community,title,content,full_text,posted_at
dcinside_남자연예인_갤러리,저주파 뉴트남 패는 뿡줌+곰젖괴 조합은 진짜 독하긔,끝까지 따라다녀,저주파 뉴트남 패는 뿡줌+곰젖괴 조합은 진짜 독하긔 끝까지 따라다녀,2025-11-23T19:46:38
dcinside_남자연예인_갤러리,민나상 도오차끄대시따하앙♡♡♡♡♡♡♡♡♡♡♡,,민나상 도오차끄대시따하앙♡♡♡♡♡♡♡♡♡♡♡,2025-11-23T19:46:34
dcinside_남자연예인_갤러리,코아픈 위버스 와주는건 필요없긔,라방을 키든가,코아픈 위버스 와주는건 필요없긔 라방을 키든가,2025-11-23T19:46:32
dcinside_남자연예인_갤러리,ㄹㅇ 군대용어란년들 진짜 한심한게,그 군대에서 한남들이 읍폭행 조롱하면서 쓴거야 어원이 군대란게 걍 말장난인거긔,ㄹㅇ 군대용어란년들 진짜 한심한게 그 군대에서 한남들이 읍폭행 조롱하면서 쓴거야 어원이 군대란게 걍 말장난인거긔,2025-11-23T19:46:30
dcinside_남자연예인_갤러리,우동사리 덬창에서 1300플 실화노?,족타쉽 오히려 관심 받았다고 좋아하겠노 ㅋㅋ,우동사리 덬창에서 1300플 실화노? 족타쉽 오히려 관심 받았다고 좋아하겠노 ㅋㅋ,2025-11-23T19:46:26
dcinside_남자연예인_갤러리,아니 겨둑이는 그 먼 한남 좆튜버도 추천하고 다녓자노,그러니까 저런 단어 평소에 쓰지,아니 겨둑이는 그 먼 한남 좆튜버도 추천하고 다녓자노 그러니까 저런 단어 평소에 쓰지,2025-11-23T19:46:22
dcinside_남자연예인_갤러리,아니 윾입창이 많은거야 치매플인거야,알못인척 연기를 하는거야,아니 윾입창이 많은거야 치매플인거야 알못인척 연기를 하는거야,2025-11-23T19:46:12
dcinside_남자연예인_갤러리,갸아악 갸아악 갸아악 갸아악갹갹갹갹 갸아악 갸악 갸악,갸아악 갸아악 갸아악갹갹갹갹 갸아악 갸아악,갸아악 갸아악 갸아악 갸아악갹갹갹갹 갸아악 갸악 갸악 갸아악 갸아악 갸아악갹갹갹갹 갸아악 갸아악,2025-11-23T19:45:59
dcinside_남자연예인_갤러리,측갑이 칼국수 해명도 진짜,그냥 안 먹어봤어요랑 모르겠어요 말 잘못 나왔었다라고 하면 될걸 저거 진짜 흐린눈 했었는데 또 발작버튼 눌리노 ://.//2818?=_9671 민지 '칼국수 논란' 억울해서 해명하지만 끝내 사과해 # #논란 #아이돌 #뉴진스 # #칼국수 #하니 #민지 .,측갑이 칼국수 해명도 진짜 그냥 안 먹어봤어요랑 모르겠어요 말 잘못 나왔었다라고 하면 될걸 저거 진짜 흐린눈 했었는데 또 발작버튼 눌리노 ://.//2818?=_9671 민지 '칼국수 논란' 억울해서 해명하지만 끝내 사과해 # #논란 #아이돌 #뉴진스 # #칼국수 #하니 #민지 .,2025-11-23T19:45:57
dcinside_남자연예인_갤러리,성적인 의미라 못쓰는거면 씨발도 쓰지마,ㅋㅋㅋ,성적인 의미라 못쓰는거면 씨발도 쓰지마 ㅋㅋㅋ,2025-11-23T19:45:49
dcinside_남자연예인_갤러리,식폭행 덕창 갔었잖아,치매야?,식폭행 덕창 갔었잖아 치매야?,2025-11-23T19:45:48
dcinside_남자연예인_갤러리,갸악 갸악 갸악 갸악 갸악 갸악 갸아악갹갹갹갹,갸악 갸악 갸악 갸악 갸악 갸악 갸악 갸악,갸악 갸악 갸악 갸악 갸악 갸악 갸아악갹갹갹갹 갸악 갸악 갸악 갸악 갸악 갸악 갸악 갸악,2025-11-23T19:45:46
dcinside_남자연예인_갤러리,저주파시녀들이 눈치없이 기습시위하니 쳐맞지,측국수플돌고있는데 갑자기 저주파뉴트남패지말라고빼액거려서,저주파시녀들이 눈치없이 기습시위하니 쳐맞지 측국수플돌고있는데 갑자기 저주파뉴트남패지말라고빼액거려서,2025-11-23T19:45:41
dcinside_남자연예인_갤러리,갸아악 갸아악 갸아악 갸아악 갸아악 갸아악,갸아악갹갹갹갹 갸아악갹갹갹갹 갸아악갹갹갹갹,갸아악 갸아악 갸아악 갸아악 갸아악 갸아악 갸아악갹갹갹갹 갸아악갹갹갹갹 갸아악갹갹갹갹,2025-11-23T19:45:34
dcinside_남자연예인_갤러리,팩트폭행은 성폭행이랑 별개로 같이 발전한 단어긔,~~폭행은 원래 배리에이션 많게 쓰였는데 식폭행은 성폭행에서 유래한거 맞아 성폭행 연상시키려는 목적으로 만들어진거긔,팩트폭행은 성폭행이랑 별개로 같이 발전한 단어긔 ~~폭행은 원래 배리에이션 많게 쓰였는데 식폭행은 성폭행에서 유래한거 맞아 성폭행 연상시키려는 목적으로 만들어진거긔,2025-11-23T19:45:33
dcinside_남자연예인_갤러리,식폭행 당했다를 직접 말함?,구라지?,식폭행 당했다를 직접 말함? 구라지?,2025-11-23T19:45:26
dcinside_남자연예인_갤러리,갸아악갹갹갹갹 갸아악 갸아악갹갹갹갹 갸아악갹갹갹갹 갸아악,갸아악갹갹갹갹 갸아악갹갹갹갹 갸아악,갸아악갹갹갹갹 갸아악 갸아악갹갹갹갹 갸아악갹갹갹갹 갸아악 갸아악갹갹갹갹 갸아악갹갹갹갹 갸아악,2025-11-23T19:45:25
dcinside_남자연예인_갤러리,아랍사는 창압홈창년들 미친거노,앱옵충한테 참수당하려고 ㄷㄷ 똠리핀은 서비스긔,아랍사는 창압홈창년들 미친거노 앱옵충한테 참수당하려고 ㄷㄷ 똠리핀은 서비스긔,2025-11-23T19:45:25
dcinside_남자연예인_갤러리,팩폭 폭행 유행할때 자리잡은거같은데 안써야겠노 ㅇㅇ,쓰지말자긔,팩폭 폭행 유행할때 자리잡은거같은데 안써야겠노 ㅇㅇ 쓰지말자긔,2025-11-23T19:45:23
dcinside_남자연예인_갤러리,우동사리 년이나 패지,왜저럴까,우동사리 년이나 패지 왜저럴까,2025-11-23T19:45:16
dcinside_남자연예인_갤러리,분명 시작은 족2였는데 어느새 저주파가 쳐맞고 있노,,분명 시작은 족2였는데 어느새 저주파가 쳐맞고 있노,2025-11-23T19:45:14
dcinside_남자연예인_갤러리,ㅇㄴㄷ 홍컨이 이쁜것 좀 보고가,,ㅇㄴㄷ 홍컨이 이쁜것 좀 보고가,2025-11-23T19:45:13
dcinside_남자연예인_갤러리,식폭행이야말로 덬창가면 핫게 도배하는거 아니노,우동사리랑 비교가 안되긔 저거 파생이 통베인데,식폭행이야말로 덬창가면 핫게 도배하는거 아니노 우동사리랑 비교가 안되긔 저거 파생이 통베인데,2025-11-23T19:45:08
dcinside_남자연예인_갤러리,아 편의점에서 생생우동이라도 사와야하나,일족이 이 개년 때문에 우동땡겨,아 편의점에서 생생우동이라도 사와야하나 일족이 이 개년 때문에 우동땡겨,2025-11-23T19:44:58
dcinside_남자연예인_갤러리,곰팡핌 일본도 곰젖괴가 판친데,이런기사 처음봐,곰팡핌 일본도 곰젖괴가 판친데 이런기사 처음봐,2025-11-23T19:44:57
dcinside_남자연예인_갤러리,ㄹㅇ 뭐가 성적인의미가 업어ㅋㅋ,쓰는 개띵잦 우동사리안든분들 한남들처럼 식폭행당햇다 ㅇㅈㄹ로 쓰자너 그거쓰는 봊들 진짜 다 거르면되긔,ㄹㅇ 뭐가 성적인의미가 업어ㅋㅋ 쓰는 개띵잦 우동사리안든분들 한남들처럼 식폭행당햇다 ㅇㅈㄹ로 쓰자너 그거쓰는 봊들 진짜 다 거르면되긔,2025-11-23T19:44:45
dcinside_남자연예인_갤러리,이거 묵대현이긔?,,이거 묵대현이긔?,2025-11-23T19:44:38
dcinside_남자연예인_갤러리,검색해봤는데 식폭행 군대가혹행위 말하는거래,군머에서 졸라 쳐먹이는 가혹행위할때 쓰는말이고 잦초단어는 맞는듯,검색해봤는데 식폭행 군대가혹행위 말하는거래 군머에서 졸라 쳐먹이는 가혹행위할때 쓰는말이고 잦초단어는 맞는듯,2025-11-23T19:44:37
dcinside_남자연예인_갤러리,와 곰젖괴들 진짜 저주파머리채잡는거봐,아무튼 2만명이 다 곰젖괴라네윤,와 곰젖괴들 진짜 저주파머리채잡는거봐 아무튼 2만명이 다 곰젖괴라네윤,2025-11-23T19:44:32
dcinside_남자연예인_갤러리,우동사리 듣보라서 묻혔노,덬창에 떠도 듣보라서 영향력 1도 없노,우동사리 듣보라서 묻혔노 덬창에 떠도 듣보라서 영향력 1도 없노,2025-11-23T19:44:24
dcinside_남자연예인_갤러리,조선일보가 식폭행 어원 밝혔노,,조선일보가 식폭행 어원 밝혔노,2025-11-23T19:44:13
dcinside_남자연예인_갤러리,족문화 솔로무대 그디어 다봤긔 ㅇㅇ 간단감상평,콘서트 곡으로는 윙족이곡이 제일 비트 괜찮고 노래자체는 여붐께 제일 좋노 음원으로 듣고 잡긔 능정린꺼는 뭔가 예전 능국노래 깔이긔 퍼퓸ㅌㅊ로 어디서 들어본곡 나머지는 평범띠 아 무을이는 갓갓노래같음,족문화 솔로무대 그디어 다봤긔 ㅇㅇ 간단감상평 콘서트 곡으로는 윙족이곡이 제일 비트 괜찮고 노래자체는 여붐께 제일 좋노 음원으로 듣고 잡긔 능정린꺼는 뭔가 예전 능국노래 깔이긔 퍼퓸ㅌㅊ로 어디서 들어본곡 나머지는 평범띠 아 무을이는 갓갓노래같음,2025-11-23T19:44:05
dcinside_남자연예인_갤러리,식폭행 저건 진짜 잘 묻힌듯,ㅇㅇ,식폭행 저건 진짜 잘 묻힌듯 ㅇㅇ,2025-11-23T19:44:01
dcinside_남자연예인_갤러리,채물빈 온니 사진첩시녀질이나 할까,이 온니 와꾸 노무 내 식이노,채물빈 온니 사진첩시녀질이나 할까 이 온니 와꾸 노무 내 식이노,2025-11-23T19:43:56
dcinside_남자연예인_갤러리,저주파 아가리로 배설을 얼마나한거야,와 진짜 새삼 슴이럴이 다패는구나싶긔 저주파 말실수의 반에반만해도 뒤지게 처맞을텐데,저주파 아가리로 배설을 얼마나한거야 와 진짜 새삼 슴이럴이 다패는구나싶긔 저주파 말실수의 반에반만해도 뒤지게 처맞을텐데,2025-11-23T19:43:45
dcinside_남자연예인_갤러리,그러게 팩폭 쓰면 안되겠노,폭력이시긔,그러게 팩폭 쓰면 안되겠노 폭력이시긔,2025-11-23T19:43:44
dcinside_남자연예인_갤러리,언노운 뜨는 이유 알았긔,위치 안뜨게 지역 대륙으로 방금 바꾸니까 언노운 뜨네 암튼 특정위치 숨기고싶어서 방금 설정 바꾼년들이긔 김치면 굳이 안바꾸겟지,언노운 뜨는 이유 알았긔 위치 안뜨게 지역 대륙으로 방금 바꾸니까 언노운 뜨네 암튼 특정위치 숨기고싶어서 방금 설정 바꾼년들이긔 김치면 굳이 안바꾸겟지,2025-11-23T19:43:36
dcinside_남자연예인_갤러리,식폭행은 시녀들도 쉴드못칠텐데 백퍼 젖괴일듯,그건 진짜 개에바야,식폭행은 시녀들도 쉴드못칠텐데 백퍼 젖괴일듯 그건 진짜 개에바야,2025-11-23T19:43:35
dcinside_남자연예인_갤러리,저주파는 살자각 이것도 있었는데,진짜 잘도 묻혔노ㅋㅋ,저주파는 살자각 이것도 있었는데 진짜 잘도 묻혔노ㅋㅋ,2025-11-23T19:43:29
dcinside_남자연예인_갤러리,족2 팀명부터 망냄새,잘가,족2 팀명부터 망냄새 잘가,2025-11-23T19:43:26
dcinside_남자연예인_갤러리,내일도 팬싸 도는 족문화 힘내시긔,,내일도 팬싸 도는 족문화 힘내시긔,2025-11-23T19:43:23
dcinside_남자연예인_갤러리,꽃밭은 어감이 예뻐서 욕같진 않고 봊도 많이쓰자너,우동사리 욕으로 쓰는 한녀 ㄹㅇ드물긔 봊초에서 검색해도 얼마안나와 저런 우악진 단어로 욕할빠에 차라리 미친년 하고말지,꽃밭은 어감이 예뻐서 욕같진 않고 봊도 많이쓰자너 우동사리 욕으로 쓰는 한녀 ㄹㅇ드물긔 봊초에서 검색해도 얼마안나와 저런 우악진 단어로 욕할빠에 차라리 미친년 하고말지,2025-11-23T19:43:16
dcinside_남자연예인_갤러리,근데 봊돌이 잦팬없는게 자랑이야?,뉴트남 성별 봊돌로서는 이상적인 성비인데 저게 까는건가 싶다,근데 봊돌이 잦팬없는게 자랑이야? 뉴트남 성별 봊돌로서는 이상적인 성비인데 저게 까는건가 싶다,2025-11-23T19:43:14
dcinside_남자연예인_갤러리,저주파젖괴 쉴드친다고 팩폭이랑 식폭행이 같대ㅋㅋㅋ,깜보디아 던져놓고싶노,저주파젖괴 쉴드친다고 팩폭이랑 식폭행이 같대ㅋㅋㅋ 깜보디아 던져놓고싶노,2025-11-23T19:42:55
dcinside_남자연예인_갤러리,어머 좀 그렇노,,어머 좀 그렇노,2025-11-23T19:42:47
dcinside_남자연예인_갤러리,아기족까 한시간 전에 보블 보고갔긔,좋은말만 해줬긔,아기족까 한시간 전에 보블 보고갔긔 좋은말만 해줬긔,2025-11-23T19:42:44
dcinside_남자연예인_갤러리,※ 환기를 시작합니다 ※,,※ 환기를 시작합니다 ※,2025-11-23T19:42:42
dcinside_남자연예인_갤러리,겨둑이 돼졌노도 영상 내려갔잖아,원본 아직있긔,겨둑이 돼졌노도 영상 내려갔잖아 원본 아직있긔,2025-11-23T19:42:39
dcinside_남자연예인_갤러리,이리랑 학치는 진짜 다시봐도 좃돌역머급탈토이긔,ㅋㅋ,이리랑 학치는 진짜 다시봐도 좃돌역머급탈토이긔 ㅋㅋ,2025-11-23T19:42:37
dcinside_남자연예인_갤러리,개뿡턱 진짜 키 좀 늘려봐,전신짤만 보면 봊식어,개뿡턱 진짜 키 좀 늘려봐 전신짤만 보면 봊식어,2025-11-23T19:42:28
dcinside_남자연예인_갤러리,식폭행은 대놓고 성폭행 언어유흰데?,젖괴야,식폭행은 대놓고 성폭행 언어유흰데? 젖괴야,2025-11-23T19:42:28
dcinside_남자연예인_갤러리,봊돌 중에 머리 나쁜 애들,여메,봊돌 중에 머리 나쁜 애들 여메,2025-11-23T19:42:14
dcinside_남자연예인_갤러리,식폭행 당했다는 ㄹㅇ 놈 역한데?,미친거아니야?,식폭행 당했다는 ㄹㅇ 놈 역한데? 미친거아니야?,2025-11-23T19:41:58
dcinside_남자연예인_갤러리,저주파 식폭행 살자말려 ㅇㅈㄹ했는데,보돕보 ㄹㅇ 거하게 받았긔 그래놓고 허구한날 보적보 호소해 미친년들,저주파 식폭행 살자말려 ㅇㅈㄹ했는데 보돕보 ㄹㅇ 거하게 받았긔 그래놓고 허구한날 보적보 호소해 미친년들,2025-11-23T19:41:58
dcinside_남자연예인_갤러리,2찍 메까가 퍼트린거 같은데,ㅇㅇ,2찍 메까가 퍼트린거 같은데 ㅇㅇ,2025-11-23T19:41:51
dcinside_남자연예인_갤러리,팩폭도 팩폭 당했다 그러는데 뭐가 문제야,겨둑이 패고싶어서 지랄하노,팩폭도 팩폭 당했다 그러는데 뭐가 문제야 겨둑이 패고싶어서 지랄하노,2025-11-23T19:41:42
dcinside_남자연예인_갤러리,진짜 개극혐이다 이러고도 안 쳐맞았노,새삼 이때 저주파 3군이었구나,진짜 개극혐이다 이러고도 안 쳐맞았노 새삼 이때 저주파 3군이었구나,2025-11-23T19:41:18
dcinside_남자연예인_갤러리,메까 극우잖아,식폭행은 기본이지,메까 극우잖아 식폭행은 기본이지,2025-11-23T19:41:14
dcinside_남자연예인_갤러리,그래서 진짜 성폭행했냐고,,그래서 진짜 성폭행했냐고,2025-11-23T19:41:08
dcinside_남자연예인_갤러리,호모계정은 거의다 이상한나라네,역시 정신병,호모계정은 거의다 이상한나라네 역시 정신병,2025-11-23T19:41:07
dcinside_남자연예인_갤러리,뿡턱이 몸 되게 잘쓰는듯,춤 생각보다 잘추노,뿡턱이 몸 되게 잘쓰는듯 춤 생각보다 잘추노,2025-11-23T19:40:54
dcinside_남자연예인_갤러리,식폭행 거기서 파생된 단어 맞지않노,그렇게 아는데 한남들 쓸때도 더럽게 썼었음,식폭행 거기서 파생된 단어 맞지않노 그렇게 아는데 한남들 쓸때도 더럽게 썼었음,2025-11-23T19:40:42
dcinside_남자연예인_갤러리,식폭행 어떻게 묻었긔,씹슴 대단하노,식폭행 어떻게 묻었긔 씹슴 대단하노,2025-11-23T19:40:33
dcinside_남자연예인_갤러리,배달 시작끄!,,배달 시작끄!,2025-11-23T19:40:30
dcinside_남자연예인_갤러리,약젠 똠리타 보다 똠스럽게 생겼노,웁스,약젠 똠리타 보다 똠스럽게 생겼노 웁스,2025-11-23T19:40:26
dcinside_남자연예인_갤러리,족2 시녀들이 전국에 8명인데 뭉치면 어쩔건데,캠핑이나 ㄱ,족2 시녀들이 전국에 8명인데 뭉치면 어쩔건데 캠핑이나 ㄱ,2025-11-23T19:40:16
dcinside_남자연예인_갤러리,갸아악갹갹갹갹 갸아악갹갹갹갹 갸아악 갸아악갹갹갹갹,갸아악갹갹갹갹 갸아악 갸아악갹갹갹갹 갸아악갹갹갹갹 갸아악갹갹갹갹 갸아악갹갹갹갹 갸아악 갸아악갹갹갹갹 갸아악갹갹갹갹 갸아악갹갹갹갹,갸아악갹갹갹갹 갸아악갹갹갹갹 갸아악 갸아악갹갹갹갹 갸아악갹갹갹갹 갸아악 갸아악갹갹갹갹 갸아악갹갹갹갹 갸아악갹갹갹갹 갸아악갹갹갹갹 갸아악 갸아악갹갹갹갹 갸아악갹갹갹갹 갸아악갹갹갹갹,2025-11-23T19:40:14
dcinside_남자연예인_갤러리,팩폭도 팩트폭행인데,팩폭 당했다는건 쳐패지도 않으면서 참,팩폭도 팩트폭행인데 팩폭 당했다는건 쳐패지도 않으면서 참,2025-11-23T19:40:13
dcinside_남자연예인_갤러리,와 족2 우동사리 발언 ㄹㅇ 선 세게 넘었네,욕 ㅈㄴ 쳐먹노,와 족2 우동사리 발언 ㄹㅇ 선 세게 넘었네 욕 ㅈㄴ 쳐먹노,2025-11-23T19:40:07
dcinside_남자연예인_갤러리,식폭행이 먼소리긔,ㅈㄱㄴ,식폭행이 먼소리긔 ㅈㄱㄴ,2025-11-23T19:39:58
dcinside_남자연예인_갤러리,봊돌들 면요리 때문에 나락가는거 존나웃겨 ㅋㅋㅋㅋ,칼국수에 우동사리에 ㅅㅂ,봊돌들 면요리 때문에 나락가는거 존나웃겨 ㅋㅋㅋㅋ 칼국수에 우동사리에 ㅅㅂ,2025-11-23T19:39:47
dcinside_남자연예인_갤러리,성폭행에서 파생되고 뭐고 진짜 성폭행하진 않았잖아,이리야,성폭행에서 파생되고 뭐고 진짜 성폭행하진 않았잖아 이리야,2025-11-23T19:39:45
dcinside_남자연예인_갤러리,아씨발 십만팔 뿡번역계 국적 ㅋㅋㅋㅋ,스리랑카띠니 ㅋㅋㅋㅋ,아씨발 십만팔 뿡번역계 국적 ㅋㅋㅋㅋ 스리랑카띠니 ㅋㅋㅋㅋ,2025-11-23T19:39:29
dcinside_남자연예인_갤러리,역시 살구는 역대 최애중 최고의 보컬이야,재환이 딕션 고쳐야 될텐데...,역시 살구는 역대 최애중 최고의 보컬이야 재환이 딕션 고쳐야 될텐데...,2025-11-23T19:39:27
dcinside_남자연예인_갤러리,"우동사리, 식폭행 두개는 ㄹㅇ한남이 쓰는 단어야",쓸거 같은도 아니고 실제로 한남들이 많이 쓰는 단어긔,"우동사리, 식폭행 두개는 ㄹㅇ한남이 쓰는 단어야 쓸거 같은도 아니고 실제로 한남들이 많이 쓰는 단어긔",2025-11-23T19:39:20
dcinside_남자연예인_갤러리,식폭행은 ㅅ이랑 폭행 조합이 노무 불미스럽긔,팩트폭행이랑 뭔 차이냐 하면 딱히 말 못하겠는데 식폭행은 그냥 더러움,식폭행은 ㅅ이랑 폭행 조합이 노무 불미스럽긔 팩트폭행이랑 뭔 차이냐 하면 딱히 말 못하겠는데 식폭행은 그냥 더러움,2025-11-23T19:38:52
dcinside_남자연예인_갤러리,약괴 자컨 좀 보는 중인데,왜 재밌노 얘네 자컨 많이 올림?,약괴 자컨 좀 보는 중인데 왜 재밌노 얘네 자컨 많이 올림?,2025-11-23T19:38:48
dcinside_남자연예인_갤러리,얼마나 개듣보면 식폭행쓰고 묻혔노,새삼 민줌이 쏴주기전까지 저주파 3군이었던거 실감나,얼마나 개듣보면 식폭행쓰고 묻혔노 새삼 민줌이 쏴주기전까지 저주파 3군이었던거 실감나,2025-11-23T19:38:42
dcinside_남자연예인_갤러리,능아픈 아직 김치활동 하는군아,좆튭 알고리즘 떠서 라디오 나온거 봤는데 진작 김치머뷔하지,능아픈 아직 김치활동 하는군아 좆튭 알고리즘 떠서 라디오 나온거 봤는데 진작 김치머뷔하지,2025-11-23T19:38:34
dcinside_남자연예인_갤러리,족2 저걸로 시녀들 뭉친거면,나쁠거 없는거 아니노,족2 저걸로 시녀들 뭉친거면 나쁠거 없는거 아니노,2025-11-23T19:38:25
dcinside_남자연예인_갤러리,저 단어 귤 존나 먹이는거 읍동에서 파생된거 아님?,그런걸로 아는데,저 단어 귤 존나 먹이는거 읍동에서 파생된거 아님? 그런걸로 아는데,2025-11-23T19:38:06
dcinside_남자연예인_갤러리,족문화에서 능정린이 제일 몸매 좋은것같긔,골반도 있고 팔다리 존나 길던데,족문화에서 능정린이 제일 몸매 좋은것같긔 골반도 있고 팔다리 존나 길던데,2025-11-23T19:38:05
dcinside_남자연예인_갤러리,젖괴챙년들 역류기도 못돌리고 손도배하는거 개쳐웃겨,이 섬섬옥수같은 손으로 일일이 치고있을거 아니긔,젖괴챙년들 역류기도 못돌리고 손도배하는거 개쳐웃겨 이 섬섬옥수같은 손으로 일일이 치고있을거 아니긔,2025-11-23T19:38:01
dcinside_남자연예인_갤러리,식폭행 잦돌이 했으면 그날로 탈퇴,ㅇㅇ,식폭행 잦돌이 했으면 그날로 탈퇴 ㅇㅇ,2025-11-23T19:38:01
dcinside_남자연예인_갤러리,족타쉽 저렇게 해서 그국적여성 띄웠잖아,ㅇㅇ,족타쉽 저렇게 해서 그국적여성 띄웠잖아 ㅇㅇ,2025-11-23T19:37:43
dcinside_남자연예인_갤러리,까이는걸로 바이럴하는것도 윙족이 딸기같은거나 먹히지,우동사리는 진짜 머가리 비어보이는데 설마,까이는걸로 바이럴하는것도 윙족이 딸기같은거나 먹히지 우동사리는 진짜 머가리 비어보이는데 설마,2025-11-23T19:37:33
dcinside_남자연예인_갤러리,아오 8,윤 벌레새끼 ㅚ생명체 王대갈통,아오 8 윤 벌레새끼 ㅚ생명체 王대갈통,2025-11-23T19:37:19
dcinside_남자연예인_갤러리,식폭행은 누가봐도 성폭행에서 파생된거라,ㅈㄴ불쾌함 젖괴들이 쉴드친다고 가져온 팩트폭행은 팩트로 후드려팬다 이러니까 팩트폭행 ㅇㅈㄹ하는거고 성폭행에서 따온게 아니잖아,식폭행은 누가봐도 성폭행에서 파생된거라 ㅈㄴ불쾌함 젖괴들이 쉴드친다고 가져온 팩트폭행은 팩트로 후드려팬다 이러니까 팩트폭행 ㅇㅈㄹ하는거고 성폭행에서 따온게 아니잖아,2025-11-23T19:37:17
dcinside_남자연예인_갤러리,멜뮤 티켓팅 빡세노?,ㅅㅂ이거 때문에 1년동안 이용권 유지했는데 팡탈되면 ㅈ같을거같긔,멜뮤 티켓팅 빡세노? ㅅㅂ이거 때문에 1년동안 이용권 유지했는데 팡탈되면 ㅈ같을거같긔,2025-11-23T19:37:13
dcinside_남자연예인_갤러리,겨둑이는 머리가 꽃밭드립 쳤는데,우동사리랑 같은거 아님?,겨둑이는 머리가 꽃밭드립 쳤는데 우동사리랑 같은거 아님?,2025-11-23T19:37:01
dcinside_남자연예인_갤러리,근데 뉴트남 이거 뭐가 패륜적인거긔,곰팡핌이랑 뉴트남이 진짜 자매였어? 그것도아니고 무슨 패륜적이란거긔,근데 뉴트남 이거 뭐가 패륜적인거긔 곰팡핌이랑 뉴트남이 진짜 자매였어? 그것도아니고 무슨 패륜적이란거긔,2025-11-23T19:37:01
dcinside_남자연예인_갤러리,좆타쉽 저 바이럴이 통할줄 아는게 어이가 없긔,똥꼬쇼하노,좆타쉽 저 바이럴이 통할줄 아는게 어이가 없긔 똥꼬쇼하노,2025-11-23T19:36:53
dcinside_남자연예인_갤러리,짭판 개훈 존나닮은거같긔,헷갈려,짭판 개훈 존나닮은거같긔 헷갈려,2025-11-23T19:36:48
dcinside_남자연예인_갤러리,여메는 쌍도 출신도 아닌데 노체 쓰던데,통베긔?,여메는 쌍도 출신도 아닌데 노체 쓰던데 통베긔?,2025-11-23T19:36:39
dcinside_남자연예인_갤러리,짹창 아기족2 시녀들 공격성 올라갔긔,알계년 아무일 아닌척 애들 보러 기어나오면 패버린대,짹창 아기족2 시녀들 공격성 올라갔긔 알계년 아무일 아닌척 애들 보러 기어나오면 패버린대,2025-11-23T19:36:17
dcinside_남자연예인_갤러리,저주파크트 “잦돌이나 패 잦돌패자 얼른”,ㅇㅇ,저주파크트 “잦돌이나 패 잦돌패자 얼른” ㅇㅇ,2025-11-23T19:36:17
dcinside_남자연예인_갤러리,그럼 식폭행 가서 니가 패던지,아 존나 주절거려 씨발,그럼 식폭행 가서 니가 패던지 아 존나 주절거려 씨발,2025-11-23T19:36:13
dcinside_남자연예인_갤러리,족2 쳐맞는거 보고 느낀게,봊돌병크는 진짜 잦돌에 비하면 아무것도 아니구나,족2 쳐맞는거 보고 느낀게 봊돌병크는 진짜 잦돌에 비하면 아무것도 아니구나,2025-11-23T19:36:09
dcinside_남자연예인_갤러리,비빡이는 냥부이 창꾹이는 겨둑이,좋아하는거같긔 사귈지는 몰루 곰팡핌은 노무 안사귈거같으셔,비빡이는 냥부이 창꾹이는 겨둑이 좋아하는거같긔 사귈지는 몰루 곰팡핌은 노무 안사귈거같으셔,2025-11-23T19:36:03
dcinside_남자연예인_갤러리,재밌는데 똥주파 젖괴야?,좀 나가,재밌는데 똥주파 젖괴야? 좀 나가,2025-11-23T19:35:52
dcinside_남자연예인_갤러리,족2 알계가 뭔 너무 욕먹어서 삭제해 ㅋㅋㅋㅋㅋ,좆타쉽이 계정팠다 지운런데,족2 알계가 뭔 너무 욕먹어서 삭제해 ㅋㅋㅋㅋㅋ 좆타쉽이 계정팠다 지운런데,2025-11-23T19:35:46
dcinside_남자연예인_갤러리,저주파 똠젖괴들 잦돌 플 시작!,ㅋㅋ,저주파 똠젖괴들 잦돌 플 시작! ㅋㅋ,2025-11-23T19:35:36
