community,title,content,full_text,posted_at
dcinside_리그오브레전드_갤러리,근데 한화는 누가 주장임?,리핏 파엠 제우스 국가대표 원툴 좆퇴물 벨베스 휘적휘적 원툴 카나비 월즈+ 나름 기둥인 제카 쓰리핏 파엠 구마 딜라,근데 한화는 누가 주장임? 리핏 파엠 제우스 국가대표 원툴 좆퇴물 벨베스 휘적휘적 원툴 카나비 월즈+ 나름 기둥인 제카 쓰리핏 파엠 구마 딜라,2025-11-23T17:27:14
dcinside_리그오브레전드_갤러리,와 근데 진짜 티원 페이즈 오피셜 나자마자,구좆 어디 가는지는 아무도 개조또 관심을 안가지네... 결국 얘갈 숙주였던 것인가..,와 근데 진짜 티원 페이즈 오피셜 나자마자 구좆 어디 가는지는 아무도 개조또 관심을 안가지네... 결국 얘갈 숙주였던 것인가..,2025-11-23T17:27:00
dcinside_리그오브레전드_갤러리,손흥민 인생 유나랑 결혼,전자는 뉴턴이 지금의 인류 문명을 진화시킨 영향을 지금 물리판으로 모조리 환산한 가치이고 후자의 완벽 이상형은 나임,손흥민 인생 유나랑 결혼 전자는 뉴턴이 지금의 인류 문명을 진화시킨 영향을 지금 물리판으로 모조리 환산한 가치이고 후자의 완벽 이상형은 나임,2025-11-23T17:26:53
dcinside_리그오브레전드_갤러리,돌풍 부활시키면 구마 역체원 맞는데,돌풍 다시 만들고 구마를 역체원으로 ㄱ,돌풍 부활시키면 구마 역체원 맞는데 돌풍 다시 만들고 구마를 역체원으로 ㄱ,2025-11-23T17:26:54
dcinside_리그오브레전드_갤러리,티원은 이번에도 부품갈고 리그우승못하면,내년은 푹자다 월즈만보는게 맞다 걍 연이없는거임,티원은 이번에도 부품갈고 리그우승못하면 내년은 푹자다 월즈만보는게 맞다 걍 연이없는거임,2025-11-23T17:26:51
dcinside_리그오브레전드_갤러리,나이먹고 점점 고립되는게 느껴지노,앱솔루트 시네마인지 머시긴지 모르겠네 내가 유튜브를 안보니까 더더욱 그런거도 있긴하다만 나도 나이 더 먹으면 그때 세대들한테 영포티 취급받겠지? 물론 까마득한 일이긴 함,나이먹고 점점 고립되는게 느껴지노 앱솔루트 시네마인지 머시긴지 모르겠네 내가 유튜브를 안보니까 더더욱 그런거도 있긴하다만 나도 나이 더 먹으면 그때 세대들한테 영포티 취급받겠지? 물론 까마득한 일이긴 함,2025-11-23T17:26:49
dcinside_리그오브레전드_갤러리,아니 ㅅㅂ물로켓이후로 쵸비가 다월즈우승시켜준거 맞잖아,쵸비옆에서 범인몰이 당하면서 고생좀하고 나가면 바로 월즈우승 별달아줌<<이거 8년째 하는중 쵸른의 걸작 신통하면 개추ㅋㅋ,아니 ㅅㅂ물로켓이후로 쵸비가 다월즈우승시켜준거 맞잖아 쵸비옆에서 범인몰이 당하면서 고생좀하고 나가면 바로 월즈우승 별달아줌<<이거 8년째 하는중 쵸른의 걸작 신통하면 개추ㅋㅋ,2025-11-23T17:26:35
dcinside_리그오브레전드_갤러리,카나비 <- 오너한테도 동선 닦임,걍 노답임,카나비 <- 오너한테도 동선 닦임 걍 노답임,2025-11-23T17:26:34
dcinside_리그오브레전드_갤러리,롤잘알들만 월즈에서만 카나비 봤는데 카나비가 오너 캐니언급임?,리그는 한번 안봄 근데 월즈에서 맨날 오너 캐니언한테 발리던데 오너 캐니언급임?,롤잘알들만 월즈에서만 카나비 봤는데 카나비가 오너 캐니언급임? 리그는 한번 안봄 근데 월즈에서 맨날 오너 캐니언한테 발리던데 오너 캐니언급임?,2025-11-23T17:26:22
dcinside_리그오브레전드_갤러리,카나비면 무조건 업글이지 ㅋㅋㅋㅋ,ㄹㅇ,카나비면 무조건 업글이지 ㅋㅋㅋㅋ ㄹㅇ,2025-11-23T17:26:21
dcinside_리그오브레전드_갤러리,한화 오피셜 영상 지리네 ㅋㅋㅋ,ㅋㅋㅋ 개지리노,한화 오피셜 영상 지리네 ㅋㅋㅋ ㅋㅋㅋ 개지리노,2025-11-23T17:26:17
dcinside_리그오브레전드_갤러리,결국 한화는 제카 딜라 << 얘네 때문에 안됨,얘네 둘 때문에 티젠한테 발리게 되어있음 카나비도 솔직히 티젠 상대로 월즈에서 버로우 ㅈㄴ 타는 스타일이고 ㅇㅇ,결국 한화는 제카 딜라 << 얘네 때문에 안됨 얘네 둘 때문에 티젠한테 발리게 되어있음 카나비도 솔직히 티젠 상대로 월즈에서 버로우 ㅈㄴ 타는 스타일이고 ㅇㅇ,2025-11-23T17:26:14
dcinside_리그오브레전드_갤러리,미필국대뽑으면,기인 오너 비디디 바이퍼 카엘 서브 캐니언 맞나?,미필국대뽑으면 기인 오너 비디디 바이퍼 카엘 서브 캐니언 맞나?,2025-11-23T17:26:11
dcinside_리그오브레전드_갤러리,칰감독 모글리라며? 그럼 겜 끝난거 아님?,기대 하나도 안되는데 벤픽 순수재미는 있겠다,칰감독 모글리라며? 그럼 겜 끝난거 아님? 기대 하나도 안되는데 벤픽 순수재미는 있겠다,2025-11-23T17:26:04
dcinside_리그오브레전드_갤러리,와 한화 오피셜 지리네 ㅋㅋㅋㅋ마이웨이로 카정가잨ㅋㅋ,이번 건 맘에 듦,와 한화 오피셜 지리네 ㅋㅋㅋㅋ마이웨이로 카정가잨ㅋㅋ 이번 건 맘에 듦,2025-11-23T17:26:01
dcinside_리그오브레전드_갤러리,근데 한화<-얘네는 영입을 아무리해도 8강하는게신기,올해멤버도 8강에서 멈출거같음 왠지,근데 한화<-얘네는 영입을 아무리해도 8강하는게신기 올해멤버도 8강에서 멈출거같음 왠지,2025-11-23T17:26:00
dcinside_리그오브레전드_갤러리,쓰리핏 원딜이 대장이지 ㅇㅇ,ㅇㅋㅋㅋㅋㅌ,쓰리핏 원딜이 대장이지 ㅇㅇ ㅇㅋㅋㅋㅋㅌ,2025-11-23T17:25:44
dcinside_리그오브레전드_갤러리,피시방 드가자,드가자!!!,피시방 드가자 드가자!!!,2025-11-23T17:25:36
dcinside_리그오브레전드_갤러리,로프유시몬을 석방하라,ㅇㅈ하면 개추,로프유시몬을 석방하라 ㅇㅈ하면 개추,2025-11-23T17:25:32
dcinside_리그오브레전드_갤러리,똥칰은 원거리 없고,라인지우개가 있는팀임 ㅋㅋㅋㅋㅋ,똥칰은 원거리 없고 라인지우개가 있는팀임 ㅋㅋㅋㅋㅋ,2025-11-23T17:25:30
dcinside_리그오브레전드_갤러리,한화 전력은 비슷해보이는데 기대치는 더 떨어진듯,제카 딜라가 맛간거 들켜서,한화 전력은 비슷해보이는데 기대치는 더 떨어진듯 제카 딜라가 맛간거 들켜서,2025-11-23T17:25:30
dcinside_리그오브레전드_갤러리,와 한화는 진짜 징하네 아직도 오피셜 안냄?,이새끼들 대체 뭐하는데 시발 뭐 해외로케가서 영입 영상찍음? 대체 뭔데 시발거,와 한화는 진짜 징하네 아직도 오피셜 안냄? 이새끼들 대체 뭐하는데 시발 뭐 해외로케가서 영입 영상찍음? 대체 뭔데 시발거,2025-11-23T17:25:10
dcinside_리그오브레전드_갤러리,"오피셜) 한화생명, 26년 그랜드 슬램 예정",ㅁㄴㅇㅁㅈㅁㄴㅁㄴㅁㄴㅇ,"오피셜) 한화생명, 26년 그랜드 슬램 예정 ㅁㄴㅇㅁㅈㅁㄴㅁㄴㅁㄴㅇ",2025-11-23T17:25:09
dcinside_리그오브레전드_갤러리,류감독이나 꼬마가 1 업그레이드라하면 뭐 그러구나 하는데,페이즈 부산물의 부산물 원딜쓰는 담원 전과자 감독께서 다른 그룹 팀이 업그레이드니 뭐니 하는게 존나 웃기네요 페이즈랑 같은 팀에서도 불화인지 폭행인지로 상호해지 된걸로 아는데,류감독이나 꼬마가 1 업그레이드라하면 뭐 그러구나 하는데 페이즈 부산물의 부산물 원딜쓰는 담원 전과자 감독께서 다른 그룹 팀이 업그레이드니 뭐니 하는게 존나 웃기네요 페이즈랑 같은 팀에서도 불화인지 폭행인지로 상호해지 된걸로 아는데,2025-11-23T17:25:06
dcinside_리그오브레전드_갤러리,ㅋㅋ 구마 주인공 취급해주다 팀 날아가는꼴 보게될듯,걔 주인공 취급해주면 팀 먹으려 듬,ㅋㅋ 구마 주인공 취급해주다 팀 날아가는꼴 보게될듯 걔 주인공 취급해주면 팀 먹으려 듬,2025-11-23T17:24:58
dcinside_리그오브레전드_갤러리,피넛 뭔가 군대해결하고 또 현역복귀노리는느낌임,송별회 행사도 한화가 해준다는거 정중하게 거절했다더라 근데 다시 와도 가능해보이긴함 ㅋㅋㅋㅋㅋㅋㅋㅋㅋㅋㅋㅋㅋㅋㅋ,피넛 뭔가 군대해결하고 또 현역복귀노리는느낌임 송별회 행사도 한화가 해준다는거 정중하게 거절했다더라 근데 다시 와도 가능해보이긴함 ㅋㅋㅋㅋㅋㅋㅋㅋㅋㅋㅋㅋㅋㅋㅋ,2025-11-23T17:24:56
dcinside_리그오브레전드_갤러리,내년 아겜 못가면 입대해야되는게..,리헨즈가 내년이 라스트댄스니까 01까지는 무조건 가야되는듯??,내년 아겜 못가면 입대해야되는게.. 리헨즈가 내년이 라스트댄스니까 01까지는 무조건 가야되는듯??,2025-11-23T17:24:26
dcinside_리그오브레전드_갤러리,솔찍히 티원 리그 기대함?,슥갈들 진지하게 궁금함 간신히 4시드 갔는데 더 너프됬잖아,솔찍히 티원 리그 기대함? 슥갈들 진지하게 궁금함 간신히 4시드 갔는데 더 너프됬잖아,2025-11-23T17:24:19
dcinside_리그오브레전드_갤러리,정보: 감코는 셀캡안들어가서 오히려 구마유시보다 연봉많이받을걸,티원감코가 ㅋㅋ 김정균연봉ㅈㄴ높음 톰도 아마 ㅈㄴ높을거고 ㅋㅋ,정보: 감코는 셀캡안들어가서 오히려 구마유시보다 연봉많이받을걸 티원감코가 ㅋㅋ 김정균연봉ㅈㄴ높음 톰도 아마 ㅈㄴ높을거고 ㅋㅋ,2025-11-23T17:24:06
dcinside_리그오브레전드_갤러리,톰은 중국가서 스위프트 정치질에 커리어 쫑난거 아님?,난 벵기보단 톰이 좋았는데,톰은 중국가서 스위프트 정치질에 커리어 쫑난거 아님? 난 벵기보단 톰이 좋았는데,2025-11-23T17:24:00
dcinside_리그오브레전드_갤러리,페이즈 작년 리그 국제전 성적 한번 알아보자,스플릿 1 탈락 스플릿 2 탈락 스플릿 3 탈락 월즈 예선 탈락 롤로파 조별 꼴찌 탈락 그만 알아보자,페이즈 작년 리그 국제전 성적 한번 알아보자 스플릿 1 탈락 스플릿 2 탈락 스플릿 3 탈락 월즈 예선 탈락 롤로파 조별 꼴찌 탈락 그만 알아보자,2025-11-23T17:23:55
dcinside_리그오브레전드_갤러리,지금 쵸비 한화가면 롤드컵우승가능할듯,제우스 카나비 쵸비 구마유시 딜라 ㄷ. 딜라빼고 완벽하네,지금 쵸비 한화가면 롤드컵우승가능할듯 제우스 카나비 쵸비 구마유시 딜라 ㄷ. 딜라빼고 완벽하네,2025-11-23T17:23:48
dcinside_리그오브레전드_갤러리,#4 (카나비 영상),,#4 (카나비 영상),2025-11-23T17:23:47
dcinside_리그오브레전드_갤러리,슼갈들 근데 지금이야 뒷난 빨아줘도,방출 당하면 바로 슼디르로 변신해서 아 그 뒷담까던 새끼? 잘됐지 어차피 폼 다 죽었음 무조건 대체 가능함 ㄱㅊㄱㅊ 하고 말 바꿀거 뻔함 이런 새끼들임 ㅋㅋㅋㅋㅋ 누누히 말하지만 얘네 팀원평가 척도가 충성도가 1순위지 나간 순간 바로 조리돌림 시전임 ㅋㅋ 왜 아냐고? 내가 흑화 슼갈이라 ㅋㅋㅋㅋ,슼갈들 근데 지금이야 뒷난 빨아줘도 방출 당하면 바로 슼디르로 변신해서 아 그 뒷담까던 새끼? 잘됐지 어차피 폼 다 죽었음 무조건 대체 가능함 ㄱㅊㄱㅊ 하고 말 바꿀거 뻔함 이런 새끼들임 ㅋㅋㅋㅋㅋ 누누히 말하지만 얘네 팀원평가 척도가 충성도가 1순위지 나간 순간 바로 조리돌림 시전임 ㅋㅋ 왜 아냐고? 내가 흑화 슼갈이라 ㅋㅋㅋㅋ,2025-11-23T17:23:42
dcinside_리그오브레전드_갤러리,갈드컵 거르고 어디가 더 세보임?,ㄷㅈ ㄷㅎ,갈드컵 거르고 어디가 더 세보임? ㄷㅈ ㄷㅎ,2025-11-23T17:23:18
dcinside_리그오브레전드_갤러리,한화생명 베트남 사업해서 팬 많더라,그래서 매년 행사 가던데,한화생명 베트남 사업해서 팬 많더라 그래서 매년 행사 가던데,2025-11-23T17:23:07
dcinside_리그오브레전드_갤러리,카나비 잘하면 재밌을텐데,왤케 욕 먹고있을거 같지 정글러라 살인당할거 생각하면..,카나비 잘하면 재밌을텐데 왤케 욕 먹고있을거 같지 정글러라 살인당할거 생각하면..,2025-11-23T17:23:07
dcinside_리그오브레전드_갤러리,구마유시 <= 이번 한화생명 영입의 주인공 ㅋㅋㅋ 지렸다,,구마유시 <= 이번 한화생명 영입의 주인공 ㅋㅋㅋ 지렸다,2025-11-23T17:22:59
dcinside_리그오브레전드_갤러리,씨맥이 내년 티원 너무 쎌거같다는데,업글이라는거임?,씨맥이 내년 티원 너무 쎌거같다는데 업글이라는거임?,2025-11-23T17:22:54
dcinside_리그오브레전드_갤러리,"코.인, 타""점.매'니.저├",52 *타 점 차 트 드 로 잉 시 그 널 가 입 *거 래 소 가 입 비 트 겟 거 래 소 가 입 *,"코.인, 타""점.매'니.저├ 52 *타 점 차 트 드 로 잉 시 그 널 가 입 *거 래 소 가 입 비 트 겟 거 래 소 가 입 *",2025-11-23T17:22:53
dcinside_리그오브레전드_갤러리,근데 카나비도 속상하겠다 무슨 피넛에 영상이 포커싱되있노,ㅋㅋㅋㅋㅋㅋㅋㅋㅋ,근데 카나비도 속상하겠다 무슨 피넛에 영상이 포커싱되있노 ㅋㅋㅋㅋㅋㅋㅋㅋㅋ,2025-11-23T17:22:53
dcinside_리그오브레전드_갤러리,구마 라인전센것도 23년까지지,24년도 라딸조합으로 페리한테 발리고 25년은 때 한화전 한판이긴거빼고 중요경기 젠지전 룰러듀로한테 발린기억뿐 그냥 딱 라인전승률 50프로임 발리면 탑으로 튀어서 15분 골드 세탁하고,구마 라인전센것도 23년까지지 24년도 라딸조합으로 페리한테 발리고 25년은 때 한화전 한판이긴거빼고 중요경기 젠지전 룰러듀로한테 발린기억뿐 그냥 딱 라인전승률 50프로임 발리면 탑으로 튀어서 15분 골드 세탁하고,2025-11-23T17:22:49
dcinside_리그오브레전드_갤러리,케리아 표정 포텐갔다길래 팝콘뜯으러 갔는데,댓글에 발작하는 년들 ㅈㄴ 많아서 ㅈㄴ 웃기네ㅋㅋㅋ,케리아 표정 포텐갔다길래 팝콘뜯으러 갔는데 댓글에 발작하는 년들 ㅈㄴ 많아서 ㅈㄴ 웃기네ㅋㅋㅋ,2025-11-23T17:22:47
dcinside_리그오브레전드_갤러리,구까들도 인정해야함 구마유시 못하지는 않음,딱 10억 언더로 주고 쓰기 좋은 원딜인거지 룰러 바이퍼가 10억 언더였으면 구마유시는 3년전에 방출됨 그래서 10억언더 페이즈 풀리지마자 쫒겨난거고,구까들도 인정해야함 구마유시 못하지는 않음 딱 10억 언더로 주고 쓰기 좋은 원딜인거지 룰러 바이퍼가 10억 언더였으면 구마유시는 3년전에 방출됨 그래서 10억언더 페이즈 풀리지마자 쫒겨난거고,2025-11-23T17:22:47
dcinside_리그오브레전드_갤러리,근데 장기대기 뭐냐 이거 몇몇선수 몸둥아리 문제없는데,군대ㅔ안가는 새끼 몇있던데 리치라던가,근데 장기대기 뭐냐 이거 몇몇선수 몸둥아리 문제없는데 군대ㅔ안가는 새끼 몇있던데 리치라던가,2025-11-23T17:22:39
dcinside_리그오브레전드_갤러리,칰런트인데 오늘 8시반 구마 오피셜임,,칰런트인데 오늘 8시반 구마 오피셜임,2025-11-23T17:22:32
dcinside_리그오브레전드_갤러리,마지막으로 구마유시 오피셜 가자,손가락 3개 피고 3년계약 선언 가즈앗,마지막으로 구마유시 오피셜 가자 손가락 3개 피고 3년계약 선언 가즈앗,2025-11-23T17:22:30
dcinside_리그오브레전드_갤러리,씨맥)팀들 전반적으로 다 업그레이드다ㅋㅋㅋㅋㅋㅋㅋㅋㅋㅋㅋㅋㅋㅋㅋㅋ,페>>구>>바 롤은 못해도 선수보는 눈은 정확한 새끼ㅋㅋㅋㅋㅋㅋㅋㅋㅋㅋㅋㅋㅋㅋㅋㅋㅋㅋㅋㅋㅋㅋㅋㅋㅋㅋㅋㅋㅋㅋㅋㅋ,씨맥)팀들 전반적으로 다 업그레이드다ㅋㅋㅋㅋㅋㅋㅋㅋㅋㅋㅋㅋㅋㅋㅋㅋ 페>>구>>바 롤은 못해도 선수보는 눈은 정확한 새끼ㅋㅋㅋㅋㅋㅋㅋㅋㅋㅋㅋㅋㅋㅋㅋㅋㅋㅋㅋㅋㅋㅋㅋㅋㅋㅋㅋㅋㅋㅋㅋㅋ,2025-11-23T17:22:28
dcinside_리그오브레전드_갤러리,근데 한화는 왜 저렇게 선수영입 늦게 발표함?,점점 스토브 뽕이 다 식어가는거같은데,근데 한화는 왜 저렇게 선수영입 늦게 발표함? 점점 스토브 뽕이 다 식어가는거같은데,2025-11-23T17:22:15
dcinside_리그오브레전드_갤러리,피넛 이름은 왜 계속 보여준건데,같이 보다가 피넛 코치로 오나 설레발친 내 친구 운다 후임자가 카나비인건 아는데 왜 얘만 캠프원에서 찍냐 컨셉 바뀌니 철학을 모르겠네,피넛 이름은 왜 계속 보여준건데 같이 보다가 피넛 코치로 오나 설레발친 내 친구 운다 후임자가 카나비인건 아는데 왜 얘만 캠프원에서 찍냐 컨셉 바뀌니 철학을 모르겠네,2025-11-23T17:22:03
dcinside_리그오브레전드_갤러리,근데 피넛<-은퇴식 왜 한화에서 안하냐??,설마 1년있었는데 티원에서 하냐?,근데 피넛<-은퇴식 왜 한화에서 안하냐?? 설마 1년있었는데 티원에서 하냐?,2025-11-23T17:22:03
dcinside_리그오브레전드_갤러리,듀로 누구닮았나했더니,한덕수 ㅈㄴ 닮았네 롤준석에 이은 롤덕수 ㄷㄷ,듀로 누구닮았나했더니 한덕수 ㅈㄴ 닮았네 롤준석에 이은 롤덕수 ㄷㄷ,2025-11-23T17:21:58
dcinside_리그오브레전드_갤러리,꼬마 톰은 연봉 얼마정도임??,연봉 1.5억 오바 언더?,꼬마 톰은 연봉 얼마정도임?? 연봉 1.5억 오바 언더?,2025-11-23T17:21:48
dcinside_리그오브레전드_갤러리,한화 응우옌 팬 많았음?,댓글 대부분이던데 ㅋㅋ,한화 응우옌 팬 많았음? 댓글 대부분이던데 ㅋㅋ,2025-11-23T17:21:19
dcinside_리그오브레전드_갤러리,구마유시는 걍 못해서 1에 맞게 개조된거지,포장할게있나 한타를 너무 못함,구마유시는 걍 못해서 1에 맞게 개조된거지 포장할게있나 한타를 너무 못함,2025-11-23T17:21:18
dcinside_리그오브레전드_갤러리,걍 도란은 티원 종신확정같은데ㅋㅋㅋㅋㅋㅋ,,걍 도란은 티원 종신확정같은데ㅋㅋㅋㅋㅋㅋ,2025-11-23T17:21:07
dcinside_리그오브레전드_갤러리,법무법인 실시간기자...,,법무법인 실시간기자...,2025-11-23T17:21:02
dcinside_리그오브레전드_갤러리,내일 바로 5번 구마유시 나오냐 ㅋㅋㅋㅋ,?_?,내일 바로 5번 구마유시 나오냐 ㅋㅋㅋㅋ ?_?,2025-11-23T17:20:49
dcinside_리그오브레전드_갤러리,피넛에서 카나비 역대급 너프 ㅋㅋㅋ,작년 재키 369빼고 다 개 ㅄ들인데 ㅋㅋ 이걸 사오노 ㅋㅋㅋㅋㅋㅋ,피넛에서 카나비 역대급 너프 ㅋㅋㅋ 작년 재키 369빼고 다 개 ㅄ들인데 ㅋㅋ 이걸 사오노 ㅋㅋㅋㅋㅋㅋ,2025-11-23T17:20:46
dcinside_리그오브레전드_갤러리,카나비 올해 정규시즌 퍼스트 정글러,ㅇ,카나비 올해 정규시즌 퍼스트 정글러 ㅇ,2025-11-23T17:20:44
dcinside_리그오브레전드_갤러리,씨맥>>> 이번 스토브 티원은 업그레이드다,페이즈는 신이였다 실제로 한말임,씨맥>>> 이번 스토브 티원은 업그레이드다 페이즈는 신이였다 실제로 한말임,2025-11-23T17:20:41
dcinside_리그오브레전드_갤러리,설마 진짜 카나비 닉이 이거임? ㅋㅋ,좆구리노,설마 진짜 카나비 닉이 이거임? ㅋㅋ 좆구리노,2025-11-23T17:20:37
dcinside_리그오브레전드_갤러리,한화가 구마 주인공대접 해주노,ㅋㅋㅋ크,한화가 구마 주인공대접 해주노 ㅋㅋㅋ크,2025-11-23T17:20:25
dcinside_리그오브레전드_갤러리,_ <---- 이 새끼,이새끼 누구냐? 개발자 짤린년이 ㅈㄴ 나대네,_ <---- 이 새끼 이새끼 누구냐? 개발자 짤린년이 ㅈㄴ 나대네,2025-11-23T17:20:25
dcinside_리그오브레전드_갤러리,근데 ㄹㅇ 롤갤 응갤 다 됐음 구마유시 ㅈ도 안 궁금하니까,언급 자제좀;,근데 ㄹㅇ 롤갤 응갤 다 됐음 구마유시 ㅈ도 안 궁금하니까 언급 자제좀;,2025-11-23T17:20:24
dcinside_리그오브레전드_갤러리,젠첩들 다 어디갔냐,언제 응줌한테 점령당한거냐?,젠첩들 다 어디갔냐 언제 응줌한테 점령당한거냐?,2025-11-23T17:20:23
dcinside_리그오브레전드_갤러리,상체가 재앙스 준끄바 윤카 ㅋㅋㅋ,대통합,상체가 재앙스 준끄바 윤카 ㅋㅋㅋ 대통합,2025-11-23T17:20:22
dcinside_리그오브레전드_갤러리,똥칰은 롤에서도 돈지랄이네 ㅋㅋㅋ,빠따도 그렇고 롤도 이새끼들이 연봉거품 만드는 1등공신,똥칰은 롤에서도 돈지랄이네 ㅋㅋㅋ 빠따도 그렇고 롤도 이새끼들이 연봉거품 만드는 1등공신,2025-11-23T17:20:17
dcinside_리그오브레전드_갤러리,카나비 오피셜 떴네,내년 티원은 그냥 뒤지게 쳐맞는다고 보면 된다,카나비 오피셜 떴네 내년 티원은 그냥 뒤지게 쳐맞는다고 보면 된다,2025-11-23T17:20:09
dcinside_리그오브레전드_갤러리,제미나이 념글 엄청 웃기네 ㅋㅋㅋㅋㅋ,(당뇨걸려뒤짐) ㅋㅋㅋ,제미나이 념글 엄청 웃기네 ㅋㅋㅋㅋㅋ (당뇨걸려뒤짐) ㅋㅋㅋ,2025-11-23T17:20:06
dcinside_리그오브레전드_갤러리,그럴리는 없겠지만 만약에 페이커가 한화 이적하게되면?,영상 어떻게 만들어줄지 궁금함,그럴리는 없겠지만 만약에 페이커가 한화 이적하게되면? 영상 어떻게 만들어줄지 궁금함,2025-11-23T17:20:06
dcinside_리그오브레전드_갤러리,ㅅㅅㅅㅅ피넛아니라 다행이노 ㄹㅇㅋㅋㅋㅋㅋㅋㅋㅋㅋㅋㅋ,ㅋㅋㅋㅋㅋㅋㅋㅋㅋㅋㅋㅋㅋㅋㅋㅋㅋㅋㅋㅋㅋㅋㅋㅋㅋㅋㅋㅋㅋㄹㅇ,ㅅㅅㅅㅅ피넛아니라 다행이노 ㄹㅇㅋㅋㅋㅋㅋㅋㅋㅋㅋㅋㅋ ㅋㅋㅋㅋㅋㅋㅋㅋㅋㅋㅋㅋㅋㅋㅋㅋㅋㅋㅋㅋㅋㅋㅋㅋㅋㅋㅋㅋㅋㄹㅇ,2025-11-23T17:20:03
dcinside_리그오브레전드_갤러리,똥트남 애들 사이에서 유행하는거 솔직히 기분 불쾌함,하필 좋아해도 냄새나는 후진국 싸개년들이...,똥트남 애들 사이에서 유행하는거 솔직히 기분 불쾌함 하필 좋아해도 냄새나는 후진국 싸개년들이...,2025-11-23T17:19:59
dcinside_리그오브레전드_갤러리,한화 영상 맛있네 그냥 오피셜글 띡 올리는거보다,캬 소리 나오게만드노,한화 영상 맛있네 그냥 오피셜글 띡 올리는거보다 캬 소리 나오게만드노,2025-11-23T17:19:53
dcinside_리그오브레전드_갤러리,왜 롤 망하고 나서 한물간 여자 연예인들이 숟가락 얹으러 오냐,흥할때는 취급도 안하다가 인기 다 식고 끝물일때 와서 숟가락 얹고 있노 ㅋㅋ 플래니 다이아니 마스터니 하는것들 죄다 서포터로 듀오 돌리면서 버스 쳐타놓고는 플레이 보면 그냥 브실골 수준인데 티어부심 부리면서 롤진녀라고 언플하고 있노 카타 하는 애만 롤 좋아한듯하고 나머지는 그냥 버스나 타면서 왜 티어부심 부리지,왜 롤 망하고 나서 한물간 여자 연예인들이 숟가락 얹으러 오냐 흥할때는 취급도 안하다가 인기 다 식고 끝물일때 와서 숟가락 얹고 있노 ㅋㅋ 플래니 다이아니 마스터니 하는것들 죄다 서포터로 듀오 돌리면서 버스 쳐타놓고는 플레이 보면 그냥 브실골 수준인데 티어부심 부리면서 롤진녀라고 언플하고 있노 카타 하는 애만 롤 좋아한듯하고 나머지는 그냥 버스나 타면서 왜 티어부심 부리지,2025-11-23T17:19:52
dcinside_리그오브레전드_갤러리,근데 피싸개 피분수 이런말좀 안쓰면 좋겠어ㅠㅠ,폐경이라 피 이제 안나와 피싼다그러면 좋아함,근데 피싸개 피분수 이런말좀 안쓰면 좋겠어ㅠㅠ 폐경이라 피 이제 안나와 피싼다그러면 좋아함,2025-11-23T17:19:49
dcinside_리그오브레전드_갤러리,한화 롤준석 오피셜 ㅋㅋㅋㅋㅋㅋ,,한화 롤준석 오피셜 ㅋㅋㅋㅋㅋㅋ,2025-11-23T17:19:44
dcinside_리그오브레전드_갤러리,5옵션이라 5번 ㅋㅋㅋㅋ,ㅋㅋㅋㅋㅋㅋㅋㅋㅋㅋㅋㅋㅋㅋㅋㅋㅋㅋㅋㅋㅋㅋㅋㅋㅋㅋㅋㅋ,5옵션이라 5번 ㅋㅋㅋㅋ ㅋㅋㅋㅋㅋㅋㅋㅋㅋㅋㅋㅋㅋㅋㅋㅋㅋㅋㅋㅋㅋㅋㅋㅋㅋㅋㅋㅋ,2025-11-23T17:19:42
dcinside_리그오브레전드_갤러리,뭔 죄다 응우옌이노 씨발ㅋㅋㅋㅋㅋㅋㅋㅋㅋㅋㅋㅋ,ㅋㅋㅋㅋㅋㅋㅋㅋ,뭔 죄다 응우옌이노 씨발ㅋㅋㅋㅋㅋㅋㅋㅋㅋㅋㅋㅋ ㅋㅋㅋㅋㅋㅋㅋㅋ,2025-11-23T17:19:41
dcinside_리그오브레전드_갤러리,한화는 이제 완전 나가리네,카나비 ㅋㅋㅋㅋ,한화는 이제 완전 나가리네 카나비 ㅋㅋㅋㅋ,2025-11-23T17:19:33
dcinside_리그오브레전드_갤러리,이제 하나남았노,캬 시발 체증이 해소되는 느낌이네 살짝... 구마 왜안떠 ㅠㅠ,이제 하나남았노 캬 시발 체증이 해소되는 느낌이네 살짝... 구마 왜안떠 ㅠㅠ,2025-11-23T17:19:30
