community,title,content,full_text,posted_at
dcinside_리그오브레전드_갤러리,케리아가 대체불가 역2롤 ㅇㅈㄹ하는 케맘년들아,이새끼가 무뇌정글 오너보다도 쿨계산 못 해서 다 틀린다 ㅅㅂ련들아 시야못따 탱못해 구마탓하면서 쩔수 혜지픽 ㅇㅈㄹ에 정글보다도 쿨계산 못 해 티스코드에서 지만 다른 각보고 꿍시렁거려 이새끼 폼 나가리된지 오래다 메인오더다 뭐다 지랄말고 오더는 페이커 하나니까 입쳐닫아 올해 하는 꼬라지보면 욕 안먹은게 신기한데 오히려 빨리는게 기괴하네 비응신련들,케리아가 대체불가 역2롤 ㅇㅈㄹ하는 케맘년들아 이새끼가 무뇌정글 오너보다도 쿨계산 못 해서 다 틀린다 ㅅㅂ련들아 시야못따 탱못해 구마탓하면서 쩔수 혜지픽 ㅇㅈㄹ에 정글보다도 쿨계산 못 해 티스코드에서 지만 다른 각보고 꿍시렁거려 이새끼 폼 나가리된지 오래다 메인오더다 뭐다 지랄말고 오더는 페이커 하나니까 입쳐닫아 올해 하는 꼬라지보면 욕 안먹은게 신기한데 오히려 빨리는게 기괴하네 비응신련들,2025-11-23T15:01:28
dcinside_리그오브레전드_갤러리,ㄴ살다살다 이런 앰생은 처음보면 개추,ㅇ,ㄴ살다살다 이런 앰생은 처음보면 개추 ㅇ,2025-11-23T15:01:19
dcinside_리그오브레전드_갤러리,이제 솔랭도르는 진짜 의미 0퍼 된 듯,그래도 옛날엔 한 5~10퍼 정도 의미 있었다 치면 요즘은 진짜 아예 의미 없는 듯 솔랭이 너무 병신됐어,이제 솔랭도르는 진짜 의미 0퍼 된 듯 그래도 옛날엔 한 5~10퍼 정도 의미 있었다 치면 요즘은 진짜 아예 의미 없는 듯 솔랭이 너무 병신됐어,2025-11-23T15:01:16
dcinside_리그오브레전드_갤러리,구마는 좀 대단하긴함,티원 원딜로 매드무비 저렇게 안 나오기 힘든데 진짜 원딜다운 매드무비 월즈 4강 카이사말고 없는 거 같음,구마는 좀 대단하긴함 티원 원딜로 매드무비 저렇게 안 나오기 힘든데 진짜 원딜다운 매드무비 월즈 4강 카이사말고 없는 거 같음,2025-11-23T15:00:59
dcinside_리그오브레전드_갤러리,형 말레니아 잡고 왔다,16시간 걸림,형 말레니아 잡고 왔다 16시간 걸림,2025-11-23T15:00:57
dcinside_리그오브레전드_갤러리,솔직히 내년엔 우승하길 바람,내년에도 우승 못하면 야구처럼될듯 ㄹㅇ 한국야구 좆박아서 일본에 비교도 안되는거마냥 만 딸치는 게임될거같음,솔직히 내년엔 우승하길 바람 내년에도 우승 못하면 야구처럼될듯 ㄹㅇ 한국야구 좆박아서 일본에 비교도 안되는거마냥 만 딸치는 게임될거같음,2025-11-23T15:00:51
dcinside_리그오브레전드_갤러리,벵기 웨이보가는거보면 내친게아니라 못잡은거같은데?,ㅈㄴ 거액으로간다는데 왜데려가는거지,벵기 웨이보가는거보면 내친게아니라 못잡은거같은데? ㅈㄴ 거액으로간다는데 왜데려가는거지,2025-11-23T15:00:47
dcinside_리그오브레전드_갤러리,그래서 그걸로 이겼음?,롤판 전체를 관통하는 명문이네 ㄷㄷ,그래서 그걸로 이겼음? 롤판 전체를 관통하는 명문이네 ㄷㄷ,2025-11-23T15:00:26
dcinside_리그오브레전드_갤러리,씨맥) 내가 왜 구마유시 거르고 스매쉬를 선택했냐면,,씨맥) 내가 왜 구마유시 거르고 스매쉬를 선택했냐면,2025-11-23T15:00:23
dcinside_리그오브레전드_갤러리,제카제구딜 왜 존나 쌔보이지않냐 올해랑 좀 비슷해보임,뭐 고점은 피넛 바이퍼보다 카나비 구마가 더 높겠지 ㅇㅇ 근데 그 고점이 매판 나오지않음 저점이더 나옴 그리고 제카제구딜이 존나 쌔보이지 않는 이유가 제카 때매 그런가 딜라때매 그런가 특히 제카는 22때가 최고점이고 이제 그 폼이 안 나옴 비디디 카엘이 와야함 한화 로스터 존나 쌔질려면,제카제구딜 왜 존나 쌔보이지않냐 올해랑 좀 비슷해보임 뭐 고점은 피넛 바이퍼보다 카나비 구마가 더 높겠지 ㅇㅇ 근데 그 고점이 매판 나오지않음 저점이더 나옴 그리고 제카제구딜이 존나 쌔보이지 않는 이유가 제카 때매 그런가 딜라때매 그런가 특히 제카는 22때가 최고점이고 이제 그 폼이 안 나옴 비디디 카엘이 와야함 한화 로스터 존나 쌔질려면,2025-11-23T15:00:13
dcinside_리그오브레전드_갤러리,구마는 애초에 증명한적이 없음,쓰리핏 = 월즈 구경꾼 파엠 = 미포궁 딸깍 성적과 관련없는 방출 스매쉬한테 밀렸으나 로 인해 기용된 낙하산 티원 아니었으면 월즈 가보지도 못함 ㄹㅇㅋㅋ,구마는 애초에 증명한적이 없음 쓰리핏 = 월즈 구경꾼 파엠 = 미포궁 딸깍 성적과 관련없는 방출 스매쉬한테 밀렸으나 로 인해 기용된 낙하산 티원 아니었으면 월즈 가보지도 못함 ㄹㅇㅋㅋ,2025-11-23T15:00:03
dcinside_리그오브레전드_갤러리,뭐냐 젠퀴벌레 다 도망갔네,무슨 일이노,뭐냐 젠퀴벌레 다 도망갔네 무슨 일이노,2025-11-23T14:59:58
dcinside_리그오브레전드_갤러리,요새 해외에 67 뭔밈이냐?,코로나 때 엄준식 같은 거냐? 걍 들으면 웃으면 되는 거임?,요새 해외에 67 뭔밈이냐? 코로나 때 엄준식 같은 거냐? 걍 들으면 웃으면 되는 거임?,2025-11-23T14:59:43
dcinside_리그오브레전드_갤러리,클템이 롤판 망친 지분 적게잡아도 90아님?,롤판 ㅈ같은 일 생겼을 때 얘나 울프 찍으면 무조건 맞음,클템이 롤판 망친 지분 적게잡아도 90아님? 롤판 ㅈ같은 일 생겼을 때 얘나 울프 찍으면 무조건 맞음,2025-11-23T14:59:33
dcinside_리그오브레전드_갤러리,팀미드 26,누가이기냐?,팀미드 26 누가이기냐?,2025-11-23T14:59:21
dcinside_리그오브레전드_갤러리,페이즈 1패는 매드무비 개웃기노 ㅋㅋㅋ,구마 진짜 개못하네 ㅋㅋㅋㅋ 습관성 뒷무빙 진짜구나 얘,페이즈 1패는 매드무비 개웃기노 ㅋㅋㅋ 구마 진짜 개못하네 ㅋㅋㅋㅋ 습관성 뒷무빙 진짜구나 얘,2025-11-23T14:59:20
dcinside_리그오브레전드_갤러리,근데 잼구만큼 유리멘탈 프로 있었음?,잼구는 거의 공황장애온것처럼 플레이를 해버리던데 말리면,근데 잼구만큼 유리멘탈 프로 있었음? 잼구는 거의 공황장애온것처럼 플레이를 해버리던데 말리면,2025-11-23T14:58:55
dcinside_리그오브레전드_갤러리,솔랭 점수 높은 프로 중에 잘하는 새끼 없는 이유가 뭐냐,잘하는 프로들 거의 솔랭 별로 안돌리네,솔랭 점수 높은 프로 중에 잘하는 새끼 없는 이유가 뭐냐 잘하는 프로들 거의 솔랭 별로 안돌리네,2025-11-23T14:58:48
dcinside_리그오브레전드_갤러리,숏습이 2승후 3패스위스때도 스카웃한테 처맞는게 시작이었던게,힘조견들은 싫어할만함 근데 북미랑 싸워서 2승으로 생색낸게 문제아닐까,숏습이 2승후 3패스위스때도 스카웃한테 처맞는게 시작이었던게 힘조견들은 싫어할만함 근데 북미랑 싸워서 2승으로 생색낸게 문제아닐까,2025-11-23T14:58:32
dcinside_리그오브레전드_갤러리,오늘 날씨 좋은데 구맘은 안 좋은 이유,오늘도 롤갤과 트위터에서 구마유시를 지켜야해서,오늘 날씨 좋은데 구맘은 안 좋은 이유 오늘도 롤갤과 트위터에서 구마유시를 지켜야해서,2025-11-23T14:58:29
dcinside_리그오브레전드_갤러리,역체롤 구마유시,ㅇㅇ 반박시 롤컵 쓰리핏 내년에 롤컵우승시 반박불가,역체롤 구마유시 ㅇㅇ 반박시 롤컵 쓰리핏 내년에 롤컵우승시 반박불가,2025-11-23T14:58:16
dcinside_리그오브레전드_갤러리,프로 원딜이랑 탑은,이번 롤드컵 보고 빨간약 존ㄴ나 처먹엇을걸? ㅋㅋㅋㅋㅋ 내가 가도 저정도는 하는데...<<<씨발 다 이생각햇을듯,프로 원딜이랑 탑은 이번 롤드컵 보고 빨간약 존ㄴ나 처먹엇을걸? ㅋㅋㅋㅋㅋ 내가 가도 저정도는 하는데...<<<씨발 다 이생각햇을듯,2025-11-23T14:58:16
dcinside_리그오브레전드_갤러리,이거 뭐냐 제카 닮았네 씨발 ㅋㅋㅋㅋㅋ,씨발 ㅋㅋㅋ,이거 뭐냐 제카 닮았네 씨발 ㅋㅋㅋㅋㅋ 씨발 ㅋㅋㅋ,2025-11-23T14:58:05
dcinside_리그오브레전드_갤러리,아겜 위상거리는데 페이커없었으면 위상도 없음,진짜라는거임;,아겜 위상거리는데 페이커없었으면 위상도 없음 진짜라는거임;,2025-11-23T14:57:54
dcinside_리그오브레전드_갤러리,이거 왜 꼴리냐 시발???,하 시발 여우련 바지 확내리고 와바박...♡ . .,이거 왜 꼴리냐 시발??? 하 시발 여우련 바지 확내리고 와바박...♡ . .,2025-11-23T14:57:45
dcinside_리그오브레전드_갤러리,옛날 롤 수준낮고 물로켓인 증거...,아트 다처맞는쪽이 병신인데 이딴게 빨림;;,옛날 롤 수준낮고 물로켓인 증거... 아트 다처맞는쪽이 병신인데 이딴게 빨림;;,2025-11-23T14:57:23
dcinside_리그오브레전드_갤러리,근데 쵸비가 페이커 넘으려면,씨발 6연우승해야하노 ㅋㅋㅋㅋㅋㅋㅋㅋㅋ,근데 쵸비가 페이커 넘으려면 씨발 6연우승해야하노 ㅋㅋㅋㅋㅋㅋㅋㅋㅋ,2025-11-23T14:57:15
dcinside_리그오브레전드_갤러리,근데 씨맥정도면 능력 ㅁㅌㅊ임?,곧 죽어도 1부리그는 맨날 있던데,근데 씨맥정도면 능력 ㅁㅌㅊ임? 곧 죽어도 1부리그는 맨날 있던데,2025-11-23T14:56:58
dcinside_리그오브레전드_갤러리,쵸비가 컨디션만 좋았으면 진짜 다 따먹었는데 하필 겨울에 월즈해서,개씨발 일교차 독감 바이러스컵,쵸비가 컨디션만 좋았으면 진짜 다 따먹었는데 하필 겨울에 월즈해서 개씨발 일교차 독감 바이러스컵,2025-11-23T14:56:58
dcinside_리그오브레전드_갤러리,루시드 얘 여론은 어떠냐,쇼메 팬들이 놔둠??,루시드 얘 여론은 어떠냐 쇼메 팬들이 놔둠??,2025-11-23T14:56:54
dcinside_리그오브레전드_갤러리,유투브 댓글 레전드 ㅋㅋㅋㅋㅋㅋ,페이즈 케리아 솔랭에서 만난 영상 2년전 댓글ㅋㅋㅋㅋ,유투브 댓글 레전드 ㅋㅋㅋㅋㅋㅋ 페이즈 케리아 솔랭에서 만난 영상 2년전 댓글ㅋㅋㅋㅋ,2025-11-23T14:56:50
dcinside_리그오브레전드_갤러리,올해 라인하면 멤버가,탑 도란 기인 제우스 퍼펙트 킹겐 정글 오너 캐니언 커즈 ? ? 미드 페이커 쵸비 비디디 제카 스카웃 원딜 구마유시 페이즈 룰러 덕담 디아블 서폿 케리아 듀로 딜라이트 피터 리헨즈인가,올해 라인하면 멤버가 탑 도란 기인 제우스 퍼펙트 킹겐 정글 오너 캐니언 커즈 ? ? 미드 페이커 쵸비 비디디 제카 스카웃 원딜 구마유시 페이즈 룰러 덕담 디아블 서폿 케리아 듀로 딜라이트 피터 리헨즈인가,2025-11-23T14:56:49
dcinside_리그오브레전드_갤러리,예전엔 쏜을 그래도 페이커보다 높게 쳤었는데,황회장님이 페이커 삼창 해준 이상 페이커가 압도적 우위,예전엔 쏜을 그래도 페이커보다 높게 쳤었는데 황회장님이 페이커 삼창 해준 이상 페이커가 압도적 우위,2025-11-23T14:56:49
dcinside_리그오브레전드_갤러리,팩트는 티원 원딜 자리에 구마가 아니여도 쓰리핏임ㅋㅋㅋ,그걸 알아야지 구맘 장애인 년들아 ㅋㅋㅋㅋ,팩트는 티원 원딜 자리에 구마가 아니여도 쓰리핏임ㅋㅋㅋ 그걸 알아야지 구맘 장애인 년들아 ㅋㅋㅋㅋ,2025-11-23T14:56:40
dcinside_리그오브레전드_갤러리,아겜이 위상 높다는 놈들은 뇌 열어봐야함,ㅇㅇ,아겜이 위상 높다는 놈들은 뇌 열어봐야함 ㅇㅇ,2025-11-23T14:56:31
dcinside_리그오브레전드_갤러리,국가대표 주전 미드여서 미안해..,"누군가를 상대로 솔킬을 17번 따서 미안해 누군가를 상대로 리그 파엠, 파엠을 먹어서 미안해 누군가를 상대로 라인전에서 천골차를 내버려서 미안해 누군가보다 롤을 더 잘해서 미안해","국가대표 주전 미드여서 미안해.. 누군가를 상대로 솔킬을 17번 따서 미안해 누군가를 상대로 리그 파엠, 파엠을 먹어서 미안해 누군가를 상대로 라인전에서 천골차를 내버려서 미안해 누군가보다 롤을 더 잘해서 미안해",2025-11-23T14:56:16
dcinside_리그오브레전드_갤러리,한화가 티원 못 이길 거 같은데,탑 체급 밀림 정글 밀림 미드 밀림 원딜 밀림 서폿 밀림 이길 구석이 있나 ? 그나마 젠지가 티원 잡을 듯,한화가 티원 못 이길 거 같은데 탑 체급 밀림 정글 밀림 미드 밀림 원딜 밀림 서폿 밀림 이길 구석이 있나 ? 그나마 젠지가 티원 잡을 듯,2025-11-23T14:56:08
dcinside_리그오브레전드_갤러리,감독 이거 ㄹㅇ 한번 보고싶은데,에서 안끝나고 로 번질까봐 김정균 뇌신 김정수 이런감코들 절대 죽었다깨어나도 안나가려하고 아무도 참여안할듯,감독 이거 ㄹㅇ 한번 보고싶은데 에서 안끝나고 로 번질까봐 김정균 뇌신 김정수 이런감코들 절대 죽었다깨어나도 안나가려하고 아무도 참여안할듯,2025-11-23T14:56:06
dcinside_리그오브레전드_갤러리,응갤러들이조용히비추누르고가는움짤.,,응갤러들이조용히비추누르고가는움짤.,2025-11-23T14:56:00
dcinside_리그오브레전드_갤러리,구케 올려치는것도 젠첩 팔팔이팬 새끼들 작품이지 ㅋㅋ,어떻게 월즈 우승팀 원딜이 5옵션 ㅋㅋ,구케 올려치는것도 젠첩 팔팔이팬 새끼들 작품이지 ㅋㅋ 어떻게 월즈 우승팀 원딜이 5옵션 ㅋㅋ,2025-11-23T14:55:57
dcinside_리그오브레전드_갤러리,내년 1보다 한화가 지는게 놀림감인 이유,애초에 한화는 1을 발라온 팀임 근데 역체탑 역체원을 끼고 내년에 1한테 발린다? 기존 멤버 방출하고 큰 돈 쓴게 개뻘짓 된거다 한화는 무조건 우승해야 본전임,내년 1보다 한화가 지는게 놀림감인 이유 애초에 한화는 1을 발라온 팀임 근데 역체탑 역체원을 끼고 내년에 1한테 발린다? 기존 멤버 방출하고 큰 돈 쓴게 개뻘짓 된거다 한화는 무조건 우승해야 본전임,2025-11-23T14:55:46
dcinside_리그오브레전드_갤러리,월즈 올려치기 이 표현부터가 웃긴게,이름부터가 월즈챔피언쉽인데 제일 큰 대회지,월즈 올려치기 이 표현부터가 웃긴게 이름부터가 월즈챔피언쉽인데 제일 큰 대회지,2025-11-23T14:55:44
dcinside_리그오브레전드_갤러리,담원 왜이렇게 된거냐 이제 걍 동부팀이네..,월즈 결승 2연속에 암흑기도 끝내고 칸 칸나 덕켈 데프트 등 몸값 오른 선수들이 가장 가고싶어하던 팀이었는데 이번 로스터는 진지하게 킅농은커녕 폭스나 든프도 못이길것같네,담원 왜이렇게 된거냐 이제 걍 동부팀이네.. 월즈 결승 2연속에 암흑기도 끝내고 칸 칸나 덕켈 데프트 등 몸값 오른 선수들이 가장 가고싶어하던 팀이었는데 이번 로스터는 진지하게 킅농은커녕 폭스나 든프도 못이길것같네,2025-11-23T14:55:44
dcinside_리그오브레전드_갤러리,씨맥 점마는 왜 치지직 안옴 ?,딮기 방송은 치지직인데,씨맥 점마는 왜 치지직 안옴 ? 딮기 방송은 치지직인데,2025-11-23T14:55:33
dcinside_리그오브레전드_갤러리,씨맥 피드백중간에,아 저새끼 존나 웃기네 형 개소리좀 자제요 이러면 안면강타 쓰냐?,씨맥 피드백중간에 아 저새끼 존나 웃기네 형 개소리좀 자제요 이러면 안면강타 쓰냐?,2025-11-23T14:55:20
dcinside_리그오브레전드_갤러리,남들 주말에 놀 때 상혁이 지키는 응갤러들 한심하네,그러니까 결혼을 못한거겠지..,남들 주말에 놀 때 상혁이 지키는 응갤러들 한심하네 그러니까 결혼을 못한거겠지..,2025-11-23T14:55:19
dcinside_리그오브레전드_갤러리,구좆.,,구좆.,2025-11-23T14:55:18
dcinside_리그오브레전드_갤러리,케리아가 제일 잘알지 ㅋㅋ 원딜 실력 하자있는거 ㅋㅋ,구마유시 때문에 조합이 ㅈㄴ 제한걸리는데,케리아가 제일 잘알지 ㅋㅋ 원딜 실력 하자있는거 ㅋㅋ 구마유시 때문에 조합이 ㅈㄴ 제한걸리는데,2025-11-23T14:55:15
dcinside_리그오브레전드_갤러리,순수실력 이지랄 하네 ㅋㅋㅋ,이건 순수실력 아니냐 이 시발새끼야 ㅋㅋ,순수실력 이지랄 하네 ㅋㅋㅋ 이건 순수실력 아니냐 이 시발새끼야 ㅋㅋ,2025-11-23T14:55:06
dcinside_리그오브레전드_갤러리,그웬은 왜 로아안감??,평타 위주 메이지라서 균열 가는거임?,그웬은 왜 로아안감?? 평타 위주 메이지라서 균열 가는거임?,2025-11-23T14:54:54
dcinside_리그오브레전드_갤러리,부품 갈이 ? 모욕이자 칭찬임.,"이 새끼랑 같은 팀 하면, '월즈‘ 빼고는 다 우승할 수 있음. 1 년 12 개 월 중에 11 개월 정도는 웃고 싶은 새끼들이, 이 새끼랑 같은 팀 해 보려고 줄을 섬. 사실 상 모욕이자 칭찬임 그냥.","부품 갈이 ? 모욕이자 칭찬임. 이 새끼랑 같은 팀 하면, '월즈‘ 빼고는 다 우승할 수 있음. 1 년 12 개 월 중에 11 개월 정도는 웃고 싶은 새끼들이, 이 새끼랑 같은 팀 해 보려고 줄을 섬. 사실 상 모욕이자 칭찬임 그냥.",2025-11-23T14:54:41
dcinside_리그오브레전드_갤러리,아겜주전월즈쓰리핏골든로드,뭐가 가장 쩌냐? 위상에 있어서 아겜? 아니면 아직 아무도 못한 골든로드?,아겜주전월즈쓰리핏골든로드 뭐가 가장 쩌냐? 위상에 있어서 아겜? 아니면 아직 아무도 못한 골든로드?,2025-11-23T14:54:20
dcinside_리그오브레전드_갤러리,쵸비 이 영상에서 성향 존나 잘보인다,://../?=78 자크가 들어가도 계속 뒷무빙만 치네 아무리 솔랭이어도 글치,쵸비 이 영상에서 성향 존나 잘보인다 ://../?=78 자크가 들어가도 계속 뒷무빙만 치네 아무리 솔랭이어도 글치,2025-11-23T14:54:14
dcinside_리그오브레전드_갤러리,씨맥) 구마유시 파엠 보고 감명받았다,내가 살면서 본 원딜중에 단연 1등이다,씨맥) 구마유시 파엠 보고 감명받았다 내가 살면서 본 원딜중에 단연 1등이다,2025-11-23T14:54:13
dcinside_리그오브레전드_갤러리,애당초 월즈올려친게 페까인데 뭔소릴하는거냐 ㅋㅋㅋㅋㅋㅋㅋㅋㅋㅋㅋㅋ,이새끼들은 걍 양심이 없음ㅋㅋㅋㅋㅋㅋ,애당초 월즈올려친게 페까인데 뭔소릴하는거냐 ㅋㅋㅋㅋㅋㅋㅋㅋㅋㅋㅋㅋ 이새끼들은 걍 양심이 없음ㅋㅋㅋㅋㅋㅋ,2025-11-23T14:53:55
dcinside_리그오브레전드_갤러리,구마 한생가냐 그슬각이네,ㄹㅇ,구마 한생가냐 그슬각이네 ㄹㅇ,2025-11-23T14:53:54
dcinside_리그오브레전드_갤러리,씨맥내년이진짜위기네안면강타참기99노,,씨맥내년이진짜위기네안면강타참기99노,2025-11-23T14:53:44
dcinside_리그오브레전드_갤러리,손흥민 페이커 누가 위임?,원래는 손흥민 위로 쳐줬을텐데 자꾸 페이커가 올라가네,손흥민 페이커 누가 위임? 원래는 손흥민 위로 쳐줬을텐데 자꾸 페이커가 올라가네,2025-11-23T14:53:11
dcinside_리그오브레전드_갤러리,난 이번 페이커 복기방송 이후로 운타라 빠는 중,이새기가 게임을 좆같이 못했던 건 프로애들한테는 없는 사회성이 고도로 발달되어있어서였음 마지 조조 옆에 있는 순욱 느낌이랄까,난 이번 페이커 복기방송 이후로 운타라 빠는 중 이새기가 게임을 좆같이 못했던 건 프로애들한테는 없는 사회성이 고도로 발달되어있어서였음 마지 조조 옆에 있는 순욱 느낌이랄까,2025-11-23T14:52:57
dcinside_리그오브레전드_갤러리,씨맥의금쪽이들.,,씨맥의금쪽이들.,2025-11-23T14:52:56
dcinside_리그오브레전드_갤러리,왜 구마 역체롤 밈은 안나오는 거임?,제우스때랑 뭐가 다른거지... 같은 파엠인데,왜 구마 역체롤 밈은 안나오는 거임? 제우스때랑 뭐가 다른거지... 같은 파엠인데,2025-11-23T14:52:36
dcinside_리그오브레전드_갤러리,뒷난.,,뒷난.,2025-11-23T14:52:03
dcinside_리그오브레전드_갤러리,18년도 아프리카는 도대체 뭐냐,9한테 3대떡은 ㅅㅂ ㅋㅋ,18년도 아프리카는 도대체 뭐냐 9한테 3대떡은 ㅅㅂ ㅋㅋ,2025-11-23T14:51:50
dcinside_리그오브레전드_갤러리,티원 꼴아박고 5명 싸우는게 보고싶구나..,도맘ㅡ페이즈 연합 뒷난ㅡ페독 연합 오너시치 볼만하겠노 ㅋㅋ,티원 꼴아박고 5명 싸우는게 보고싶구나.. 도맘ㅡ페이즈 연합 뒷난ㅡ페독 연합 오너시치 볼만하겠노 ㅋㅋ,2025-11-23T14:51:41
dcinside_리그오브레전드_갤러리,진짜 씨발 작년에 내가 꿈꾸던 로스터 완성될 수 있었는데,쮀오페룰케 조마쉬 개 씨이발련때문에 아 개혈압오르노 ㄹㅇ,진짜 씨발 작년에 내가 꿈꾸던 로스터 완성될 수 있었는데 쮀오페룰케 조마쉬 개 씨이발련때문에 아 개혈압오르노 ㄹㅇ,2025-11-23T14:51:40
dcinside_리그오브레전드_갤러리,근데 운타라는 현역때 어느정도임?,지금은 그냥 광대같고,근데 운타라는 현역때 어느정도임? 지금은 그냥 광대같고,2025-11-23T14:51:37
dcinside_리그오브레전드_갤러리,구마는 촉나라로 치면 조자룡임,조운이 유비 아들 구한거 원툴이듯이 구마도 선수 생활동안 임펙트라고는 22년 바루스로 바론 스틸밖에 없음 ㄹㅇㅋㅋ,구마는 촉나라로 치면 조자룡임 조운이 유비 아들 구한거 원툴이듯이 구마도 선수 생활동안 임펙트라고는 22년 바루스로 바론 스틸밖에 없음 ㄹㅇㅋㅋ,2025-11-23T14:51:21
dcinside_리그오브레전드_갤러리,운타라 호감인 이유,눈치좋고 사회성좋고 가식없고 여유있는데 양아치도 아니니까,운타라 호감인 이유 눈치좋고 사회성좋고 가식없고 여유있는데 양아치도 아니니까,2025-11-23T14:51:11
dcinside_리그오브레전드_갤러리,이짤은 줜나웃기네 ㅋㅋㅋㅋㅋㅋㅋㅋㅋ,아직 구마 한화확정 아니지?,이짤은 줜나웃기네 ㅋㅋㅋㅋㅋㅋㅋㅋㅋ 아직 구마 한화확정 아니지?,2025-11-23T14:51:06
dcinside_리그오브레전드_갤러리,애초에 슼이란팀은 페이커 빠는김에 팀원도 빨아주는거지,도란 티원입단전 인스타 5만 >> 50만넘김 페이즈 티원입단전 5만 >> 11만넘김 거의모든 슼갈들이 페독인데 구줌들만 특이한 병신집단임 구좆을빨면서 페이커를깜 이건 구좆이 그동안 얼마나 페이커를 적으로 생각했는지 알수있는 대목임 같은팀 미드한테 3년 재계약에 광기가 느껴진다 이게 정상적인 팀원이 같은팀원한테 할수있는 대사가아님 페이커가 3년 재계약해서 커리어 같이 쌓는다고 푸념 아니진짜 이 씹병신은 그럼 지가 팀을 처나가야지 페이커빨 최고인기팀 티원 후광은 받고싶고 페이커 커리어는 따라잡고싶고 이게 뭐하는 병신새낀거냐,애초에 슼이란팀은 페이커 빠는김에 팀원도 빨아주는거지 도란 티원입단전 인스타 5만 >> 50만넘김 페이즈 티원입단전 5만 >> 11만넘김 거의모든 슼갈들이 페독인데 구줌들만 특이한 병신집단임 구좆을빨면서 페이커를깜 이건 구좆이 그동안 얼마나 페이커를 적으로 생각했는지 알수있는 대목임 같은팀 미드한테 3년 재계약에 광기가 느껴진다 이게 정상적인 팀원이 같은팀원한테 할수있는 대사가아님 페이커가 3년 재계약해서 커리어 같이 쌓는다고 푸념 아니진짜 이 씹병신은 그럼 지가 팀을 처나가야지 페이커빨 최고인기팀 티원 후광은 받고싶고 페이커 커리어는 따라잡고싶고 이게 뭐하는 병신새낀거냐,2025-11-23T14:51:05
dcinside_리그오브레전드_갤러리,아니근데티원프론트에ㄹㅇ응갤러있는듯,말이안댐걍,아니근데티원프론트에ㄹㅇ응갤러있는듯 말이안댐걍,2025-11-23T14:51:03
dcinside_리그오브레전드_갤러리,근데 다른걸 떠나서 왜 페이즈 사는거 희망회로 글만 올라오는거임?,그렇다면 왜 한화는 올해 성적이... ㄱ-,근데 다른걸 떠나서 왜 페이즈 사는거 희망회로 글만 올라오는거임? 그렇다면 왜 한화는 올해 성적이... ㄱ-,2025-11-23T14:51:02
dcinside_리그오브레전드_갤러리,이거보니까 딜라이트 걱정은 안된다,싸우면 무조건 딜라가 이겨 목굵기 차이봐라,이거보니까 딜라이트 걱정은 안된다 싸우면 무조건 딜라가 이겨 목굵기 차이봐라,2025-11-23T14:51:01
dcinside_리그오브레전드_갤러리,케리아도 스찌 원딜은 거르는구나,ㅋㅋㅋㅋ,케리아도 스찌 원딜은 거르는구나 ㅋㅋㅋㅋ,2025-11-23T14:50:51
