community,title,content,full_text,posted_at
dcinside_리그오브레전드_갤러리,씨발 롤대갤 완장이 응갤임 ㅋㅋ 개쳐웃기노 ㅋㅣㄱ,응라포밍을 대놓고하노,씨발 롤대갤 완장이 응갤임 ㅋㅋ 개쳐웃기노 ㅋㅣㄱ 응라포밍을 대놓고하노,2025-11-23T18:52:20
dcinside_리그오브레전드_갤러리,26 순위 예상해봄,1.티원 2.한화 3.젠지 4.농심 5.킅 6.딮 7.폭스 8.든프 9. 10.브리온 티원 이제 리그 먹을때 됐음,26 순위 예상해봄 1.티원 2.한화 3.젠지 4.농심 5.킅 6.딮 7.폭스 8.든프 9. 10.브리온 티원 이제 리그 먹을때 됐음,2025-11-23T18:52:15
dcinside_리그오브레전드_갤러리,페이즈 와서 좋은점,내년에 케리아 저격밴 빼줄수있음 그 전엔 못하던거 ㅋㅋ,페이즈 와서 좋은점 내년에 케리아 저격밴 빼줄수있음 그 전엔 못하던거 ㅋㅋ,2025-11-23T18:52:08
dcinside_리그오브레전드_갤러리,법무법인 대륜 실시@간기자...,,법무법인 대륜 실시@간기자...,2025-11-23T18:52:04
dcinside_리그오브레전드_갤러리,사실 근데 뒷담은 용서함....,하지만 난쟁이인건 절대 용서못함 난쟁이는 씨발 사람이 아님,사실 근데 뒷담은 용서함.... 하지만 난쟁이인건 절대 용서못함 난쟁이는 씨발 사람이 아님,2025-11-23T18:52:04
dcinside_리그오브레전드_갤러리,씨맥이 구마는 그냥 롤을 못한데 페이즈 발끝도 안된데,"://./?=7 씨맥 ‘1 페이즈 3년계약은 업그레이드’ 구마유시 무시 발언 여러분들의 생각은? 에서 마음에 드는 동영상과 음악을 감상하고, 직접 만든 콘텐츠를 업로드하여 친구, 가족뿐 아니라 전 세계 사람들과 콘텐츠를 공유할 수 있습니다. .","씨맥이 구마는 그냥 롤을 못한데 페이즈 발끝도 안된데 ://./?=7 씨맥 ‘1 페이즈 3년계약은 업그레이드’ 구마유시 무시 발언 여러분들의 생각은? 에서 마음에 드는 동영상과 음악을 감상하고, 직접 만든 콘텐츠를 업로드하여 친구, 가족뿐 아니라 전 세계 사람들과 콘텐츠를 공유할 수 있습니다. .",2025-11-23T18:52:03
dcinside_리그오브레전드_갤러리,뒷난이 올려치는건 누구임?,오너는 역체정 아니지만 뒷난은 ㅇㅈ이라는데 티원 오기전에 페이커낀 에포트한테 벽느낀게 케리아임 얘도 커리어 페페페고만 뭔,뒷난이 올려치는건 누구임? 오너는 역체정 아니지만 뒷난은 ㅇㅈ이라는데 티원 오기전에 페이커낀 에포트한테 벽느낀게 케리아임 얘도 커리어 페페페고만 뭔,2025-11-23T18:51:48
dcinside_리그오브레전드_갤러리,구마상대 벤카드는 바루스 하나면 충분,피어리스라서 그냥 한판 뺏어오면 쭉 걱정없음.,구마상대 벤카드는 바루스 하나면 충분 피어리스라서 그냥 한판 뺏어오면 쭉 걱정없음.,2025-11-23T18:51:37
dcinside_리그오브레전드_갤러리,응줌마 거르고 스매쉬 나올 때 ㅈㄴ 웃기긴함,노골적으로 제이카만 픽하는게 ㅈㄴ웃겼음ㅋㅋ,응줌마 거르고 스매쉬 나올 때 ㅈㄴ 웃기긴함 노골적으로 제이카만 픽하는게 ㅈㄴ웃겼음ㅋㅋ,2025-11-23T18:51:13
dcinside_리그오브레전드_갤러리,ㅁㅌㅊ노,,ㅁㅌㅊ노,2025-11-23T18:51:07
dcinside_리그오브레전드_갤러리,내년 한생갤 이용가이드,1. 게임 이기고 누군가 빨린다면 구마유시를 낄껴할것 ) 제우스가 일 경우 -> 와 제구 역시 파엠듀오 미쳣다 2. 원딜탓이 나온다면 쮀맘 / 응줌 몰이를 반반섞어서 혼동을 유발할것,내년 한생갤 이용가이드 1. 게임 이기고 누군가 빨린다면 구마유시를 낄껴할것 ) 제우스가 일 경우 -> 와 제구 역시 파엠듀오 미쳣다 2. 원딜탓이 나온다면 쮀맘 / 응줌 몰이를 반반섞어서 혼동을 유발할것,2025-11-23T18:51:07
dcinside_리그오브레전드_갤러리,씨맥)구마>페이즈는 업그레이드다,,씨맥)구마>페이즈는 업그레이드다,2025-11-23T18:51:07
dcinside_리그오브레전드_갤러리,내년 롤파크 ㄹㅇ 개좆된 이유...,이젠 막아줄 사람도 없어서 ㄹㅇ 벽 부셔지게 생김....,내년 롤파크 ㄹㅇ 개좆된 이유... 이젠 막아줄 사람도 없어서 ㄹㅇ 벽 부셔지게 생김....,2025-11-23T18:51:02
dcinside_리그오브레전드_갤러리,쮀맘 구맘 시빌워 기대되농,내년은 내내 한생갤에서 놀아야지,쮀맘 구맘 시빌워 기대되농 내년은 내내 한생갤에서 놀아야지,2025-11-23T18:51:02
dcinside_리그오브레전드_갤러리,피어리스 ㅈ노잼인데 안하면 안되냐?,다전제 가면 3세트부터 똥냄새 존나 나서 재미가 없어 페이커 우승해서 피어리스 이전기록 어쩌구 지랄도 못할테니까 제발 옛날로 다시 돌려줘,피어리스 ㅈ노잼인데 안하면 안되냐? 다전제 가면 3세트부터 똥냄새 존나 나서 재미가 없어 페이커 우승해서 피어리스 이전기록 어쩌구 지랄도 못할테니까 제발 옛날로 다시 돌려줘,2025-11-23T18:51:01
dcinside_리그오브레전드_갤러리,축리웹 피싸개 만선인게 구마유시 최애 이딴게 인기글 가잖아,아휴 피냄새 씨발 역겨워라,축리웹 피싸개 만선인게 구마유시 최애 이딴게 인기글 가잖아 아휴 피냄새 씨발 역겨워라,2025-11-23T18:50:47
dcinside_리그오브레전드_갤러리,씨맥이 구마유시 개무시했데,"://./?=7 씨맥 ‘1 페이즈 3년계약은 업그레이드’ 구마유시 무시 발언 여러분들의 생각은? 에서 마음에 드는 동영상과 음악을 감상하고, 직접 만든 콘텐츠를 업로드하여 친구, 가족뿐 아니라 전 세계 사람들과 콘텐츠를 공유할 수 있습니다. .","씨맥이 구마유시 개무시했데 ://./?=7 씨맥 ‘1 페이즈 3년계약은 업그레이드’ 구마유시 무시 발언 여러분들의 생각은? 에서 마음에 드는 동영상과 음악을 감상하고, 직접 만든 콘텐츠를 업로드하여 친구, 가족뿐 아니라 전 세계 사람들과 콘텐츠를 공유할 수 있습니다. .",2025-11-23T18:50:34
dcinside_리그오브레전드_갤러리,카이팅 못하고 근접탱커만 하는 새끼들이 원딜할때 꺼내는게 직슨데,구 <<<< 이새낀 대체 정체가 뭐임? 그렇다고 또 메카닉 요구하는 제이카도 못함 진짜 조온나게 까다로운 놈이노 ㅋㅋ,카이팅 못하고 근접탱커만 하는 새끼들이 원딜할때 꺼내는게 직슨데 구 <<<< 이새낀 대체 정체가 뭐임? 그렇다고 또 메카닉 요구하는 제이카도 못함 진짜 조온나게 까다로운 놈이노 ㅋㅋ,2025-11-23T18:50:33
dcinside_리그오브레전드_갤러리,국대 기인 오너 페/쵸 바이퍼 듀로 ← 어떰,미드는 솔까 미필 못뽑을듯 나머지는 그냥 미필중에 뽑았는데 저대로면 금메달 가능?,국대 기인 오너 페/쵸 바이퍼 듀로 ← 어떰 미드는 솔까 미필 못뽑을듯 나머지는 그냥 미필중에 뽑았는데 저대로면 금메달 가능?,2025-11-23T18:50:31
dcinside_리그오브레전드_갤러리,아겜 미드는 솔직히 쵸비가 가야함,비디디 팀원 좋으면 오히려 지가 못함 페이커 외부일정 때문에 바쁘고 내년부터 몸관리 해야함 제카 포함 다른 미드 개못해서 중국한테 질 가능성 높음 미드는 쵸비다,아겜 미드는 솔직히 쵸비가 가야함 비디디 팀원 좋으면 오히려 지가 못함 페이커 외부일정 때문에 바쁘고 내년부터 몸관리 해야함 제카 포함 다른 미드 개못해서 중국한테 질 가능성 높음 미드는 쵸비다,2025-11-23T18:50:22
dcinside_리그오브레전드_갤러리,티원 이제 이 조합 쓸 수 있노,ㄹㅇ 개무서웠는데 ㅋㅋㅋ,티원 이제 이 조합 쓸 수 있노 ㄹㅇ 개무서웠는데 ㅋㅋㅋ,2025-11-23T18:50:22
dcinside_리그오브레전드_갤러리,바이퍼 안나왔으면 구좆은 어디로 갔냐?,는 돈 없고 디플?,바이퍼 안나왔으면 구좆은 어디로 갔냐? 는 돈 없고 디플?,2025-11-23T18:50:17
dcinside_리그오브레전드_갤러리,쓰리핏파엠 역체원 구마유시 한화종신바라면 개추,티원은 눈물머금고 페이즈나 써야지 ㄹㅇ,쓰리핏파엠 역체원 구마유시 한화종신바라면 개추 티원은 눈물머금고 페이즈나 써야지 ㄹㅇ,2025-11-23T18:50:11
dcinside_리그오브레전드_갤러리,올해의 선수가 도란인 이유,월즈끝날때까지 도란으로 월즈 우승하기 이게 가능한지 전문가도 몰랐고 슼갈도 몰랐음ㅋㅋ,올해의 선수가 도란인 이유 월즈끝날때까지 도란으로 월즈 우승하기 이게 가능한지 전문가도 몰랐고 슼갈도 몰랐음ㅋㅋ,2025-11-23T18:50:03
dcinside_리그오브레전드_갤러리,칼바람 아수라장 버그있나,쿨타임 있는 증강 빼고 바로 얻어지는 증강 두번씩 먹어지는데 이거 버근가 치명타 50% 두개 받아서 100되고 전환 프리즘 두개 받아서 프리즘 두개 됨,칼바람 아수라장 버그있나 쿨타임 있는 증강 빼고 바로 얻어지는 증강 두번씩 먹어지는데 이거 버근가 치명타 50% 두개 받아서 100되고 전환 프리즘 두개 받아서 프리즘 두개 됨,2025-11-23T18:50:03
dcinside_리그오브레전드_갤러리,딜라이트 때문에 한화는 답이 없음 ㅇㅇ,라인전 폭파는 꿈도 못꾸게될거라 구마의 유일한 장점 사라지고 그렇게 똥치워도 딜라이트가 가져다 줄 리턴이 크지 않음 결국 남는건 절망적인 구마의 후반뿐임 ㅇㅇ,딜라이트 때문에 한화는 답이 없음 ㅇㅇ 라인전 폭파는 꿈도 못꾸게될거라 구마의 유일한 장점 사라지고 그렇게 똥치워도 딜라이트가 가져다 줄 리턴이 크지 않음 결국 남는건 절망적인 구마의 후반뿐임 ㅇㅇ,2025-11-23T18:50:02
dcinside_리그오브레전드_갤러리,클템 롤알못임?,념글 구마유시 환상적인 핑퐁 한타라는데 왜 케리아는 고개 흔든거임 누가 맞는거임,클템 롤알못임? 념글 구마유시 환상적인 핑퐁 한타라는데 왜 케리아는 고개 흔든거임 누가 맞는거임,2025-11-23T18:49:55
dcinside_리그오브레전드_갤러리,쵸비랑 케리아랑 데뷔 1년차이밖에 안나는거,알고있었냐 둘다 왜 항상 신인같지?,쵸비랑 케리아랑 데뷔 1년차이밖에 안나는거 알고있었냐 둘다 왜 항상 신인같지?,2025-11-23T18:49:53
dcinside_리그오브레전드_갤러리,젠첩들근데 양심있노 느원페는 안하노 ㅋㅋㅋㅋㅋㅋㅋㅋ,젠첩인증마크 확실하노,젠첩들근데 양심있노 느원페는 안하노 ㅋㅋㅋㅋㅋㅋㅋㅋ 젠첩인증마크 확실하노,2025-11-23T18:49:50
dcinside_리그오브레전드_갤러리,롤팀 팬덤중에 피냄새 안나는 팀은 없냐??,피싸개 아줌마들 그냥 존나 역겨운데 동부 개버러지 팀들 말고 그나마 남초인게 젠지임?,롤팀 팬덤중에 피냄새 안나는 팀은 없냐?? 피싸개 아줌마들 그냥 존나 역겨운데 동부 개버러지 팀들 말고 그나마 남초인게 젠지임?,2025-11-23T18:49:48
dcinside_리그오브레전드_갤러리,티원은 툴이 늘었지 하고싶었던 운영 다 하게 되었음,ㅋㅋㅋㅋㅋ,티원은 툴이 늘었지 하고싶었던 운영 다 하게 되었음 ㅋㅋㅋㅋㅋ,2025-11-23T18:49:45
dcinside_리그오브레전드_갤러리,법무법인 실시@간기자...,,법무법인 실시@간기자...,2025-11-23T18:49:38
dcinside_리그오브레전드_갤러리,어자피 이판은 길게봐야 3년임,즙 은퇴 팔팔이 은퇴 향러 은퇴 응디디 은퇴 훠즈 은퇴 개니언 은퇴 낀낀이 은퇴 숏습이 은퇴 누굴 빠노??ㅋㅋㅋㅋㅋ,어자피 이판은 길게봐야 3년임 즙 은퇴 팔팔이 은퇴 향러 은퇴 응디디 은퇴 훠즈 은퇴 개니언 은퇴 낀낀이 은퇴 숏습이 은퇴 누굴 빠노??ㅋㅋㅋㅋㅋ,2025-11-23T18:49:37
dcinside_리그오브레전드_갤러리,거품 싹 빠지는 월즈시즌이였음,평소 올려쳐지는 애들 싹다 거품빠짐 제우스 << 암베사로 기인 그웬한테 솔킬당하고 8강딱 기인 << 아트록스로 퍼펙트 크산테한테 솔킬 요릭도망후 오른한테 영향력 밀리며 4강딱 쵸비 << 카시 카운터 메타픽 애니비아 들고도 미드차이나서 4강딱 룰러 << 덕담 상대로 원딜차이나서 1세트 대역전패 아타칸에서 루시안으로 카시궁 맞고 돌되며 선채로 사망,거품 싹 빠지는 월즈시즌이였음 평소 올려쳐지는 애들 싹다 거품빠짐 제우스 << 암베사로 기인 그웬한테 솔킬당하고 8강딱 기인 << 아트록스로 퍼펙트 크산테한테 솔킬 요릭도망후 오른한테 영향력 밀리며 4강딱 쵸비 << 카시 카운터 메타픽 애니비아 들고도 미드차이나서 4강딱 룰러 << 덕담 상대로 원딜차이나서 1세트 대역전패 아타칸에서 루시안으로 카시궁 맞고 돌되며 선채로 사망,2025-11-23T18:49:35
dcinside_리그오브레전드_갤러리,이러다가 한화구마유시 아니면 진짜 구맘들 진짜 좌절하겠노 ㅋㅋ,새로오는 감독이 챔프풀 문제 있는 어느정도 감당할수있냐에 따라서 내년 운명이 결정될거 같은데 ㅋㅋ,이러다가 한화구마유시 아니면 진짜 구맘들 진짜 좌절하겠노 ㅋㅋ 새로오는 감독이 챔프풀 문제 있는 어느정도 감당할수있냐에 따라서 내년 운명이 결정될거 같은데 ㅋㅋ,2025-11-23T18:49:33
dcinside_리그오브레전드_갤러리,근데 이러고 구마 못하면 진짜 바로 티응갤 축제될거같은데,난 아직 시작도 안 됐다고 봄 리그 가서 박으면 그때부터 ㄹㅇ 지옥일듯,근데 이러고 구마 못하면 진짜 바로 티응갤 축제될거같은데 난 아직 시작도 안 됐다고 봄 리그 가서 박으면 그때부터 ㄹㅇ 지옥일듯,2025-11-23T18:49:30
dcinside_리그오브레전드_갤러리,젠지가 향러 버리고 디아블 사와서,티원 페이즈 젠지 디아블 ㄱㄱ,젠지가 향러 버리고 디아블 사와서 티원 페이즈 젠지 디아블 ㄱㄱ,2025-11-23T18:49:28
dcinside_리그오브레전드_갤러리,씨맥이 페이즈가 구마보다 롤 훨씬 잘한데,"://./?=7 씨맥 ‘1 페이즈 3년계약은 업그레이드’ 구마유시 무시 발언 여러분들의 생각은? 에서 마음에 드는 동영상과 음악을 감상하고, 직접 만든 콘텐츠를 업로드하여 친구, 가족뿐 아니라 전 세계 사람들과 콘텐츠를 공유할 수 있습니다. .","씨맥이 페이즈가 구마보다 롤 훨씬 잘한데 ://./?=7 씨맥 ‘1 페이즈 3년계약은 업그레이드’ 구마유시 무시 발언 여러분들의 생각은? 에서 마음에 드는 동영상과 음악을 감상하고, 직접 만든 콘텐츠를 업로드하여 친구, 가족뿐 아니라 전 세계 사람들과 콘텐츠를 공유할 수 있습니다. .",2025-11-23T18:49:22
dcinside_리그오브레전드_갤러리,근데 왜 바텀 바꾸는거임?,한번더 해봐도 되지않나?,근데 왜 바텀 바꾸는거임? 한번더 해봐도 되지않나?,2025-11-23T18:49:14
dcinside_리그오브레전드_갤러리,한화 상대할 때 구마 5밴 때리면 아무것도 못하잖아,ㅈㄴ 쉽겟노 ㅋㅋ,한화 상대할 때 구마 5밴 때리면 아무것도 못하잖아 ㅈㄴ 쉽겟노 ㅋㅋ,2025-11-23T18:49:10
dcinside_리그오브레전드_갤러리,올해의 선수는 구마유시일 수 밖에 없음,선수 및 관계자들은 악플 다발에 받는 스트레스를 더 잘느끼고 그 고통을 알고 있음 근데 악플을 넘어선 화환에 다니는 교회에 시위까지 오는걸 참고 견딘다? 이 것만으로 리스펙인데 월즈 쓰리핏에 파엠?? 걍 관계자들이면 무사정발기임,올해의 선수는 구마유시일 수 밖에 없음 선수 및 관계자들은 악플 다발에 받는 스트레스를 더 잘느끼고 그 고통을 알고 있음 근데 악플을 넘어선 화환에 다니는 교회에 시위까지 오는걸 참고 견딘다? 이 것만으로 리스펙인데 월즈 쓰리핏에 파엠?? 걍 관계자들이면 무사정발기임,2025-11-23T18:49:02
dcinside_리그오브레전드_갤러리,티원 이제 직스 쓸 수 있는게 크다,남들 다 잘 쓰는데 계속 아쉽긴했지,티원 이제 직스 쓸 수 있는게 크다 남들 다 잘 쓰는데 계속 아쉽긴했지,2025-11-23T18:49:01
dcinside_리그오브레전드_갤러리,주카이피셜 구마유시 ㅋㅋㅋㅋㅋㅋ,,주카이피셜 구마유시 ㅋㅋㅋㅋㅋㅋ,2025-11-23T18:48:59
dcinside_리그오브레전드_갤러리,구버지<<<직스 못하는거 신기함,바루스 진이 시그니처픽인데 직스는 왜못하냐,구버지<<<직스 못하는거 신기함 바루스 진이 시그니처픽인데 직스는 왜못하냐,2025-11-23T18:48:48
dcinside_리그오브레전드_갤러리,중국한테 고개숙이는 쪽바리 외무성 국장,대국한테깝치면 이렇게되는거구나,중국한테 고개숙이는 쪽바리 외무성 국장 대국한테깝치면 이렇게되는거구나,2025-11-23T18:48:42
dcinside_리그오브레전드_갤러리,근데 구마유시 << 이새끼가 오케 얘네보다 멋있는놈이지,오케 얜 페이커 옆에서 계속 꿀빨겠단 마인드 구마는 페이커 없이 커리어 만들어보겠다는 마인드 ㅇㅇ,근데 구마유시 << 이새끼가 오케 얘네보다 멋있는놈이지 오케 얜 페이커 옆에서 계속 꿀빨겠단 마인드 구마는 페이커 없이 커리어 만들어보겠다는 마인드 ㅇㅇ,2025-11-23T18:48:31
dcinside_리그오브레전드_갤러리,젠꺼기들 논리가 웃긴점,바텀 라인전 6할이 서폿인데 구케 털어먹고 우승하던 페리에서 리헨즈는 개폐급 서폿 범인몰이 하고 내쫓고 나서 하는 말이 페케 면 구케보다 구려진다함 ㅋㅋㅋㅋㅋㅋ 리헨즈가 ㅂㅅ인거야 ㅂㅅ이 아닌거야 하나만 해라 하나만 ㅋㅋㅋ,젠꺼기들 논리가 웃긴점 바텀 라인전 6할이 서폿인데 구케 털어먹고 우승하던 페리에서 리헨즈는 개폐급 서폿 범인몰이 하고 내쫓고 나서 하는 말이 페케 면 구케보다 구려진다함 ㅋㅋㅋㅋㅋㅋ 리헨즈가 ㅂㅅ인거야 ㅂㅅ이 아닌거야 하나만 해라 하나만 ㅋㅋㅋ,2025-11-23T18:48:28
dcinside_리그오브레전드_갤러리,그냥 지금 젠지가 팀 쵸비임 탑미드원딜 싹다 새가슴,ㅇㅇ,그냥 지금 젠지가 팀 쵸비임 탑미드원딜 싹다 새가슴 ㅇㅇ,2025-11-23T18:48:21
dcinside_리그오브레전드_갤러리,방출은 이 씹새끼들이 구버지가 제발로 나간거라니까?,뒷난 뒷턱에 감코진까지 뒷담이나 쳐하는 홍어새끼들 냄새를 견딜 수 없어서 더러운 똥 더 묻기 전에 스스로 나간거임 음해하지마라,방출은 이 씹새끼들이 구버지가 제발로 나간거라니까? 뒷난 뒷턱에 감코진까지 뒷담이나 쳐하는 홍어새끼들 냄새를 견딜 수 없어서 더러운 똥 더 묻기 전에 스스로 나간거임 음해하지마라,2025-11-23T18:48:20
dcinside_리그오브레전드_갤러리,이런 갤러리도 있네,페독 피해자 갤러리,이런 갤러리도 있네 페독 피해자 갤러리,2025-11-23T18:48:17
dcinside_리그오브레전드_갤러리,)구좆 챔피언 실력 정리,"ㅆㅅㅌㅊ:자야,바루스,진,칼리 ㅅㅌㅊ:루시안,닐라,케이틀린 ㅍㅌㅊ:애쉬,시비르,세나 ㅎㅌㅊ:코르키,드븐 징크스 아펠 ㅆㅎㅌㅊ:제이카유직 트타 스몰더 베인 억까 없지?",")구좆 챔피언 실력 정리 ㅆㅅㅌㅊ:자야,바루스,진,칼리 ㅅㅌㅊ:루시안,닐라,케이틀린 ㅍㅌㅊ:애쉬,시비르,세나 ㅎㅌㅊ:코르키,드븐 징크스 아펠 ㅆㅎㅌㅊ:제이카유직 트타 스몰더 베인 억까 없지?",2025-11-23T18:48:17
dcinside_리그오브레전드_갤러리,히라이랑 키드밀리랑 친한 거 첨에 알고 ㅈㄴ 놀랏는데,ㄹㅇ,히라이랑 키드밀리랑 친한 거 첨에 알고 ㅈㄴ 놀랏는데 ㄹㅇ,2025-11-23T18:48:17
dcinside_리그오브레전드_갤러리,쵸비나 룰러같이 아겜 한번 나간놈들은 또 안나갈려하지 메리트가없는데,이미 군면제고 나가서 혹시 지면 욕만 오지게 개처먹을텐데ㅋㅋㅋㅋㅋㅋㅋㅋㅋ 3판2선승제라 무조건 이긴다는 보장도없는데 까딱 잘못하면 그냥 ㅈ대는거임,쵸비나 룰러같이 아겜 한번 나간놈들은 또 안나갈려하지 메리트가없는데 이미 군면제고 나가서 혹시 지면 욕만 오지게 개처먹을텐데ㅋㅋㅋㅋㅋㅋㅋㅋㅋ 3판2선승제라 무조건 이긴다는 보장도없는데 까딱 잘못하면 그냥 ㅈ대는거임,2025-11-23T18:48:12
dcinside_리그오브레전드_갤러리,근데 구맘 응갤 거르고 올선은 진지하게 구마가 높지않음?,ㅇㅇ,근데 구맘 응갤 거르고 올선은 진지하게 구마가 높지않음? ㅇㅇ,2025-11-23T18:48:11
dcinside_리그오브레전드_갤러리,냉정하게 슼갈이 갤먹고 피냄새 나서 좆노잼 되긴함,좆즙이 욕먹을때 롤갤이 롤대남 만선이라 갈드컵 아닌글도 꿀잼 념글 나옴,냉정하게 슼갈이 갤먹고 피냄새 나서 좆노잼 되긴함 좆즙이 욕먹을때 롤갤이 롤대남 만선이라 갈드컵 아닌글도 꿀잼 념글 나옴,2025-11-23T18:48:07
dcinside_리그오브레전드_갤러리,구버지<<<객기로 제이카쓰다 성적 조지는거 아니냐,카이사는 그럭저럭하던데 이즈는 진짜 못하더라,구버지<<<객기로 제이카쓰다 성적 조지는거 아니냐 카이사는 그럭저럭하던데 이즈는 진짜 못하더라,2025-11-23T18:48:00
dcinside_리그오브레전드_갤러리,근데 원딜이 직스를 못할수가 있냐?,따른 라인들이 원딜 걸렸을때 꺼내는게 직스인데,근데 원딜이 직스를 못할수가 있냐? 따른 라인들이 원딜 걸렸을때 꺼내는게 직스인데,2025-11-23T18:47:59
dcinside_리그오브레전드_갤러리,확실한건 젠지보다 한화가 월즈가면 더 순위높을듯,한화로스터에 새가슴은 없잖아,확실한건 젠지보다 한화가 월즈가면 더 순위높을듯 한화로스터에 새가슴은 없잖아,2025-11-23T18:47:54
dcinside_리그오브레전드_갤러리,"응갤 차원이 3차원이면, 구줌 정신은 4차원 넘사",응갤은 그래도 팀이란 개념이라도 있는데 구줌은 아예 팀이란 개념 자체도 없음 오로지 구마 학부모,"응갤 차원이 3차원이면, 구줌 정신은 4차원 넘사 응갤은 그래도 팀이란 개념이라도 있는데 구줌은 아예 팀이란 개념 자체도 없음 오로지 구마 학부모",2025-11-23T18:47:48
dcinside_리그오브레전드_갤러리,근데 이 말했던 젠첩들 다 ㅇㄷ감?,"""도란 달고는 절대 월즈 못먹는다"" 라고 수년간 이 말했던 젠첩들 다 어디갔음","근데 이 말했던 젠첩들 다 ㅇㄷ감? ""도란 달고는 절대 월즈 못먹는다"" 라고 수년간 이 말했던 젠첩들 다 어디갔음",2025-11-23T18:47:42
dcinside_리그오브레전드_갤러리,젠첩들 왜 이번엔 티원 페이즈 조롱안함?,왜 도란때랑 분위기가 다른거임?,젠첩들 왜 이번엔 티원 페이즈 조롱안함? 왜 도란때랑 분위기가 다른거임?,2025-11-23T18:47:38
dcinside_리그오브레전드_갤러리,도오페 복기 방송 울프가 진행하냐 ?,ㄹㅇ?,도오페 복기 방송 울프가 진행하냐 ? ㄹㅇ?,2025-11-23T18:47:36
dcinside_리그오브레전드_갤러리,칰갤 존나 웃기노 구맘들이랑 벌써 기싸움하노 ㅋㅋㅋ,내년에 케오 풀린다고 분탕치다가 기싸움하고 있노,칰갤 존나 웃기노 구맘들이랑 벌써 기싸움하노 ㅋㅋㅋ 내년에 케오 풀린다고 분탕치다가 기싸움하고 있노,2025-11-23T18:47:30
dcinside_리그오브레전드_갤러리,응 느탑쮀~ ㅋㅋㅋㅋㅋ 응 느원구~ ㅋㅋㅋㅋㅋ,,응 느탑쮀~ ㅋㅋㅋㅋㅋ 응 느원구~ ㅋㅋㅋㅋㅋ,2025-11-23T18:47:30
dcinside_리그오브레전드_갤러리,도란은 못하는게 아님,혼자 이상한 각을 보고 그대로 뒤지는게 문제 잘하긴함,도란은 못하는게 아님 혼자 이상한 각을 보고 그대로 뒤지는게 문제 잘하긴함,2025-11-23T18:47:23
dcinside_리그오브레전드_갤러리,한화가 딱히 구마때문에 망하는건아님,내가보기엔 한화라인업이 그냥 전부 구마급임,한화가 딱히 구마때문에 망하는건아님 내가보기엔 한화라인업이 그냥 전부 구마급임,2025-11-23T18:47:17
dcinside_리그오브레전드_갤러리,군면제 이미 된 애들은 아겜 차출 메리트가 있긴 하냐?,아겜 나간다고 우승 보장도 아니고,군면제 이미 된 애들은 아겜 차출 메리트가 있긴 하냐? 아겜 나간다고 우승 보장도 아니고,2025-11-23T18:47:15
dcinside_리그오브레전드_갤러리,근데 티원밴픽은 진짜 좋아지긴하겟노,솔직히 티원이 요네밴하는거빼곤 이제 걸릴기없네,근데 티원밴픽은 진짜 좋아지긴하겟노 솔직히 티원이 요네밴하는거빼곤 이제 걸릴기없네,2025-11-23T18:47:13
dcinside_리그오브레전드_갤러리,와꾸 ㅁㅌㅊ냐,,와꾸 ㅁㅌㅊ냐,2025-11-23T18:47:07
