community,title,content,full_text,posted_at
dcinside_리그오브레전드_갤러리,ㄹㅇ 간만에 리그 재밌겠네,젠지도 스폰지밥이었으면 ㅈㄴ 재밌엇을 거 같은데 노잼지는 스토브리그부터 그냥,ㄹㅇ 간만에 리그 재밌겠네 젠지도 스폰지밥이었으면 ㅈㄴ 재밌엇을 거 같은데 노잼지는 스토브리그부터 그냥,2025-11-23T12:38:48
dcinside_리그오브레전드_갤러리,페이커는 왜 랑 리그 못먹음? 바텀패치없으면 새가슴임?!,아니면 바텀 패치없으면 본인 쓰레기 실력 커버를 못해주는건가 바텀이?,페이커는 왜 랑 리그 못먹음? 바텀패치없으면 새가슴임?! 아니면 바텀 패치없으면 본인 쓰레기 실력 커버를 못해주는건가 바텀이?,2025-11-23T12:38:41
dcinside_리그오브레전드_갤러리,월즈를 먹으려면 쫄면 안되는듯,실력별개로 새가슴이면 못먹는 것 같음,월즈를 먹으려면 쫄면 안되는듯 실력별개로 새가슴이면 못먹는 것 같음,2025-11-23T12:38:38
dcinside_리그오브레전드_갤러리,원딜중에 챔프폭 논란 진짜 구마유시만 있는거 아닌가,,원딜중에 챔프폭 논란 진짜 구마유시만 있는거 아닌가,2025-11-23T12:38:38
dcinside_리그오브레전드_갤러리,역체미 페이커 맞아 근데 나는 쵸비쓸게,김정균,역체미 페이커 맞아 근데 나는 쵸비쓸게 김정균,2025-11-23T12:38:33
dcinside_리그오브레전드_갤러리,한생갤은 처음에 피넛욕 존나하고 방출하니마니하다가,한전드로 갑자기 빨아재끼는건 뭐냐,한생갤은 처음에 피넛욕 존나하고 방출하니마니하다가 한전드로 갑자기 빨아재끼는건 뭐냐,2025-11-23T12:38:25
dcinside_리그오브레전드_갤러리,올해의 탈출상,,올해의 탈출상,2025-11-23T12:38:16
dcinside_리그오브레전드_갤러리,젠첩들아 그거 해봐 그거 ㅋㅋㅋㅋ,느원페 ㅋㅋ ¤,젠첩들아 그거 해봐 그거 ㅋㅋㅋㅋ 느원페 ㅋㅋ ¤,2025-11-23T12:38:11
dcinside_리그오브레전드_갤러리,근데 바이퍼도 1년만에 튄거보면,제우스있는데 카이사는 하기 힘들긴 함,근데 바이퍼도 1년만에 튄거보면 제우스있는데 카이사는 하기 힘들긴 함,2025-11-23T12:38:11
dcinside_리그오브레전드_갤러리,라이즈딱은 정해진거지?,티젠한클농 그외 나머지,라이즈딱은 정해진거지? 티젠한클농 그외 나머지,2025-11-23T12:38:08
dcinside_리그오브레전드_갤러리,딮기는 딱 컵 중반까지만 강한 팀인게,작년에도 베릴 복귀했다고 컵 시작도전에 이미 25월즈 우승 선언했다가 호랑이한테 물어뜯기고 빈사됐던데 그 폼이 1년간 지속됐음,딮기는 딱 컵 중반까지만 강한 팀인게 작년에도 베릴 복귀했다고 컵 시작도전에 이미 25월즈 우승 선언했다가 호랑이한테 물어뜯기고 빈사됐던데 그 폼이 1년간 지속됐음,2025-11-23T12:37:55
dcinside_리그오브레전드_갤러리,근데 내년엔 한화가 그슬각 보이기도 함 ㅇㅈ?,응 나만 인정,근데 내년엔 한화가 그슬각 보이기도 함 ㅇㅈ? 응 나만 인정,2025-11-23T12:37:42
dcinside_리그오브레전드_갤러리,구좆은 이즈 못하는게 ㄹㅇ 치명타긴함,티원이라 이즈못하는거 크게 티안난거지 다른데가면 심할거임 진짜로,구좆은 이즈 못하는게 ㄹㅇ 치명타긴함 티원이라 이즈못하는거 크게 티안난거지 다른데가면 심할거임 진짜로,2025-11-23T12:37:31
dcinside_리그오브레전드_갤러리,못난 뒷난이를 그래도 사랑하겠다,,못난 뒷난이를 그래도 사랑하겠다,2025-11-23T12:37:27
dcinside_리그오브레전드_갤러리,케리아 대체불가 맞지 ㅅㅂ 페독들 존나 나대네,그럼 뭐 이번 월즈우승 페이커가 잘해서 우승했냐 ㅋㅋ 그만 나대라 페이커만큼 하는 미드는 널렸지만 케리아만큼 하는 서폿은 없다,케리아 대체불가 맞지 ㅅㅂ 페독들 존나 나대네 그럼 뭐 이번 월즈우승 페이커가 잘해서 우승했냐 ㅋㅋ 그만 나대라 페이커만큼 하는 미드는 널렸지만 케리아만큼 하는 서폿은 없다,2025-11-23T12:37:11
dcinside_리그오브레전드_갤러리,내년 티원 도란 팽하고 쮀 리턴 할 것 같냐?,도란 올해 군 문제 해결 못하면 높은 확률로 리턴 아님?,내년 티원 도란 팽하고 쮀 리턴 할 것 같냐? 도란 올해 군 문제 해결 못하면 높은 확률로 리턴 아님?,2025-11-23T12:37:05
dcinside_리그오브레전드_갤러리,구나라는 패배의 아이콘이고,벽플박제까지 야무지게 한 승률 병신 픽인데 유나라 할만큼 한다는 올려치기는 또 뭔 음흉한 새끼들이냐,구나라는 패배의 아이콘이고 벽플박제까지 야무지게 한 승률 병신 픽인데 유나라 할만큼 한다는 올려치기는 또 뭔 음흉한 새끼들이냐,2025-11-23T12:37:05
dcinside_리그오브레전드_갤러리,페이커는 케리아 없이 최근 증명한적 있냐,이니시 오더보조 해주는게 누군데 케리아를 깜?,페이커는 케리아 없이 최근 증명한적 있냐 이니시 오더보조 해주는게 누군데 케리아를 깜?,2025-11-23T12:37:00
dcinside_리그오브레전드_갤러리,루시드 티원이었다면,페이커한테 저랬으면 바로 케리아가 머리 내리쳤을 듯 ㄹㅇ로,루시드 티원이었다면 페이커한테 저랬으면 바로 케리아가 머리 내리쳤을 듯 ㄹㅇ로,2025-11-23T12:36:56
dcinside_리그오브레전드_갤러리,솔직히 구마 카이사 ㅈㄴ 못하긴 했읔,올해 간신히 깎인 거지 개폐급 수준 맞았음 제우스도 올해 간신히 탱커 좀 깎이더라 딱 제우스 탱커만큼 깎이긴 함 구마 카이사도,솔직히 구마 카이사 ㅈㄴ 못하긴 했읔 올해 간신히 깎인 거지 개폐급 수준 맞았음 제우스도 올해 간신히 탱커 좀 깎이더라 딱 제우스 탱커만큼 깎이긴 함 구마 카이사도,2025-11-23T12:36:52
dcinside_리그오브레전드_갤러리,케리아없는 구좆 브론즈원딜 누가 더잘함?,후자가 개텀?,케리아없는 구좆 브론즈원딜 누가 더잘함? 후자가 개텀?,2025-11-23T12:36:43
dcinside_리그오브레전드_갤러리,칰갈들 진짜 불쌍하네 바이퍼>구좆은 역체감 심할텐디,더 안된건 그러고도 욕은 팀이 다 들어쳐먹는다는거임 우리가 그랬어,칰갈들 진짜 불쌍하네 바이퍼>구좆은 역체감 심할텐디 더 안된건 그러고도 욕은 팀이 다 들어쳐먹는다는거임 우리가 그랬어,2025-11-23T12:36:28
dcinside_리그오브레전드_갤러리,솔직히 페이커 제외 제오구케는,커리어에서 월즈 우승 -1씩 해야됨 ㅇㅈ? 페이커없이 증명해라,솔직히 페이커 제외 제오구케는 커리어에서 월즈 우승 -1씩 해야됨 ㅇㅈ? 페이커없이 증명해라,2025-11-23T12:36:28
dcinside_리그오브레전드_갤러리,구마유시가 기괴한게 이즈를 못하는데 루시안을 잘함,이게 존나 기괴함 원래 이즈가 원딜 입문용 챔이고 루시안은 진짜 사거리부터 난이도 극악챔프인데 단순히 루시안 스킬셋이 평타랑 비슷하다는 이유만으로 루시안을 잘하고 이즈를 못함 ㅋㅋ,구마유시가 기괴한게 이즈를 못하는데 루시안을 잘함 이게 존나 기괴함 원래 이즈가 원딜 입문용 챔이고 루시안은 진짜 사거리부터 난이도 극악챔프인데 단순히 루시안 스킬셋이 평타랑 비슷하다는 이유만으로 루시안을 잘하고 이즈를 못함 ㅋㅋ,2025-11-23T12:36:19
dcinside_리그오브레전드_갤러리,솔직히 내년 는 딮기가 다크호스 역할하면서 역배 떠뜨려야 재밌긴할듯,ㅋㅋㅋㅋ 솔직히 정배는 10위딱이지만 ㄹㅇ,솔직히 내년 는 딮기가 다크호스 역할하면서 역배 떠뜨려야 재밌긴할듯 ㅋㅋㅋㅋ 솔직히 정배는 10위딱이지만 ㄹㅇ,2025-11-23T12:36:11
dcinside_리그오브레전드_갤러리,탑쵸비 노래를 불러봤자 걍 지금 기인 보면 탑쵸비의 미래임,스찌 열심히 하면서 더블엘리빨로 멘탈 챙기면서 겜하면 어찌어찌 우승 먹는데 월즈같이 벼랑끝 승부 몇번 하면 바로 퍼펙트한테 쳐발리고 요릭으로 도망가는 모습 나옴 그냥 둘이 비슷함 그래서 서로 재계약조건을 잡았나봐,탑쵸비 노래를 불러봤자 걍 지금 기인 보면 탑쵸비의 미래임 스찌 열심히 하면서 더블엘리빨로 멘탈 챙기면서 겜하면 어찌어찌 우승 먹는데 월즈같이 벼랑끝 승부 몇번 하면 바로 퍼펙트한테 쳐발리고 요릭으로 도망가는 모습 나옴 그냥 둘이 비슷함 그래서 서로 재계약조건을 잡았나봐,2025-11-23T12:36:07
dcinside_리그오브레전드_갤러리,자꾸 페까한테 먹이주는 구좆은 방출시키는게 맞음,롤은 존나게 잘하는 것도 아니고 ㅇㅇ,자꾸 페까한테 먹이주는 구좆은 방출시키는게 맞음 롤은 존나게 잘하는 것도 아니고 ㅇㅇ,2025-11-23T12:35:56
dcinside_리그오브레전드_갤러리,페이커는 케리아 없이 증명해야되는데,비겁하게 케리아 버스만큼은 절대사수하는듯,페이커는 케리아 없이 증명해야되는데 비겁하게 케리아 버스만큼은 절대사수하는듯,2025-11-23T12:35:51
dcinside_리그오브레전드_갤러리,르블랑 서폿 이즈 서폿은 역천괴만 할수있는거야,클템도 인정한 역천괴를 니들이 뭐라고 내려침? 니들이 클템보다 롤 잘알아? 월즈 먹어보긴 했어? 한낱 롤붕이 주제에 함부로 나대는게 아니다 ㅉㅉ,르블랑 서폿 이즈 서폿은 역천괴만 할수있는거야 클템도 인정한 역천괴를 니들이 뭐라고 내려침? 니들이 클템보다 롤 잘알아? 월즈 먹어보긴 했어? 한낱 롤붕이 주제에 함부로 나대는게 아니다 ㅉㅉ,2025-11-23T12:35:48
dcinside_리그오브레전드_갤러리,근데 저런 티원을 결승에서 막은 22는 뭐냐?,도대체 얼마나 강했던거임 ㄷㄷ... 무슨 소원 하나 들어주고 흩어진 드래곤볼 마냥 ㄹㅇ 딱 고점 찍고 흩어짐,근데 저런 티원을 결승에서 막은 22는 뭐냐? 도대체 얼마나 강했던거임 ㄷㄷ... 무슨 소원 하나 들어주고 흩어진 드래곤볼 마냥 ㄹㅇ 딱 고점 찍고 흩어짐,2025-11-23T12:35:45
dcinside_리그오브레전드_갤러리,케리아 정석폿 안 된다는 프레임은 왜 씌우는 거?,2023 아샨 게임만 봐도 주구장창 정석폿 했는데 ㅋㅋ,케리아 정석폿 안 된다는 프레임은 왜 씌우는 거? 2023 아샨 게임만 봐도 주구장창 정석폿 했는데 ㅋㅋ,2025-11-23T12:35:16
dcinside_리그오브레전드_갤러리,티원한화 현재상황,,티원한화 현재상황,2025-11-23T12:35:10
dcinside_리그오브레전드_갤러리,심호흡을 배운 도란<<< 어케 막음?,심호흡 배우고 월즈 먹어서 주사위 고점만 뜨는 도란 + 하이퍼캐리 페이즈 조합 어케 막음???,심호흡을 배운 도란<<< 어케 막음? 심호흡 배우고 월즈 먹어서 주사위 고점만 뜨는 도란 + 하이퍼캐리 페이즈 조합 어케 막음???,2025-11-23T12:35:08
dcinside_리그오브레전드_갤러리,구마페이즈는 사실 모두가 알고있음,신나있는 케리아 화나있는 젠첩 싸우고있는 쮀맘 구맘 ㅋㅋ 답이 나와있잖아 누가 이득인지,구마페이즈는 사실 모두가 알고있음 신나있는 케리아 화나있는 젠첩 싸우고있는 쮀맘 구맘 ㅋㅋ 답이 나와있잖아 누가 이득인지,2025-11-23T12:34:54
dcinside_리그오브레전드_갤러리,케리아 대체불가인 거는 그거지,페이커가 신경 안쓰는 뒷일을 다해줌 대가리커져서 기어오르는놈 기강잡기 대상혁 오더 안따르는 놈 처분하기 필요악이라 그래,케리아 대체불가인 거는 그거지 페이커가 신경 안쓰는 뒷일을 다해줌 대가리커져서 기어오르는놈 기강잡기 대상혁 오더 안따르는 놈 처분하기 필요악이라 그래,2025-11-23T12:34:42
dcinside_리그오브레전드_갤러리,둘이 사귀면 누가 아깝냐,,둘이 사귀면 누가 아깝냐,2025-11-23T12:34:39
dcinside_리그오브레전드_갤러리,솔직히 티원 또 포핏할거 같음,페이즈 리헨즈 시절에 구마유시 상대로 이즈 뽑고 구케 타워에 밀어넣고 이즈로 구마유시 죽이고 살아나가는 장면 ㄹㅇ 아직도 기억남,솔직히 티원 또 포핏할거 같음 페이즈 리헨즈 시절에 구마유시 상대로 이즈 뽑고 구케 타워에 밀어넣고 이즈로 구마유시 죽이고 살아나가는 장면 ㄹㅇ 아직도 기억남,2025-11-23T12:34:35
dcinside_리그오브레전드_갤러리,❤+1.63 포그서버❤+노초기화❤+11월22일 토요일 19시~20시,"❤+1.63 포그서버❤+노초기화❤+11월22일 토요일 19시~20시 ❤+❤+❤+ ✅ 저희는 반하자 배율인 ""1.63포그서버""입니다 ✅ 그때 그시절 본섭지향을 하는 포그서버입니다 ✅ 허수아비 어택만 하셔도 플레이에 큰 도움이 되실 수 있습니다. ✅ 게임 내 모든 장비는 인첸 또는 제작 시스템으로 되어있습니다. ✅ 무과금도 꾸준한 플레이로 지존될 수 있습니다 ✅ 끊임없는 보스전투와 탄탄한 라인혈맹 그리고 사냥유저를 위한 중립혈맹 ! ✅ 천천히 즐기시며 플레이 해주시길 바랍니다. ✅ 무과금 유저분들도 비슷한 조건으로 즐기실 수 있도록 많은 경험을 토대로 시스템을 구축하였습니다. ✅ 후발 유저분들 레벨업에 대한 기존 유저들과의 밸런스 벗어나지 않게 시스템 적용되어 있습니다. ✅ 측근 및 비리 없는 투명한 운영 자부합니다 ! ✅ 서버 내 자세한 정보는 게시판 필독 부탁드립니다. ✅ 밤낮 쉬지 않고 달리신 유저분들을 배신하지 않습니다. ✅ 단기서버에 지치신 유저 여러분들의 안식처가 되겠습니다. ✅ 시원한 황금 전투 밸런스까지 겸비한 반하자 서버입니다 새로운 경험으로 초대드립니다 ! ✅ 서버 사후 관리, 상시 업데이트를 약속드립니다 ! ✅ 유저분들과 함께 만들어 온 유저분들과 함께하는 안식처입니다. ✅ 현재 까지 발전한 운영 노하우로 즐거운 안식처를 만들어 드림을 약속 드립니다. ✅ 정직한 운영을 약속드립니다. 💙💙💙포그서버 찾아오시는길💙💙💙 홈페이지 주소 : 02.. 홈페이지 주소 : 02.. 홈페이지 주소 : 02..","❤+1.63 포그서버❤+노초기화❤+11월22일 토요일 19시~20시 ❤+1.63 포그서버❤+노초기화❤+11월22일 토요일 19시~20시 ❤+❤+❤+ ✅ 저희는 반하자 배율인 ""1.63포그서버""입니다 ✅ 그때 그시절 본섭지향을 하는 포그서버입니다 ✅ 허수아비 어택만 하셔도 플레이에 큰 도움이 되실 수 있습니다. ✅ 게임 내 모든 장비는 인첸 또는 제작 시스템으로 되어있습니다. ✅ 무과금도 꾸준한 플레이로 지존될 수 있습니다 ✅ 끊임없는 보스전투와 탄탄한 라인혈맹 그리고 사냥유저를 위한 중립혈맹 ! ✅ 천천히 즐기시며 플레이 해주시길 바랍니다. ✅ 무과금 유저분들도 비슷한 조건으로 즐기실 수 있도록 많은 경험을 토대로 시스템을 구축하였습니다. ✅ 후발 유저분들 레벨업에 대한 기존 유저들과의 밸런스 벗어나지 않게 시스템 적용되어 있습니다. ✅ 측근 및 비리 없는 투명한 운영 자부합니다 ! ✅ 서버 내 자세한 정보는 게시판 필독 부탁드립니다. ✅ 밤낮 쉬지 않고 달리신 유저분들을 배신하지 않습니다. ✅ 단기서버에 지치신 유저 여러분들의 안식처가 되겠습니다. ✅ 시원한 황금 전투 밸런스까지 겸비한 반하자 서버입니다 새로운 경험으로 초대드립니다 ! ✅ 서버 사후 관리, 상시 업데이트를 약속드립니다 ! ✅ 유저분들과 함께 만들어 온 유저분들과 함께하는 안식처입니다. ✅ 현재 까지 발전한 운영 노하우로 즐거운 안식처를 만들어 드림을 약속 드립니다. ✅ 정직한 운영을 약속드립니다. 💙💙💙포그서버 찾아오시는길💙💙💙 홈페이지 주소 : 02.. 홈페이지 주소 : 02.. 홈페이지 주소 : 02..",2025-11-23T12:34:34
dcinside_리그오브레전드_갤러리,멭호령 ㅋㅋㅋㅋㅋㅋㅋㅋㅋㅋㅋㅋ,ㅋㅋㅋㅋㅋㅋㅋㅋㅋㅋㅋㅋ,멭호령 ㅋㅋㅋㅋㅋㅋㅋㅋㅋㅋㅋㅋ ㅋㅋㅋㅋㅋㅋㅋㅋㅋㅋㅋㅋ,2025-11-23T12:34:31
dcinside_리그오브레전드_갤러리,뒷난맘들 또 나대기 시작했노 ㅋㅋㅋ,그래봤자 1승 7패 페이커 부산물 부품따리면 개추 ㅋㅋㅋ,뒷난맘들 또 나대기 시작했노 ㅋㅋㅋ 그래봤자 1승 7패 페이커 부산물 부품따리면 개추 ㅋㅋㅋ,2025-11-23T12:33:49
dcinside_리그오브레전드_갤러리,케맘들 보셈 케리아 나가면 우승 못할거 같다,이게 메인임 페이커 내려치고 케리아가 메인이다라고 주장하고 싶은거임,케맘들 보셈 케리아 나가면 우승 못할거 같다 이게 메인임 페이커 내려치고 케리아가 메인이다라고 주장하고 싶은거임,2025-11-23T12:33:46
dcinside_리그오브레전드_갤러리,케리아가 대체불가인 이유는,그 팀컬러에 맞는 인성을 보유중이기 때문임 ㅋㅋ,케리아가 대체불가인 이유는 그 팀컬러에 맞는 인성을 보유중이기 때문임 ㅋㅋ,2025-11-23T12:33:38
dcinside_리그오브레전드_갤러리,구좆 제이카직유 중에서 카유는 냉정히 할만큼은함,솔직히 이즈는 억까 1스푼도 없이 존나못하는거 맞는듯,구좆 제이카직유 중에서 카유는 냉정히 할만큼은함 솔직히 이즈는 억까 1스푼도 없이 존나못하는거 맞는듯,2025-11-23T12:33:36
dcinside_리그오브레전드_갤러리,에이밍만 특혜받은거지,잼구는 일베해서 쫓겨났는데 왜 에이밍만ㅠㅠ,에이밍만 특혜받은거지 잼구는 일베해서 쫓겨났는데 왜 에이밍만ㅠㅠ,2025-11-23T12:33:33
dcinside_리그오브레전드_갤러리,솔직히 케리아 평가도 벤픽 표정빨이긴 함,"벤픽이 말렸으면 잘해서 이겨볼려는게 아니라 이미 표정부터 졌다 이표정으로 범인에서 제외되고 똥싸도 집게리아가 끝이고 오너시치, 구마유시, 그미진만 까임 ㅋㅋ","솔직히 케리아 평가도 벤픽 표정빨이긴 함 벤픽이 말렸으면 잘해서 이겨볼려는게 아니라 이미 표정부터 졌다 이표정으로 범인에서 제외되고 똥싸도 집게리아가 끝이고 오너시치, 구마유시, 그미진만 까임 ㅋㅋ",2025-11-23T12:33:24
dcinside_리그오브레전드_갤러리,공지) 페이즈 티원 첫방송 11월 25일 19시 숲티비,잊지말도록 ¤,공지) 페이즈 티원 첫방송 11월 25일 19시 숲티비 잊지말도록 ¤,2025-11-23T12:33:19
dcinside_리그오브레전드_갤러리,걍 구좆은 팀케미 망치는 새끼라 방출인거야 ㅋㅋ,실력은 억까 억빠할 것도 없어 걍 쓰리핏 원딜임 근데 성격이 병신이라 방출당한거 ㅇㅇ,걍 구좆은 팀케미 망치는 새끼라 방출인거야 ㅋㅋ 실력은 억까 억빠할 것도 없어 걍 쓰리핏 원딜임 근데 성격이 병신이라 방출당한거 ㅇㅇ,2025-11-23T12:33:18
dcinside_리그오브레전드_갤러리,난 내년 티원 ㄹㅇ 다를 거 같은데,젠지도 슬슬 진짜 늙은이들 천지라 페이즈 낀 티원이 리그에서 이길 거 같음,난 내년 티원 ㄹㅇ 다를 거 같은데 젠지도 슬슬 진짜 늙은이들 천지라 페이즈 낀 티원이 리그에서 이길 거 같음,2025-11-23T12:33:13
dcinside_리그오브레전드_갤러리,1은 페이커만이 대체 불가긴 해,ㄹㅇㅋㅋㅋㅋㅋ,1은 페이커만이 대체 불가긴 해 ㄹㅇㅋㅋㅋㅋㅋ,2025-11-23T12:33:07
dcinside_리그오브레전드_갤러리,에이밍은 잘하는것처럼 보이는데 항상 중요할떄 던짐,거의 8년 동안 그래왔고 기커비에리 커즈비디디 오더 체제에서도 매번 티원전 상대로 던지더라,에이밍은 잘하는것처럼 보이는데 항상 중요할떄 던짐 거의 8년 동안 그래왔고 기커비에리 커즈비디디 오더 체제에서도 매번 티원전 상대로 던지더라,2025-11-23T12:33:03
dcinside_리그오브레전드_갤러리,진짜 티팬티는 왜 입는 거냐?,진짜 존나 불편하네,진짜 티팬티는 왜 입는 거냐? 진짜 존나 불편하네,2025-11-23T12:32:54
dcinside_리그오브레전드_갤러리,케리아 오너 -> 대대대 리스펙,페독맞음? 물론 케리아 대체불가긴함 티원의 핵심임,케리아 오너 -> 대대대 리스펙 페독맞음? 물론 케리아 대체불가긴함 티원의 핵심임,2025-11-23T12:32:51
dcinside_리그오브레전드_갤러리,"티원이 월즈 쓸어담기 시작하면서 서폿신챔이 안나옴, 이게 우연이라 보냐?",서폿신챔은 낸다면 탱서폿이나 유틸서폿일게 분명한데 그러면 케리아보다 듀로 카엘 딜라 등등 다른 서폿들에게 더 유리하니까 23년도 3월 밀리오 출시를 이후로 티원의 쓰리핏 기간 내내 서폿챔을 단 한개도 출시 안함 이게 정말 우연이라고 보냐? 바드 니코 뽀삐는 너프 안하면서? 사파폿 잘하는 케리아에게 매튜렁이 내려준 일종의 특혜 아닐까? 난 자헨을 서폿챔으로 설계했다가 뜬금없이 “멋없다”는 이유로 탑챔으로 바꿨다는 매튜렁의 트위터글을 보고 아 이거 분명 티원이랑 뭐 있다 느껴지더라 아마 케리아가 티원에 계속 남아있는한 탱서폿 유틸서폿 신챔은 안나올거임 물론 기존 탱 유틸 폿들 버프나 리워크따위도 없을 예정이고 그 자리는 또 다른 딜포터랑 사파폿들이 쭉 채우겠지 모든건 티원을 위해서,"티원이 월즈 쓸어담기 시작하면서 서폿신챔이 안나옴, 이게 우연이라 보냐? 서폿신챔은 낸다면 탱서폿이나 유틸서폿일게 분명한데 그러면 케리아보다 듀로 카엘 딜라 등등 다른 서폿들에게 더 유리하니까 23년도 3월 밀리오 출시를 이후로 티원의 쓰리핏 기간 내내 서폿챔을 단 한개도 출시 안함 이게 정말 우연이라고 보냐? 바드 니코 뽀삐는 너프 안하면서? 사파폿 잘하는 케리아에게 매튜렁이 내려준 일종의 특혜 아닐까? 난 자헨을 서폿챔으로 설계했다가 뜬금없이 “멋없다”는 이유로 탑챔으로 바꿨다는 매튜렁의 트위터글을 보고 아 이거 분명 티원이랑 뭐 있다 느껴지더라 아마 케리아가 티원에 계속 남아있는한 탱서폿 유틸서폿 신챔은 안나올거임 물론 기존 탱 유틸 폿들 버프나 리워크따위도 없을 예정이고 그 자리는 또 다른 딜포터랑 사파폿들이 쭉 채우겠지 모든건 티원을 위해서",2025-11-23T12:32:49
dcinside_리그오브레전드_갤러리,제우스 올해 폼만 보면 좋았음?,,제우스 올해 폼만 보면 좋았음?,2025-11-23T12:32:46
dcinside_리그오브레전드_갤러리,베릴이 역2롤 타령할때는 입 꾹다물더니,케리아 역2롤 소리 나오니깐 도구는 아니지않냐 ㅇㅈㄹ ㅋㅋ 구줌마들임?,베릴이 역2롤 타령할때는 입 꾹다물더니 케리아 역2롤 소리 나오니깐 도구는 아니지않냐 ㅇㅈㄹ ㅋㅋ 구줌마들임?,2025-11-23T12:32:29
dcinside_리그오브레전드_갤러리,브리온 존나 웃긴게,느낌상 원래는 커리어로 쌀먹하려 했는데 딮기가 먼저 쌀먹 시전해서 그마저도 뺏기고 남궁으로 간듯 ㅋㅋㅋㅋㅋ,브리온 존나 웃긴게 느낌상 원래는 커리어로 쌀먹하려 했는데 딮기가 먼저 쌀먹 시전해서 그마저도 뺏기고 남궁으로 간듯 ㅋㅋㅋㅋㅋ,2025-11-23T12:32:29
dcinside_리그오브레전드_갤러리,다음 시즌 신화급 아이템 재출시,ㅈ댓다,다음 시즌 신화급 아이템 재출시 ㅈ댓다,2025-11-23T12:32:17
dcinside_리그오브레전드_갤러리,지휘관형은 대체불가능임,병사형은 피지컬좋은애 아무나 데려와도되지만 페이커 케리아같은 지휘관형은 대체불가능,지휘관형은 대체불가능임 병사형은 피지컬좋은애 아무나 데려와도되지만 페이커 케리아같은 지휘관형은 대체불가능,2025-11-23T12:32:09
dcinside_리그오브레전드_갤러리,딴 라인 역체가 진짜 아무 의미없는 게,타라인 역대 베스트 5명 라인업이랑 미드 월즈 무관 5 캡스 나이트 샤오후 쵸비 비디디 이 팀하면 누가ㅜ이길 거ㅜ같음? 포지션 적응 한 반년?시키면 그냥 개쳐바름 절대ㅜ못 이김. 저게 월즈 무관 라인업임 미드는,딴 라인 역체가 진짜 아무 의미없는 게 타라인 역대 베스트 5명 라인업이랑 미드 월즈 무관 5 캡스 나이트 샤오후 쵸비 비디디 이 팀하면 누가ㅜ이길 거ㅜ같음? 포지션 적응 한 반년?시키면 그냥 개쳐바름 절대ㅜ못 이김. 저게 월즈 무관 라인업임 미드는,2025-11-23T12:31:44
