community,title,content,full_text,posted_at
dcinside_남자연예인_갤러리,곰팡핌 젖괴들 탈주 심하긔,,곰팡핌 젖괴들 탈주 심하긔,2025-11-23T22:08:55
dcinside_남자연예인_갤러리,아 코아픈 루주 색깔 ㅈㄴ 웃겨,ㅅㅂ,아 코아픈 루주 색깔 ㅈㄴ 웃겨 ㅅㅂ,2025-11-23T22:08:52
dcinside_남자연예인_갤러리,지금 울좆앰들만 글싸고 있는데,느송자짤 앙상스크 먹금해,지금 울좆앰들만 글싸고 있는데 느송자짤 앙상스크 먹금해,2025-11-23T22:08:52
dcinside_남자연예인_갤러리,느릴라줌들 ㄹㅇ찐따같으셔,저런 인터뷰 하나하나에 의미부여하고 자아의탁 하는거ㅅㅂ,느릴라줌들 ㄹㅇ찐따같으셔 저런 인터뷰 하나하나에 의미부여하고 자아의탁 하는거ㅅㅂ,2025-11-23T22:08:51
dcinside_남자연예인_갤러리,헐 저주파 깜예까지 파묘됐노,,헐 저주파 깜예까지 파묘됐노,2025-11-23T22:08:42
dcinside_남자연예인_갤러리,느송자짤은 디지줌이 패는거야?,응원하긔,느송자짤은 디지줌이 패는거야? 응원하긔,2025-11-23T22:08:38
dcinside_남자연예인_갤러리,곰팡핌은 곰첼라말아먹어서욕쳐먹는거아니노?,ㅇㅇ,곰팡핌은 곰첼라말아먹어서욕쳐먹는거아니노? ㅇㅇ,2025-11-23T22:08:31
dcinside_남자연예인_갤러리,메까년 진짜 못났다,어,메까년 진짜 못났다 어,2025-11-23T22:08:16
dcinside_남자연예인_갤러리,뭐하러 합격각 세우면서 곰곰자매 패노,뉴트남 빠는글 하나면 10배로 발작하는데,뭐하러 합격각 세우면서 곰곰자매 패노 뉴트남 빠는글 하나면 10배로 발작하는데,2025-11-23T22:08:16
dcinside_남자연예인_갤러리,느송자짤 긁힌이유 은돌이가 밥메이트 울좆 뽑아서긔,저년은 울른을 긁으려면 아무도 안좋아하는 울좆으로 뇌절해야 하는데 은돌이가 울좆 뽑는바람에 지 세계관이 무너져서 미친거야,느송자짤 긁힌이유 은돌이가 밥메이트 울좆 뽑아서긔 저년은 울른을 긁으려면 아무도 안좋아하는 울좆으로 뇌절해야 하는데 은돌이가 울좆 뽑는바람에 지 세계관이 무너져서 미친거야,2025-11-23T22:08:13
dcinside_남자연예인_갤러리,곰팡핌 여원순 나가리되고 그냥 잡탕됨,데뷔컨셉 여원순 없이 못하니까 독기로 노선 튼 거잖아ㅋㅋ,곰팡핌 여원순 나가리되고 그냥 잡탕됨 데뷔컨셉 여원순 없이 못하니까 독기로 노선 튼 거잖아ㅋㅋ,2025-11-23T22:08:11
dcinside_남자연예인_갤러리,개은돌은 저런거 5초만에 체크하고 치우는 남성이고,느송이도 골랐는데 내가 저거 고른걸로 발작하는거겠냐구 언냐들,개은돌은 저런거 5초만에 체크하고 치우는 남성이고 느송이도 골랐는데 내가 저거 고른걸로 발작하는거겠냐구 언냐들,2025-11-23T22:08:10
dcinside_남자연예인_갤러리,진심 뿡턱이 잘생긴지 모르겠어,띠니눈엔 그냥 그 륵저 탄이닮음,진심 뿡턱이 잘생긴지 모르겠어 띠니눈엔 그냥 그 륵저 탄이닮음,2025-11-23T22:08:09
dcinside_남자연예인_갤러리,관계성 젤 좋은것도 원송돌인데,그줌들은 왜 집착하는거야,관계성 젤 좋은것도 원송돌인데 그줌들은 왜 집착하는거야,2025-11-23T22:08:02
dcinside_남자연예인_갤러리,아니 근데 곰팡핌젖괴들 이거빨면서 성형시비는,,아니 근데 곰팡핌젖괴들 이거빨면서 성형시비는,2025-11-23T22:08:01
dcinside_남자연예인_갤러리,나같으면 짹창가서 싸우겠긔,여기서 도배하면 좋아요가 사라져?,나같으면 짹창가서 싸우겠긔 여기서 도배하면 좋아요가 사라져?,2025-11-23T22:07:57
dcinside_남자연예인_갤러리,느릴라줌들 띤갤에서 울좆으로 2년동안 좆치질하면 뭐해,맨날 댓딸치면서 왕따거려봤자임,느릴라줌들 띤갤에서 울좆으로 2년동안 좆치질하면 뭐해 맨날 댓딸치면서 왕따거려봤자임,2025-11-23T22:07:55
dcinside_남자연예인_갤러리,지금 느릴라줌 중 누가 젤 긁혔는지 다 보이니,그만해 공수치 오짐,지금 느릴라줌 중 누가 젤 긁혔는지 다 보이니 그만해 공수치 오짐,2025-11-23T22:07:54
dcinside_남자연예인_갤러리,야 곰아픈 티저나 보고와 퀄리티좋음,ㄱ,야 곰아픈 티저나 보고와 퀄리티좋음 ㄱ,2025-11-23T22:07:42
dcinside_남자연예인_갤러리,씹슴...또 능국인한테 뭔짓했노;,개쳐맞고 있긔;,씹슴...또 능국인한테 뭔짓했노; 개쳐맞고 있긔;,2025-11-23T22:07:40
dcinside_남자연예인_갤러리,_ 잘 익은 쑥 이야기 츌 곜 끄 +_+!,,_ 잘 익은 쑥 이야기 츌 곜 끄 +_+!,2025-11-23T22:07:28
dcinside_남자연예인_갤러리,냅둬 디씨아니면 곰팡핌 여론방어되는곳없으시대,,냅둬 디씨아니면 곰팡핌 여론방어되는곳없으시대,2025-11-23T22:07:23
dcinside_남자연예인_갤러리,곰팡핌 제발 유학 가!!!!,ㅇㅇ,곰팡핌 제발 유학 가!!!! ㅇㅇ,2025-11-23T22:07:20
dcinside_남자연예인_갤러리,은돌이가 희생했노,ㅋㅋ애도,은돌이가 희생했노 ㅋㅋ애도,2025-11-23T22:07:19
dcinside_남자연예인_갤러리,앙상스크 며칠째 안보이는데,탈빠했나,앙상스크 며칠째 안보이는데 탈빠했나,2025-11-23T22:07:13
dcinside_남자연예인_갤러리,아니 돌울이 친해진거면 섹송은 세기의 절친인데,느송줌들도 섹송보고 그지랄로 억빠는 안하잖아 난 그냥 울른충들이 은돌이한테 황송해하는게 웃길 뿐이야,아니 돌울이 친해진거면 섹송은 세기의 절친인데 느송줌들도 섹송보고 그지랄로 억빠는 안하잖아 난 그냥 울른충들이 은돌이한테 황송해하는게 웃길 뿐이야,2025-11-23T22:07:08
dcinside_남자연예인_갤러리,곰팡핌 성형해서 쳐맞는거 맞긴해,,곰팡핌 성형해서 쳐맞는거 맞긴해,2025-11-23T22:06:56
dcinside_남자연예인_갤러리,은돌이가 울좆 좋대,느송크트 부들부들? 돌송 끝?,은돌이가 울좆 좋대 느송크트 부들부들? 돌송 끝?,2025-11-23T22:06:46
dcinside_남자연예인_갤러리,곰팡핌은 억지 뉴아르 바이럴하더니,장카설에 밀리고 껴주지도 않잖아 ㅋㅋ,곰팡핌은 억지 뉴아르 바이럴하더니 장카설에 밀리고 껴주지도 않잖아 ㅋㅋ,2025-11-23T22:06:43
dcinside_남자연예인_갤러리,뿡 외퀴들 국가 털리는거 웃기노,곰팡핌 곰아픈 저주파 메까 겨둑 닝족 댓츠핫 잦스틴 발삼 아메 보딸 쏘2 극괴 극래 노안 노련님 짭예만 자전거 능혼 학래 자짤 뿡3 뿡격거 뿡턱 똠짱 뿡진경 뿡학두 순남준 뿡딱 짮우 홍만 투창스 투다리 물냐 범냐 경괴 경개 칭인간 휴메 코아픈 라미갑 무능훈 짭판 선냐 학치커 코즉 리메 선인간 빵훈 죄이콥 학치 큐트 복자 약독대 약사히 퀸규 짭머성 짭머표 코정환 약시노리 약쾅 약쾅수 약루토 느릴라 울좆 앙상 섹찬 은돌 느송 원자로 난강 금고네 좆코네 명멜 퇴산 운지학 섹호 없우 한나방 토커 마조네 쉰쉰구 토동 투창스 륶괴 뎅기열 짱손 빵재 양락 뿡쾅 섹모 돌준 앱쭈 긴중 애물 광판 준나물 경돈 잠지 잠기수 홍어컨 홍안부 곰보 망짱 무짱 흘바타 피쉬방 서세원 괴빈 리대 짱리대 잦쏜 드갑 와보 재앙 봉하 군등 능송 죄앙민 무송 똠결 징샹 와하 유감 카주난 카준환 액옵 상판 짭경 케데헌 게데헌 딸배원 퇴공 퇴디공학 신손 슈내잦 윽찬 빵서 퇴디네 곰카레 느금 맠신영 꾸니 메리 정냐 공주 이리 좌듀 느악몽 죄노 똥찬 보민 갓파 선족 슈내잦 신손 신딸 윽찬 짱괴 하륵타 필둑 봉하 능찬 금인간 영범 족2 솟2 핑머 응구려 게이주 민죄 동불 개훈 떡조 리라 왕주 능똥 와똥선 능아픈 머익 익주 틀케 죠띠니 머꼴 능루아 윾마 느스시 윾시 리큭 샄머지 능족 머영 괴온 윾머 먼복 틀세연 호모 잦스틴 발삼 아메 보딸 퇴상순 뜨거원 어류 능사 딩친 약원순 약괴 능천수 능천 똠파리 똠키타 난국 뿡2 투다리 물냐 범냐 경괴 칭인간 느튀기 휴메 코아픈 라미갑 무능훈 짭판 선냐 학치커 코즉 리메 선인간 빵훈 죄이콥 학치 큐트 복자 세의 토커 핑머 뿡턱 약독대 약사히 퀸규 짭머성 짭머표 코정환 약시노리 약쾅 약쾅수 약루토 짭이모 느릴라 울좆 앙상 섹찬 은돌 느송 원자로 좆코네 명멜 퇴산 운지학 섹호 없우 킴지원 좆타쉽 족타쉽 곰자매 곰시녀 곰저씨 곰젖괴 셉2 륶괴 뎅기열 틀송 짱손 빵재 양락 뿡쾅 괴빈 리대 짱리대 잦쏜 드갑 와보 재앙 느금 맠신영 꾸니 메리 정냐 공주 이리 댓동 수을 순메 턱람 핑반인 효딸 여삽 인도미 느악몽 죄노 똥찬 보민 갓파 선족 능아픈 익주 틀케 죠띠니 엘쭈 퇴사배 능나 허망 숭어 뉴론 머꼴 능루아 윾마 물드시런 물레이크 물앵욱 느스시 윾시 리큭 샄머지 능족 머영 괴온 좆코네 한나방 운지학 퇴산 없우 명멜 셉2 느금 섹울 난강 리진호 리쩐하오 물현 뎅기열 뎅결 륶괴 양락 뿡쾅 짱손 서세원 괴빈 리대 잦쏜 드갑 와보 무능훈 빻키 죄부이 발삼 아메 보딸 느김치 메리 이리 도빻 느금 맠신영 꾸니 느악몽 보민 갓파 빻러 선족 느릴라 은돌 앙상 느송 섹찬 은돌 원자로 느스시 리큭 윾윽시 사큭야 머영 괴온 약독대 퀸규 코정환 약루토 짭머성 능아픈 익주 머꼴 머익 노꼴 죠띠니 능루아 틀케 윾마 뿡셕 좆목 에이즈원 여메 하괴 뉴트남 아문화 아큡 족갈 윙족 능예종 뿡이브 믂 창국 빡 압돈,뿡 외퀴들 국가 털리는거 웃기노 곰팡핌 곰아픈 저주파 메까 겨둑 닝족 댓츠핫 잦스틴 발삼 아메 보딸 쏘2 극괴 극래 노안 노련님 짭예만 자전거 능혼 학래 자짤 뿡3 뿡격거 뿡턱 똠짱 뿡진경 뿡학두 순남준 뿡딱 짮우 홍만 투창스 투다리 물냐 범냐 경괴 경개 칭인간 휴메 코아픈 라미갑 무능훈 짭판 선냐 학치커 코즉 리메 선인간 빵훈 죄이콥 학치 큐트 복자 약독대 약사히 퀸규 짭머성 짭머표 코정환 약시노리 약쾅 약쾅수 약루토 느릴라 울좆 앙상 섹찬 은돌 느송 원자로 난강 금고네 좆코네 명멜 퇴산 운지학 섹호 없우 한나방 토커 마조네 쉰쉰구 토동 투창스 륶괴 뎅기열 짱손 빵재 양락 뿡쾅 섹모 돌준 앱쭈 긴중 애물 광판 준나물 경돈 잠지 잠기수 홍어컨 홍안부 곰보 망짱 무짱 흘바타 피쉬방 서세원 괴빈 리대 짱리대 잦쏜 드갑 와보 재앙 봉하 군등 능송 죄앙민 무송 똠결 징샹 와하 유감 카주난 카준환 액옵 상판 짭경 케데헌 게데헌 딸배원 퇴공 퇴디공학 신손 슈내잦 윽찬 빵서 퇴디네 곰카레 느금 맠신영 꾸니 메리 정냐 공주 이리 좌듀 느악몽 죄노 똥찬 보민 갓파 선족 슈내잦 신손 신딸 윽찬 짱괴 하륵타 필둑 봉하 능찬 금인간 영범 족2 솟2 핑머 응구려 게이주 민죄 동불 개훈 떡조 리라 왕주 능똥 와똥선 능아픈 머익 익주 틀케 죠띠니 머꼴 능루아 윾마 느스시 윾시 리큭 샄머지 능족 머영 괴온 윾머 먼복 틀세연 호모 잦스틴 발삼 아메 보딸 퇴상순 뜨거원 어류 능사 딩친 약원순 약괴 능천수 능천 똠파리 똠키타 난국 뿡2 투다리 물냐 범냐 경괴 칭인간 느튀기 휴메 코아픈 라미갑 무능훈 짭판 선냐 학치커 코즉 리메 선인간 빵훈 죄이콥 학치 큐트 복자 세의 토커 핑머 뿡턱 약독대 약사히 퀸규 짭머성 짭머표 코정환 약시노리 약쾅 약쾅수 약루토 짭이모 느릴라 울좆 앙상 섹찬 은돌 느송 원자로 좆코네 명멜 퇴산 운지학 섹호 없우 킴지원 좆타쉽 족타쉽 곰자매 곰시녀 곰저씨 곰젖괴 셉2 륶괴 뎅기열 틀송 짱손 빵재 양락 뿡쾅 괴빈 리대 짱리대 잦쏜 드갑 와보 재앙 느금 맠신영 꾸니 메리 정냐 공주 이리 댓동 수을 순메 턱람 핑반인 효딸 여삽 인도미 느악몽 죄노 똥찬 보민 갓파 선족 능아픈 익주 틀케 죠띠니 엘쭈 퇴사배 능나 허망 숭어 뉴론 머꼴 능루아 윾마 물드시런 물레이크 물앵욱 느스시 윾시 리큭 샄머지 능족 머영 괴온 좆코네 한나방 운지학 퇴산 없우 명멜 셉2 느금 섹울 난강 리진호 리쩐하오 물현 뎅기열 뎅결 륶괴 양락 뿡쾅 짱손 서세원 괴빈 리대 잦쏜 드갑 와보 무능훈 빻키 죄부이 발삼 아메 보딸 느김치 메리 이리 도빻 느금 맠신영 꾸니 느악몽 보민 갓파 빻러 선족 느릴라 은돌 앙상 느송 섹찬 은돌 원자로 느스시 리큭 윾윽시 사큭야 머영 괴온 약독대 퀸규 코정환 약루토 짭머성 능아픈 익주 머꼴 머익 노꼴 죠띠니 능루아 틀케 윾마 뿡셕 좆목 에이즈원 여메 하괴 뉴트남 아문화 아큡 족갈 윙족 능예종 뿡이브 믂 창국 빡 압돈,2025-11-23T22:06:37
dcinside_남자연예인_갤러리,멜론투표로 나대는 저주파시녀창들 웃창이노,족문화는 탑텐 확정이라 느스시랑 연합해서 느스시 뽑고있는데 순위 차이 하나 나는거면 씹ㅋㅋㅋ,멜론투표로 나대는 저주파시녀창들 웃창이노 족문화는 탑텐 확정이라 느스시랑 연합해서 느스시 뽑고있는데 순위 차이 하나 나는거면 씹ㅋㅋㅋ,2025-11-23T22:06:35
dcinside_남자연예인_갤러리,곰팡핌젖괴가 성형으로 시비터는거 무슨 현상이긔?,,곰팡핌젖괴가 성형으로 시비터는거 무슨 현상이긔?,2025-11-23T22:06:24
dcinside_남자연예인_갤러리,갤플이 젖괴만 끼면 좆창나노,궁금하지도 않은거 들고와서 나대는거봐 아ㅡㅡ,갤플이 젖괴만 끼면 좆창나노 궁금하지도 않은거 들고와서 나대는거봐 아ㅡㅡ,2025-11-23T22:06:20
dcinside_남자연예인_갤러리,곰팡핌 유학 좀 가라 ㅅㅂ,ㅇ,곰팡핌 유학 좀 가라 ㅅㅂ ㅇ,2025-11-23T22:06:18
dcinside_남자연예인_갤러리,느물탕년들이 느릴라 개줌좀 싹 쓸어갔으면,존나 지겨워,느물탕년들이 느릴라 개줌좀 싹 쓸어갔으면 존나 지겨워,2025-11-23T22:06:16
dcinside_남자연예인_갤러리,수을이 옷 진짜 잘 입노,,수을이 옷 진짜 잘 입노,2025-11-23T22:06:10
dcinside_남자연예인_갤러리,느송자짤은 울른에 긁혔다기 보단 돌울 둘이 붙는게 싫은거야,둘 다 지 최대 사위들인데 둘이서 부비니까 좆같은거지,느송자짤은 울른에 긁혔다기 보단 돌울 둘이 붙는게 싫은거야 둘 다 지 최대 사위들인데 둘이서 부비니까 좆같은거지,2025-11-23T22:06:05
dcinside_남자연예인_갤러리,관계성 제일 집착하는거 앙상앰이자노,앙상이 아무도 안찍어줬더라,관계성 제일 집착하는거 앙상앰이자노 앙상이 아무도 안찍어줬더라,2025-11-23T22:06:04
dcinside_남자연예인_갤러리,아니 은돌이가 밥친구 울좆고른걸로 저러는거라고?,숙소에서 같이 먹은걸로 밥친구라했겠지 은돌이 어디 나가지도 않는데ㅋㅋㅋㅋㅋㅋㅋ 느송자짤 개웃기네,아니 은돌이가 밥친구 울좆고른걸로 저러는거라고? 숙소에서 같이 먹은걸로 밥친구라했겠지 은돌이 어디 나가지도 않는데ㅋㅋㅋㅋㅋㅋㅋ 느송자짤 개웃기네,2025-11-23T22:06:00
dcinside_남자연예인_갤러리,앙상스크랑 느송자짤 스워조지는거 실시간 봤었는데,앙상스크가 느송이한테 패드립 박는데도 느송자짤이 고무통짓하니까 앙상스크 어느순간 포기하고 사라짐 정신병자대결 보는거 같았어,앙상스크랑 느송자짤 스워조지는거 실시간 봤었는데 앙상스크가 느송이한테 패드립 박는데도 느송자짤이 고무통짓하니까 앙상스크 어느순간 포기하고 사라짐 정신병자대결 보는거 같았어,2025-11-23T22:05:55
dcinside_남자연예인_갤러리,곰팡핌은 유학갈거같다고징징거리는데 젖괴들 노무하노,,곰팡핌은 유학갈거같다고징징거리는데 젖괴들 노무하노,2025-11-23T22:05:54
dcinside_남자연예인_갤러리,와 곰아픈 티저 ㅆㅅㅌㅊ야,근데 뭔가 솟커스느낌으로 ㅅㅌㅊ인데 머중한테는 덜먹힐거같긔,와 곰아픈 티저 ㅆㅅㅌㅊ야 근데 뭔가 솟커스느낌으로 ㅅㅌㅊ인데 머중한테는 덜먹힐거같긔,2025-11-23T22:05:52
dcinside_남자연예인_갤러리,아니 저개줌 진짜 앙상이로 존나게 주절대너,미친거같노,아니 저개줌 진짜 앙상이로 존나게 주절대너 미친거같노,2025-11-23T22:05:48
dcinside_남자연예인_갤러리,곰팡핌 전세계적으로 무시당하는거 맞음,능국에서도 외면 당해서 도쿄돔 7만따리 했긔,곰팡핌 전세계적으로 무시당하는거 맞음 능국에서도 외면 당해서 도쿄돔 7만따리 했긔,2025-11-23T22:05:48
dcinside_남자연예인_갤러리,아 제발 곰팡핌 유학 좀 가면 좋겠긔,젖괴들 쳐나대는거 노무 보기싫긔,아 제발 곰팡핌 유학 좀 가면 좋겠긔 젖괴들 쳐나대는거 노무 보기싫긔,2025-11-23T22:05:47
dcinside_남자연예인_갤러리,제발 곰팡핌이 원탑 먹는 세상이 오면 좋겠어,띠니 소원이야,제발 곰팡핌이 원탑 먹는 세상이 오면 좋겠어 띠니 소원이야,2025-11-23T22:05:40
dcinside_남자연예인_갤러리,다들 곰아픈 티저 보고와,ㄱㄱ,다들 곰아픈 티저 보고와 ㄱㄱ,2025-11-23T22:05:39
dcinside_남자연예인_갤러리,원자로빼고 의미없으니까 호모충들 닥쳐,원자로가 느릴라 호모 왼른 다 하실꺼야,원자로빼고 의미없으니까 호모충들 닥쳐 원자로가 느릴라 호모 왼른 다 하실꺼야,2025-11-23T22:05:37
dcinside_남자연예인_갤러리,갑자기 느릴라플 왜 돌려?,존나 티나게 도배하노 새삼스럽지도 않지만,갑자기 느릴라플 왜 돌려? 존나 티나게 도배하노 새삼스럽지도 않지만,2025-11-23T22:05:34
dcinside_남자연예인_갤러리,얼마전에 울송 돌송 책 둘 다 삼,사위끼리 붙어먹지마!!,얼마전에 울송 돌송 책 둘 다 삼 사위끼리 붙어먹지마!!,2025-11-23T22:05:29
dcinside_남자연예인_갤러리,곰팡핌 저러다 유학가면 곰팡핌 젖괴들탓아니긔?,,곰팡핌 저러다 유학가면 곰팡핌 젖괴들탓아니긔?,2025-11-23T22:05:14
dcinside_남자연예인_갤러리,미친... 기사 지금 봤는데,"://.../?=346895 투어스() 도훈 “무대에서 더 빛나는 모습을 보여주고 싶어요” - ()도훈이 찍은 청춘이라는 좌표. 어떤 마음을 먹었길래 애교가 늘었어요? 그간 어떤 변화가 있었길래. 그간 아아아~주 많은 변화가 있었는데, 데뷔 초랑 비교해서 말씀하시는 거죠? 막 손 벌벌 떨었을 때. 사실 그때는 모든 게 처음이 ...","미친... 기사 지금 봤는데 ://.../?=346895 투어스() 도훈 “무대에서 더 빛나는 모습을 보여주고 싶어요” - ()도훈이 찍은 청춘이라는 좌표. 어떤 마음을 먹었길래 애교가 늘었어요? 그간 어떤 변화가 있었길래. 그간 아아아~주 많은 변화가 있었는데, 데뷔 초랑 비교해서 말씀하시는 거죠? 막 손 벌벌 떨었을 때. 사실 그때는 모든 게 처음이 ...",2025-11-23T22:05:12
dcinside_남자연예인_갤러리,앙상이의 제일 큰 문제는 슨타성이 없다는거긔,잦돌 다 빠는 탐라 꾸리면 제일 안들어오는게 앙상이임 좋은쪽으로든 나쁜쪽으로든 그냥 잦돌애미들이 앙상이에게 관심이 없음 빻순이들은 무슨 말인지 알거긔,앙상이의 제일 큰 문제는 슨타성이 없다는거긔 잦돌 다 빠는 탐라 꾸리면 제일 안들어오는게 앙상이임 좋은쪽으로든 나쁜쪽으로든 그냥 잦돌애미들이 앙상이에게 관심이 없음 빻순이들은 무슨 말인지 알거긔,2025-11-23T22:05:12
dcinside_남자연예인_갤러리,씹어보셔 맛이 좋아 이지랄하니까 외면당하지,ㅉㅉ,씹어보셔 맛이 좋아 이지랄하니까 외면당하지 ㅉㅉ,2025-11-23T22:05:08
dcinside_남자연예인_갤러리,울좆 관계성으로 패는것도 머뷔초에나 먹혔지,자컨 하나만봐도 울좆 두루두루 잘노는데 업뎃을 안한건가,울좆 관계성으로 패는것도 머뷔초에나 먹혔지 자컨 하나만봐도 울좆 두루두루 잘노는데 업뎃을 안한건가,2025-11-23T22:04:51
dcinside_남자연예인_갤러리,순메 무수리내 심하긴해,바이럴도 이제 안먹히고 띤갤 스타성도 수을이한테 밀림 순메는 견제 안되니깐 안처맞지,순메 무수리내 심하긴해 바이럴도 이제 안먹히고 띤갤 스타성도 수을이한테 밀림 순메는 견제 안되니깐 안처맞지,2025-11-23T22:04:47
dcinside_남자연예인_갤러리,혹시 2찍 곰팡핌이 한거긔? 왜 노노팡핌 당하는중?,17팡핌 뭐임,혹시 2찍 곰팡핌이 한거긔? 왜 노노팡핌 당하는중? 17팡핌 뭐임,2025-11-23T22:04:39
dcinside_남자연예인_갤러리,느송크트 울좆관계성에 긁힌이유,더이상 은돌이는 느송이를 고르지않음 울좆이 느송이보다 더 인기많음,느송크트 울좆관계성에 긁힌이유 더이상 은돌이는 느송이를 고르지않음 울좆이 느송이보다 더 인기많음,2025-11-23T22:04:28
dcinside_남자연예인_갤러리,통피로 느릴라줌인척 글싸대야겠다 존나잘낚임 개꿀ㅆㅅㅌㅊㅋㅋㅋ,아 재믺게짜,통피로 느릴라줌인척 글싸대야겠다 존나잘낚임 개꿀ㅆㅅㅌㅊㅋㅋㅋ 아 재믺게짜,2025-11-23T22:04:23
dcinside_남자연예인_갤러리,곰아픈신곡은 또 왜케 축축처지노,하,곰아픈신곡은 또 왜케 축축처지노 하,2025-11-23T22:04:13
dcinside_남자연예인_갤러리,결론은 느릴라 최고 인기멤,원자로,결론은 느릴라 최고 인기멤 원자로,2025-11-23T22:04:12
dcinside_남자연예인_갤러리,지금 좆라마 보는데 빻경 잘생겼노,와꾸 관리 잘햇다,지금 좆라마 보는데 빻경 잘생겼노 와꾸 관리 잘햇다,2025-11-23T22:04:09
dcinside_남자연예인_갤러리,곰팡핌 젖괴 다 빠짐?,,곰팡핌 젖괴 다 빠짐?,2025-11-23T22:04:07
dcinside_남자연예인_갤러리,족갈배들은 중간에 껴서 나대지마,다 티남,족갈배들은 중간에 껴서 나대지마 다 티남,2025-11-23T22:04:06
dcinside_남자연예인_갤러리,저주파시녀가 잦돌패라고 하는거긔,빡치는언냐 좋아요 누르시긔,저주파시녀가 잦돌패라고 하는거긔 빡치는언냐 좋아요 누르시긔,2025-11-23T22:04:06
dcinside_남자연예인_갤러리,지금올라온 와보 릴스,어게인 몸매2 같음,지금올라온 와보 릴스 어게인 몸매2 같음,2025-11-23T22:03:48
dcinside_남자연예인_갤러리,울좆앰이 관계성에 왜긁히노,이거뜨고 느릴라줌들이 긁혀서 울좆패는구만,울좆앰이 관계성에 왜긁히노 이거뜨고 느릴라줌들이 긁혀서 울좆패는구만,2025-11-23T22:03:45
dcinside_남자연예인_갤러리,곰젖괴들 곰팡핌 4세대 꼴찌인거 타격 크나봐,대놓고 다 패네,곰젖괴들 곰팡핌 4세대 꼴찌인거 타격 크나봐 대놓고 다 패네,2025-11-23T22:03:42
dcinside_남자연예인_갤러리,걸플갤로 꺼지라니까 말 더럽게 안듣더니 폭동났노 ㅅㅂ,,걸플갤로 꺼지라니까 말 더럽게 안듣더니 폭동났노 ㅅㅂ,2025-11-23T22:03:36
dcinside_남자연예인_갤러리,느송자짤 울른에 긁히는거 맞네,북다닥 긁혀서 글쓰는거봐,느송자짤 울른에 긁히는거 맞네 북다닥 긁혀서 글쓰는거봐,2025-11-23T22:03:23
dcinside_남자연예인_갤러리,곰자매팻다고 코드건거임?,어이없네 ㅋㅋ,곰자매팻다고 코드건거임? 어이없네 ㅋㅋ,2025-11-23T22:03:15
dcinside_남자연예인_갤러리,아니 느릴라줌들 느송자짤한테 왤케 관심을 주지,ㄹㅇ유입이야? 저년 요즘 계속 혼자 주절거리다 관심딸 안쳐주니까 불쌍하게 글 몇개싸다가 무플강간당하고 꺼졌었는데,아니 느릴라줌들 느송자짤한테 왤케 관심을 주지 ㄹㅇ유입이야? 저년 요즘 계속 혼자 주절거리다 관심딸 안쳐주니까 불쌍하게 글 몇개싸다가 무플강간당하고 꺼졌었는데,2025-11-23T22:03:14
dcinside_남자연예인_갤러리,곰팡핌 꼴지라고 글 쓰면 칼삭당함,갤검해 보시긔,곰팡핌 꼴지라고 글 쓰면 칼삭당함 갤검해 보시긔,2025-11-23T22:03:10
dcinside_남자연예인_갤러리,곰팡핌젖괴들 곰팡핌 쳐맞아서 클리너 돌린거 웃창이긔,,곰팡핌젖괴들 곰팡핌 쳐맞아서 클리너 돌린거 웃창이긔,2025-11-23T22:03:03
dcinside_남자연예인_갤러리,곰아픈 티저나왔어 관심좀주라,,곰아픈 티저나왔어 관심좀주라,2025-11-23T22:03:00
dcinside_남자연예인_갤러리,앙상이 좆이어트 왜 하는데,요즘 노무 해골이던데 앙상이는 살 조금 있는게 이쁘지 않긔?,앙상이 좆이어트 왜 하는데 요즘 노무 해골이던데 앙상이는 살 조금 있는게 이쁘지 않긔?,2025-11-23T22:02:50
dcinside_남자연예인_갤러리,곰아픈 노래 왜저래,존나 쳐져,곰아픈 노래 왜저래 존나 쳐져,2025-11-23T22:02:36
