community,title,content,full_text,posted_at
dcinside_남자연예인_갤러리,근데 씹슴 돼벨도 갓양에서 안빨리는 거 보면,실력 문제만도 아닌 거 같긔 씹슴 특유의 무언가 인위적인 씹덕느낌과 기계적인 춤 우악스러운 보컬이 거부감을 일으키는 것 같긔,근데 씹슴 돼벨도 갓양에서 안빨리는 거 보면 실력 문제만도 아닌 거 같긔 씹슴 특유의 무언가 인위적인 씹덕느낌과 기계적인 춤 우악스러운 보컬이 거부감을 일으키는 것 같긔,2025-11-23T17:24:23
dcinside_남자연예인_갤러리,언노운으로 갑자기 바꾸는년들 웃기다,국적이 떳떳하지 못하노?,언노운으로 갑자기 바꾸는년들 웃기다 국적이 떳떳하지 못하노?,2025-11-23T17:24:18
dcinside_남자연예인_갤러리,접속 위치가 그사람 찐 국적이긔?,앱스토어 옆에 뜨는 나라,접속 위치가 그사람 찐 국적이긔? 앱스토어 옆에 뜨는 나라,2025-11-23T17:24:09
dcinside_남자연예인_갤러리,뉴트남은 어때?,ㅋㅋㅋ,뉴트남은 어때? ㅋㅋㅋ,2025-11-23T17:24:06
dcinside_남자연예인_갤러리,약핑이 유럽 쌀국에서 인기많으니깐 앰버서더하지,떨거지 무수리년들 ㅅㅂ 약핑 따라하는거 개웃기노,약핑이 유럽 쌀국에서 인기많으니깐 앰버서더하지 떨거지 무수리년들 ㅅㅂ 약핑 따라하는거 개웃기노,2025-11-23T17:23:59
dcinside_남자연예인_갤러리,투창스는 봊돌머갈보다 작은데,좆돌이랑비교자체가 좀 잔인하긴해,투창스는 봊돌머갈보다 작은데 좆돌이랑비교자체가 좀 잔인하긴해,2025-11-23T17:23:47
dcinside_남자연예인_갤러리,뎅두창 퇴치짤,,뎅두창 퇴치짤,2025-11-23T17:23:47
dcinside_남자연예인_갤러리,발삼이가 뎅기열 바이럴 태워주는구나,숏츠 올라오면 뎅기열 비율에 다 놀라겠다,발삼이가 뎅기열 바이럴 태워주는구나 숏츠 올라오면 뎅기열 비율에 다 놀라겠다,2025-11-23T17:23:42
dcinside_남자연예인_갤러리,계정정보 짹창 업데이트 해야 보이늠거야?,어캐봄,계정정보 짹창 업데이트 해야 보이늠거야? 어캐봄,2025-11-23T17:23:34
dcinside_남자연예인_갤러리,나라망신은 죄다 한남이 하는게 맞는거같긔,한녀들은 정직한데 젖괴들이 국적속이고 분탕치고 다니노 왜저러고살아,나라망신은 죄다 한남이 하는게 맞는거같긔 한녀들은 정직한데 젖괴들이 국적속이고 분탕치고 다니노 왜저러고살아,2025-11-23T17:23:34
dcinside_남자연예인_갤러리,메까패는 윙족시녀 국적 보시긔,독국녀성이노 ㅆㅅㅌㅊ,메까패는 윙족시녀 국적 보시긔 독국녀성이노 ㅆㅅㅌㅊ,2025-11-23T17:23:32
dcinside_남자연예인_갤러리,짱들 언노운으로 돌리는이유가 썰릴까봐그래?,ㅇㅇ,짱들 언노운으로 돌리는이유가 썰릴까봐그래? ㅇㅇ,2025-11-23T17:23:26
dcinside_남자연예인_갤러리,짹창으로 본 계급순위,갓양> 김능 > 짱똥,짹창으로 본 계급순위 갓양> 김능 > 짱똥,2025-11-23T17:23:06
dcinside_남자연예인_갤러리,약핑앰중에 약국 나오고 붙은 앰들은,쌀국 유럽계정이 많고 계정생성 21년전은 똠이나 산유국이 많긔,약핑앰중에 약국 나오고 붙은 앰들은 쌀국 유럽계정이 많고 계정생성 21년전은 똠이나 산유국이 많긔,2025-11-23T17:22:59
dcinside_남자연예인_갤러리,뎅륶 둘다 망왑상같지않노,오래된생각이긔 특히 륶괴보면 가끔 녕긔생각나긔,뎅륶 둘다 망왑상같지않노 오래된생각이긔 특히 륶괴보면 가끔 녕긔생각나긔,2025-11-23T17:22:58
dcinside_남자연예인_갤러리,발삼이 코디 이게 뭐노,정털린다,발삼이 코디 이게 뭐노 정털린다,2025-11-23T17:22:27
dcinside_남자연예인_갤러리,약괴 똠리타 이년 존나 기대하면서 국적 파묘했는데,애미가 몇없어서 제일 똠스러운 계정들 두개만 파묘했는데 뭐긔;,약괴 똠리타 이년 존나 기대하면서 국적 파묘했는데 애미가 몇없어서 제일 똠스러운 계정들 두개만 파묘했는데 뭐긔;,2025-11-23T17:21:53
dcinside_남자연예인_갤러리,미갤있는데 갤기장 파서 달리는거 별로임?,갤에서 빨고싶은데,미갤있는데 갤기장 파서 달리는거 별로임? 갤에서 빨고싶은데,2025-11-23T17:21:51
dcinside_남자연예인_갤러리,안드로이드는 아무도 안뜨노,다 앱스토어네,안드로이드는 아무도 안뜨노 다 앱스토어네,2025-11-23T17:21:36
dcinside_남자연예인_갤러리,오히려 저거보니 약핑은 똠리사말곤 똠팬들이 떨어지고,쌀국유럽팬들이 어느순간부터 확 는것 같노,오히려 저거보니 약핑은 똠리사말곤 똠팬들이 떨어지고 쌀국유럽팬들이 어느순간부터 확 는것 같노,2025-11-23T17:21:35
dcinside_남자연예인_갤러리,118235 륶두창 똥장미 뎅기열도배중,왜 또 발작해,118235 륶두창 똥장미 뎅기열도배중 왜 또 발작해,2025-11-23T17:21:16
dcinside_남자연예인_갤러리,커뮤국적공개가 더 시급해,ㄹㅇ 짱개 50프로 예상함,커뮤국적공개가 더 시급해 ㄹㅇ 짱개 50프로 예상함,2025-11-23T17:21:15
dcinside_남자연예인_갤러리,뎅기열은 신기한 와꾸긔,혼자있으면 잧 모르겠는데 투샷은 잘털어,뎅기열은 신기한 와꾸긔 혼자있으면 잧 모르겠는데 투샷은 잘털어,2025-11-23T17:20:50
dcinside_남자연예인_갤러리,홍컨 와꾸폼 뭐노,,홍컨 와꾸폼 뭐노,2025-11-23T17:20:37
dcinside_남자연예인_갤러리,윾시 수을이랑,영통하는 모습 미리보기,윾시 수을이랑 영통하는 모습 미리보기,2025-11-23T17:20:33
dcinside_남자연예인_갤러리,트페미들 툭하면 잦돌빻순이 패는 걸로 쉴드고뭐고 다써먹는거 앰창임,봊 성상품화 공로자들이면서 주제파악 노무안돼,트페미들 툭하면 잦돌빻순이 패는 걸로 쉴드고뭐고 다써먹는거 앰창임 봊 성상품화 공로자들이면서 주제파악 노무안돼,2025-11-23T17:20:31
dcinside_남자연예인_갤러리,정보) 투창스 좆론 하트수가 작스틴보다 많다,한녀는 투창스 맞긔 둘중에선,정보) 투창스 좆론 하트수가 작스틴보다 많다 한녀는 투창스 맞긔 둘중에선,2025-11-23T17:20:31
dcinside_남자연예인_갤러리,근데 뎅륶는 그냥 좆돌중에서도 탈좆간 네율인걸 인지하고 있어서,투샷으로 털려도 아무생각 안들긔 학폭줌 아니긔,근데 뎅륶는 그냥 좆돌중에서도 탈좆간 네율인걸 인지하고 있어서 투샷으로 털려도 아무생각 안들긔 학폭줌 아니긔,2025-11-23T17:20:20
dcinside_남자연예인_갤러리,짮우 방에 액괴잇는거보니까 ㄹㅇ중졸인거실감나,ㅋㅋ,짮우 방에 액괴잇는거보니까 ㄹㅇ중졸인거실감나 ㅋㅋ,2025-11-23T17:20:17
dcinside_남자연예인_갤러리,된잰 허드슨쇼 관객 100% 머리떡진 똥남아년ㅋㅋㅋ,실물을 찍은걸 보면 갓양타령 개웃기긔,된잰 허드슨쇼 관객 100% 머리떡진 똥남아년ㅋㅋㅋ 실물을 찍은걸 보면 갓양타령 개웃기긔,2025-11-23T17:20:13
dcinside_남자연예인_갤러리,근데 설정국가바꿔도 앱스토어때문에들키잖아,ㅇ,근데 설정국가바꿔도 앱스토어때문에들키잖아 ㅇ,2025-11-23T17:20:11
dcinside_남자연예인_갤러리,똥남아여도 그냥 봊풍당당하게 밝히는게 낫긔,국적 속이는게 훨씬 없어보여 봊풍당당하게 똠국어쓰면서 똠국뜨고 나 필리핀인이요 나 인도네시아인이요 하는건 그냥 그런갑다 하게됨,똥남아여도 그냥 봊풍당당하게 밝히는게 낫긔 국적 속이는게 훨씬 없어보여 봊풍당당하게 똠국어쓰면서 똠국뜨고 나 필리핀인이요 나 인도네시아인이요 하는건 그냥 그런갑다 하게됨,2025-11-23T17:20:05
dcinside_남자연예인_갤러리,둘다머갈 존나작다진짜,옆에서긴싫긔,둘다머갈 존나작다진짜 옆에서긴싫긔,2025-11-23T17:20:02
dcinside_남자연예인_갤러리,211.234 아메줌아 착각하지마시긔 아메는 걍 빻았어,ㅇㅇ,211.234 아메줌아 착각하지마시긔 아메는 걍 빻았어 ㅇㅇ,2025-11-23T17:19:33
dcinside_남자연예인_갤러리,아메 발삼이 뎅기열 키 비교,아메야,아메 발삼이 뎅기열 키 비교 아메야,2025-11-23T17:19:30
dcinside_남자연예인_갤러리,약핑바이럴들 국적 부심 부리면서 몰려온거 뭐야,에저씨득저씨들한테 쳐맞고 뒤끝 머단하다,약핑바이럴들 국적 부심 부리면서 몰려온거 뭐야 에저씨득저씨들한테 쳐맞고 뒤끝 머단하다,2025-11-23T17:19:26
dcinside_남자연예인_갤러리,능정린 보블 보면 놀라겠노,뭘 저걸로 패니,능정린 보블 보면 놀라겠노 뭘 저걸로 패니,2025-11-23T17:19:20
dcinside_남자연예인_갤러리,클리너 어케 저렇게 잘 돌리냐고,띠니새끼글은 암만 신고해도 절대 안지워지던데 욕도 안들어가있는데 무조건 써는게 가능한거냐고,클리너 어케 저렇게 잘 돌리냐고 띠니새끼글은 암만 신고해도 절대 안지워지던데 욕도 안들어가있는데 무조건 써는게 가능한거냐고,2025-11-23T17:19:20
dcinside_남자연예인_갤러리,발망 옆에선 산타같아 발삼 뎅기열,,발망 옆에선 산타같아 발삼 뎅기열,2025-11-23T17:19:13
dcinside_남자연예인_갤러리,메까 넴드 이거 한명이 계정 다 굴리는거긔?,터키뭐야,메까 넴드 이거 한명이 계정 다 굴리는거긔? 터키뭐야,2025-11-23T17:19:04
dcinside_남자연예인_갤러리,아니 도대체 경괴가 누구를 털고 다녔다는 거노,시발ㅋ,아니 도대체 경괴가 누구를 털고 다녔다는 거노 시발ㅋ,2025-11-23T17:18:56
dcinside_남자연예인_갤러리,양락이가 뎅보다 나아 보이면 눈깔 병신이노,오늘 진짜 양락이가 더 나아 보이긔,양락이가 뎅보다 나아 보이면 눈깔 병신이노 오늘 진짜 양락이가 더 나아 보이긔,2025-11-23T17:18:54
dcinside_남자연예인_갤러리,아니 생각보다 외퀴중에 튀르키예가 많아,뭐노,아니 생각보다 외퀴중에 튀르키예가 많아 뭐노,2025-11-23T17:18:50
dcinside_남자연예인_갤러리,발삼이 키 구라치는것까지 이병헌이랑 똑같노,,발삼이 키 구라치는것까지 이병헌이랑 똑같노,2025-11-23T17:18:43
dcinside_남자연예인_갤러리,언냐들 띠니 퀸핑 계정들 확인하고왔는데 쌀국유럽 많긔,흐뭇,언냐들 띠니 퀸핑 계정들 확인하고왔는데 쌀국유럽 많긔 흐뭇,2025-11-23T17:18:42
dcinside_남자연예인_갤러리,뎅두창들 실컷 투샷딸치다가 쳐맞은 새끼앰들이,뎅기열 패면 륶두창 이간질이라고 빠져나오는거 졸라티남,뎅두창들 실컷 투샷딸치다가 쳐맞은 새끼앰들이 뎅기열 패면 륶두창 이간질이라고 빠져나오는거 졸라티남,2025-11-23T17:18:36
dcinside_남자연예인_갤러리,근데 갓양인들 진심 한녀들 피부 하얀거랑 성형으로 노무 팬다,왜저러노,근데 갓양인들 진심 한녀들 피부 하얀거랑 성형으로 노무 팬다 왜저러노,2025-11-23T17:18:33
dcinside_남자연예인_갤러리,뎅기열 걍 저러다 경괴꼴 나는거지 뭐,외퀴없는 경괴면 볼만하겠누,뎅기열 걍 저러다 경괴꼴 나는거지 뭐 외퀴없는 경괴면 볼만하겠누,2025-11-23T17:18:28
dcinside_남자연예인_갤러리,잦스틴 똥성괴 오늘 엔딩 얼빡도 이랬는데,발삼이 엔딩요정 깨끗한 개씹존잘 얼빡 보고 와 존나 감탄하다가 엔딩얼빡 무난한 보딸을 거쳐서 개빻성괴 나오는데 똥내나는 닭대가리 베르사체까르띠에지방시뷰티롯데빼빼로지방시 뷰티스키즈 현진주작폭로억까짓선동황현진정병단풍손성괴용복아메리똥내냉부해시청률역대최저성괴필릭스트레이키즈제왑버버리펜디앙령보딸구찌떡고루이비통개줌스폰망공차개줌스폰역대급폭망갤럭시삼성괴매국노짓발삼정병개줌스폰젠몬헤라썩은피부똥내제왑갤부매성괴직원주작바이럴잦스틴탈출제왑탈출현진워크돌십오야뉴스룸느믹스응구려잦니쥬신손,잦스틴 똥성괴 오늘 엔딩 얼빡도 이랬는데 발삼이 엔딩요정 깨끗한 개씹존잘 얼빡 보고 와 존나 감탄하다가 엔딩얼빡 무난한 보딸을 거쳐서 개빻성괴 나오는데 똥내나는 닭대가리 베르사체까르띠에지방시뷰티롯데빼빼로지방시 뷰티스키즈 현진주작폭로억까짓선동황현진정병단풍손성괴용복아메리똥내냉부해시청률역대최저성괴필릭스트레이키즈제왑버버리펜디앙령보딸구찌떡고루이비통개줌스폰망공차개줌스폰역대급폭망갤럭시삼성괴매국노짓발삼정병개줌스폰젠몬헤라썩은피부똥내제왑갤부매성괴직원주작바이럴잦스틴탈출제왑탈출현진워크돌십오야뉴스룸느믹스응구려잦니쥬신손,2025-11-23T17:18:25
dcinside_남자연예인_갤러리,알계년들 국적 보러가자,ㅇ,알계년들 국적 보러가자 ㅇ,2025-11-23T17:18:24
dcinside_남자연예인_갤러리,오히려 똥남아는 까긔 언노운으로 돌리는거 짱깨야,ㅇㅇ,오히려 똥남아는 까긔 언노운으로 돌리는거 짱깨야 ㅇㅇ,2025-11-23T17:18:14
dcinside_남자연예인_갤러리,아메 잦돌계 원숭이아니노,발삼 아메 뎅기열,아메 잦돌계 원숭이아니노 발삼 아메 뎅기열,2025-11-23T17:18:07
dcinside_남자연예인_갤러리,약핑은 쌀국 유럽 존나 많노 네임 막 20만 계정,이런데,약핑은 쌀국 유럽 존나 많노 네임 막 20만 계정 이런데,2025-11-23T17:18:03
dcinside_남자연예인_갤러리,셉치 득와 능국계정 많고,약핑은 생각보다 국가가 더 다양하긔 쌀국도 많아 뿡은 인도가 많고,셉치 득와 능국계정 많고 약핑은 생각보다 국가가 더 다양하긔 쌀국도 많아 뿡은 인도가 많고,2025-11-23T17:18:02
dcinside_남자연예인_갤러리,짱깨들아냐 혹시,짱깨는 차이나 뜨긔?,짱깨들아냐 혹시 짱깨는 차이나 뜨긔?,2025-11-23T17:17:54
dcinside_남자연예인_갤러리,딴덴 몰라도 깜보디아는 ㄹㅇ업체 산거 아니노?,깜보디아인이 돈이어딨어,딴덴 몰라도 깜보디아는 ㄹㅇ업체 산거 아니노? 깜보디아인이 돈이어딨어,2025-11-23T17:17:51
dcinside_남자연예인_갤러리,솔직히 나도 한남이지만 한국 출산율 낮은 것부터 여성차별의 증거임,"출산율 높은 대륙: 아프리카, 인도, 남미 출산율 낮은 대륙: 북미, 유럽, 한국, 일본 전 세계적으로 출산율 높은 나라들 보면 다 여성 인권 보장된 나라들이고 출산율 낮아질수록 여성인권 낮은 나라들임 ㅇㅇ","솔직히 나도 한남이지만 한국 출산율 낮은 것부터 여성차별의 증거임 출산율 높은 대륙: 아프리카, 인도, 남미 출산율 낮은 대륙: 북미, 유럽, 한국, 일본 전 세계적으로 출산율 높은 나라들 보면 다 여성 인권 보장된 나라들이고 출산율 낮아질수록 여성인권 낮은 나라들임 ㅇㅇ",2025-11-23T17:17:47
dcinside_남자연예인_갤러리,아메 키가 이리 작았노,,아메 키가 이리 작았노,2025-11-23T17:17:18
dcinside_남자연예인_갤러리,발삼이 ㄹㅇ 잦돌계 산타 아니노,170후반이라고 구라치는 산타,발삼이 ㄹㅇ 잦돌계 산타 아니노 170후반이라고 구라치는 산타,2025-11-23T17:16:55
dcinside_남자연예인_갤러리,갤에 뎅앰인지 두창 ㅈㄴ 많은거같긔,맨날 쳐맞는다고 징징대는데 멋글달리는거봐,갤에 뎅앰인지 두창 ㅈㄴ 많은거같긔 맨날 쳐맞는다고 징징대는데 멋글달리는거봐,2025-11-23T17:16:48
dcinside_남자연예인_갤러리,우리는 다 일론 손바닥안에 있노,일론이 좆돌판을 지배하노,우리는 다 일론 손바닥안에 있노 일론이 좆돌판을 지배하노,2025-11-23T17:16:46
dcinside_남자연예인_갤러리,발삼이가 노무 좋긔,웅,발삼이가 노무 좋긔 웅,2025-11-23T17:16:38
dcinside_남자연예인_갤러리,인가때마다 앰들이 잦돌 다 패고다닌 분의 말로를 봐,,인가때마다 앰들이 잦돌 다 패고다닌 분의 말로를 봐,2025-11-23T17:16:34
dcinside_남자연예인_갤러리,근데 지네 국적 숨기고 패는거 ㄹㅇ없어보여,똥남아여도 앞면까고 필리핀 이지랄로 써있으면 덜 우스운데 언노운이러니까 ㅎㅌㅊ같아,근데 지네 국적 숨기고 패는거 ㄹㅇ없어보여 똥남아여도 앞면까고 필리핀 이지랄로 써있으면 덜 우스운데 언노운이러니까 ㅎㅌㅊ같아,2025-11-23T17:16:32
dcinside_남자연예인_갤러리,국적 설정 못하는데?,대륙공개나 국가공개 둘중하나만 가능함,국적 설정 못하는데? 대륙공개나 국가공개 둘중하나만 가능함,2025-11-23T17:16:29
dcinside_남자연예인_갤러리,헐 약지슥 네임드 계정 유럽이었노,ㅇㅇㄹ,헐 약지슥 네임드 계정 유럽이었노 ㅇㅇㄹ,2025-11-23T17:16:26
dcinside_남자연예인_갤러리,똥남아인들 신라면 먹을 수 있긔?,거기서라도 팔아야겠노,똥남아인들 신라면 먹을 수 있긔? 거기서라도 팔아야겠노,2025-11-23T17:16:25
dcinside_남자연예인_갤러리,잦스틴 발삼 이병헌 닮았다,,잦스틴 발삼 이병헌 닮았다,2025-11-23T17:16:13
dcinside_남자연예인_갤러리,발삼이 비율로 패는건 뭐노,ㅋ,발삼이 비율로 패는건 뭐노 ㅋ,2025-11-23T17:16:07
dcinside_남자연예인_갤러리,언노운 나는 짱깨다 선언하는거랑 뭐가 다름,ㅋㅋㅋㅋ,언노운 나는 짱깨다 선언하는거랑 뭐가 다름 ㅋㅋㅋㅋ,2025-11-23T17:15:54
dcinside_남자연예인_갤러리,빠질 계정인데 국적숨기는건,의심할만하긔,빠질 계정인데 국적숨기는건 의심할만하긔,2025-11-23T17:15:23
dcinside_남자연예인_갤러리,보니까 국적속인년들 딱 이정도긔,똠 김치(주로40대이상 개저개줌들이 해외사는척하다 뼛속까지 김치인거걸림),보니까 국적속인년들 딱 이정도긔 똠 김치(주로40대이상 개저개줌들이 해외사는척하다 뼛속까지 김치인거걸림),2025-11-23T17:15:18
dcinside_남자연예인_갤러리,투창스 투샷만찍히면 머갈 다털어버리노,뿌듯하긔,투창스 투샷만찍히면 머갈 다털어버리노 뿌듯하긔,2025-11-23T17:15:03
dcinside_남자연예인_갤러리,언노운+의심 뜨면 짱깨 맞을걸,짱깨 짹창 좆별 좆튭 다 안되지않긔?,언노운+의심 뜨면 짱깨 맞을걸 짱깨 짹창 좆별 좆튭 다 안되지않긔?,2025-11-23T17:14:53
dcinside_남자연예인_갤러리,신라면 똠주파에 속았노,쌀국어써서 속은듯,신라면 똠주파에 속았노 쌀국어써서 속은듯,2025-11-23T17:14:53
dcinside_남자연예인_갤러리,갑자기 하나둘 언노운으로 바꾸기시작하노,놈웃겨,갑자기 하나둘 언노운으로 바꾸기시작하노 놈웃겨,2025-11-23T17:14:52
dcinside_남자연예인_갤러리,다시 한번 보수 괴멸 선언하는 이준석 ㄷㄷ,://..//_11/20571571 국힘과 개혁신당 합당 커지는 보수 통합론... - 국내야구 갤러리 전 대통령 선거에서 단일화 안해서 이재명을 대통령으로 만들어준 쁘락치 이준석ㅋㅋㅋㅋㅋㅋㅋ 이번엔 이재명을 위해 어떤 비장의 카드를 보여줄것인가 ㅋㅋㅋㅋ 그저 신재명 ㅋㅋㅋㅋㅋㅋㅋㅋㅋㅋㅋㅋㅋ .. 개추 댓글시 기분 좋은일만 생깁니다,다시 한번 보수 괴멸 선언하는 이준석 ㄷㄷ ://..//_11/20571571 국힘과 개혁신당 합당 커지는 보수 통합론... - 국내야구 갤러리 전 대통령 선거에서 단일화 안해서 이재명을 대통령으로 만들어준 쁘락치 이준석ㅋㅋㅋㅋㅋㅋㅋ 이번엔 이재명을 위해 어떤 비장의 카드를 보여줄것인가 ㅋㅋㅋㅋ 그저 신재명 ㅋㅋㅋㅋㅋㅋㅋㅋㅋㅋㅋㅋㅋ .. 개추 댓글시 기분 좋은일만 생깁니다,2025-11-23T17:14:50
dcinside_남자연예인_갤러리,뿡 쌀국 팬베 파묘됐긔 ㄷㄷ,뷔빡쭈창국압돈,뿡 쌀국 팬베 파묘됐긔 ㄷㄷ 뷔빡쭈창국압돈,2025-11-23T17:14:47
dcinside_남자연예인_갤러리,씹슴창들 자기들도 메까 와꾸크기로 딴년들 패놓고,뎅결와꾸크기로 씹슴패는거 왜부들대,씹슴창들 자기들도 메까 와꾸크기로 딴년들 패놓고 뎅결와꾸크기로 씹슴패는거 왜부들대,2025-11-23T17:14:38
dcinside_남자연예인_갤러리,게이팝 빠는년들 똥남아만 있진 않긔,오히려 윾럽년들이 생각보다 많던데 근데 유난히 똥남아만 붙은 그룹이 몇몇 있는거같긴 해,게이팝 빠는년들 똥남아만 있진 않긔 오히려 윾럽년들이 생각보다 많던데 근데 유난히 똥남아만 붙은 그룹이 몇몇 있는거같긴 해,2025-11-23T17:14:27
dcinside_남자연예인_갤러리,발삼이 산타같아,키가 이런데 와꾸 근본으로 빠는 산타줌들 보는 거같긔,발삼이 산타같아 키가 이런데 와꾸 근본으로 빠는 산타줌들 보는 거같긔,2025-11-23T17:14:26
dcinside_남자연예인_갤러리,근데 피시가입이여도 언노운이래,띠니도 언노운으로떠,근데 피시가입이여도 언노운이래 띠니도 언노운으로떠,2025-11-23T17:14:21
dcinside_남자연예인_갤러리,지금 뎅결 도배 경괴 뿡이럴 문건 생각나,역바 못잃어,지금 뎅결 도배 경괴 뿡이럴 문건 생각나 역바 못잃어,2025-11-23T17:14:08
dcinside_남자연예인_갤러리,굳이 위치 안뜨게하는년들 뭐긔,은근 있노,굳이 위치 안뜨게하는년들 뭐긔 은근 있노,2025-11-23T17:14:05
dcinside_남자연예인_갤러리,환혐 보다가 노잼이라탈주함,저번주부터안보는중 보기귀찮다,환혐 보다가 노잼이라탈주함 저번주부터안보는중 보기귀찮다,2025-11-23T17:14:01
dcinside_남자연예인_갤러리,국적 비공할 나라 하나 밖에 없잖아,짱 깨,국적 비공할 나라 하나 밖에 없잖아 짱 깨,2025-11-23T17:13:56
dcinside_남자연예인_갤러리,발삼이가 진짜 갓양인들이 환장하는 똥양인상같긔,무쌍느낌에 찢어진 눈 네레기 스타일,발삼이가 진짜 갓양인들이 환장하는 똥양인상같긔 무쌍느낌에 찢어진 눈 네레기 스타일,2025-11-23T17:13:55
dcinside_남자연예인_갤러리,발삼이 보면 잦은 키인거같긔,와꾸는 존잘같은데 늘 키로 초라해지는거같아,발삼이 보면 잦은 키인거같긔 와꾸는 존잘같은데 늘 키로 초라해지는거같아,2025-11-23T17:13:45
dcinside_남자연예인_갤러리,키작고 목짧고 머리큰건 저주야,잦스틴이 김치에서 반응 없는 이유,키작고 목짧고 머리큰건 저주야 잦스틴이 김치에서 반응 없는 이유,2025-11-23T17:13:42
dcinside_남자연예인_갤러리,토스트젖괴는 국적 짱깨 맞아,짱깨 패니까 패지 말래,토스트젖괴는 국적 짱깨 맞아 짱깨 패니까 패지 말래,2025-11-23T17:13:42
dcinside_남자연예인_갤러리,능냐들은 진짜솔직하네,국적정직하노,능냐들은 진짜솔직하네 국적정직하노,2025-11-23T17:13:31
dcinside_남자연예인_갤러리,메까 읍희롱 레딧에서 투표 1위하더니,베스트붑 이런거 1위할때부터 똥남아냄새 ㅈㄴ났는데 찐으로 똥남아인셀젖괴픽이노 슬푸다,메까 읍희롱 레딧에서 투표 1위하더니 베스트붑 이런거 1위할때부터 똥남아냄새 ㅈㄴ났는데 찐으로 똥남아인셀젖괴픽이노 슬푸다,2025-11-23T17:13:30
dcinside_남자연예인_갤러리,언노운은 쓴건가,어쩌구 그러는ㅔ,언노운은 쓴건가 어쩌구 그러는ㅔ,2025-11-23T17:13:24
dcinside_남자연예인_갤러리,훌디 왜자꾸 이용당하지? 개훈 익주 저딴놈들까지 빌붙는데,좀 저런건 쳐내지,훌디 왜자꾸 이용당하지? 개훈 익주 저딴놈들까지 빌붙는데 좀 저런건 쳐내지,2025-11-23T17:13:14
dcinside_남자연예인_갤러리,다다음주 조추첨 기대되노 ㅋㅋ,최상의조 캐나다 한국 남아공 아이티 최악의조 아르헨 한국 노르웨이 이탈리아 이거냐?,다다음주 조추첨 기대되노 ㅋㅋ 최상의조 캐나다 한국 남아공 아이티 최악의조 아르헨 한국 노르웨이 이탈리아 이거냐?,2025-11-23T17:13:12
dcinside_남자연예인_갤러리,발삼이 자짤 이걸로 달겠긔,머갈장군 발삼,발삼이 자짤 이걸로 달겠긔 머갈장군 발삼,2025-11-23T17:13:08
dcinside_남자연예인_갤러리,모드로 하니까 바로 뜨노,,모드로 하니까 바로 뜨노,2025-11-23T17:12:58
dcinside_남자연예인_갤러리,언노운은 ㄹㅇ수상함,뭘 그렇게까지 감추려는거긔,언노운은 ㄹㅇ수상함 뭘 그렇게까지 감추려는거긔,2025-11-23T17:12:35
dcinside_남자연예인_갤러리,새끼 외퀴 계정 국적에 왜 뽕먹는거긔,갓양 유럽 다 이런스타일이 빨텐데,새끼 외퀴 계정 국적에 왜 뽕먹는거긔 갓양 유럽 다 이런스타일이 빨텐데,2025-11-23T17:12:32
dcinside_남자연예인_갤러리,썼다고 흑인비하라고 욕하던 계정들,동남아인거 웃기네ㅋㅋ,썼다고 흑인비하라고 욕하던 계정들 동남아인거 웃기네ㅋㅋ,2025-11-23T17:12:27
