community,title,content,full_text,posted_at
dcinside_남자연예인_갤러리,여갈이 기싸움 하노 ㅋㅋ,표독스럽구나,여갈이 기싸움 하노 ㅋㅋ 표독스럽구나,2025-11-23T15:36:40
dcinside_남자연예인_갤러리,무용봊들이나 악기하는봊들 다큐같은거 궁금해 ㄹㅇ 어캐,혼나는지 구경하고싶긔,무용봊들이나 악기하는봊들 다큐같은거 궁금해 ㄹㅇ 어캐 혼나는지 구경하고싶긔,2025-11-23T15:36:39
dcinside_남자연예인_갤러리,무줌마년들은 단체로 갤검후에 네추찍는게 일인가봐,가만히나있지 ㅂㅅ,무줌마년들은 단체로 갤검후에 네추찍는게 일인가봐 가만히나있지 ㅂㅅ,2025-11-23T15:36:33
dcinside_남자연예인_갤러리,여갈이라고? 턱람이나 도딸인줄,,여갈이라고? 턱람이나 도딸인줄,2025-11-23T15:36:24
dcinside_남자연예인_갤러리,음악 예체능에서 재일 저렴한게 성악이래,레슨비 백단위인데 돈 제일 안 든대,음악 예체능에서 재일 저렴한게 성악이래 레슨비 백단위인데 돈 제일 안 든대,2025-11-23T15:36:18
dcinside_남자연예인_갤러리,은저씨가 더 잘생겼는데?,뭐니,은저씨가 더 잘생겼는데? 뭐니,2025-11-23T15:36:13
dcinside_남자연예인_갤러리,여갈이 멘탈괜찮아보여서 곰젖괴 정병왔긔,여갈이 아니라고 부정중이긔,여갈이 멘탈괜찮아보여서 곰젖괴 정병왔긔 여갈이 아니라고 부정중이긔,2025-11-23T15:36:07
dcinside_남자연예인_갤러리,응옥이는 모르겠는데 애초에 거의완전체로 굴릴꺼같앗어,딩냥에 뉴페이스 3명 더 추가하는건 뿡이브입장에서도 비용이 훨씬 많이들자나,응옥이는 모르겠는데 애초에 거의완전체로 굴릴꺼같앗어 딩냥에 뉴페이스 3명 더 추가하는건 뿡이브입장에서도 비용이 훨씬 많이들자나,2025-11-23T15:36:00
dcinside_남자연예인_갤러리,죄범네 은저씨아들 뭔 정면짤 없어,다 정면인데,죄범네 은저씨아들 뭔 정면짤 없어 다 정면인데,2025-11-23T15:35:50
dcinside_남자연예인_갤러리,여갈이 뭐랄까? 갓양식 기쎔같긔,밝은데도 실속 잘 차리는,여갈이 뭐랄까? 갓양식 기쎔같긔 밝은데도 실속 잘 차리는,2025-11-23T15:35:19
dcinside_남자연예인_갤러리,언냐들 뿡격거랑 죄범이네 겹친다고 생각해?,뿡격거는 장르만 힙합이지 춤이 강점아니노 랩이 아니라,언냐들 뿡격거랑 죄범이네 겹친다고 생각해? 뿡격거는 장르만 힙합이지 춤이 강점아니노 랩이 아니라,2025-11-23T15:35:15
dcinside_남자연예인_갤러리,한국무용이면 장구채로 쳐맞는거 아니노,장구채 존나 때리기 좋게 생겼긔,한국무용이면 장구채로 쳐맞는거 아니노 장구채 존나 때리기 좋게 생겼긔,2025-11-23T15:35:14
dcinside_남자연예인_갤러리,띠니도 피아노슨상한테 맞으면서배움,띠닌 전공생도 아닌데 시발,띠니도 피아노슨상한테 맞으면서배움 띠닌 전공생도 아닌데 시발,2025-11-23T15:35:12
dcinside_남자연예인_갤러리,죄범이네 띠니같은 년들이 일당백하는거라고ㅡㅡ,이새끼들이 바이럴 쓸 돈이 어딨노 무릎꿇고 믹테 받으러 오라고 비는거 보고 감동한 띠니가 일부러 공짜 바이럴해주며 어그로 끌어주는거라고ㅡㅡ 근데 어그로 끌어도 딴 좆돌 후려치는 ㅎㅌㅊ어그로는 안끈다,죄범이네 띠니같은 년들이 일당백하는거라고ㅡㅡ 이새끼들이 바이럴 쓸 돈이 어딨노 무릎꿇고 믹테 받으러 오라고 비는거 보고 감동한 띠니가 일부러 공짜 바이럴해주며 어그로 끌어주는거라고ㅡㅡ 근데 어그로 끌어도 딴 좆돌 후려치는 ㅎㅌㅊ어그로는 안끈다,2025-11-23T15:35:11
dcinside_남자연예인_갤러리,환혐 한무당 닮음,,환혐 한무당 닮음,2025-11-23T15:35:04
dcinside_남자연예인_갤러리,죄범이네 자작곡으로 머뷔함?,?,죄범이네 자작곡으로 머뷔함? ?,2025-11-23T15:35:03
dcinside_남자연예인_갤러리,죄범이네는 바이럴이 아니고 역바가 붙겠ㄷ지,이미 짹창에 머뷔도 안했는데 죄범이 때문에 죄범이네도 소소하게 쳐맞고 있음 외퀴년들은 죄범이 왤케 싫어해,죄범이네는 바이럴이 아니고 역바가 붙겠ㄷ지 이미 짹창에 머뷔도 안했는데 죄범이 때문에 죄범이네도 소소하게 쳐맞고 있음 외퀴년들은 죄범이 왤케 싫어해,2025-11-23T15:34:57
dcinside_남자연예인_갤러리,죄범이네 읍이럴은 하나같이 뚱뚱한 개줌내나는 글로,주절주절대는거 진짜 토나오긔,죄범이네 읍이럴은 하나같이 뚱뚱한 개줌내나는 글로 주절주절대는거 진짜 토나오긔,2025-11-23T15:34:53
dcinside_남자연예인_갤러리,이거 여갈이긔?,라창년아니고?,이거 여갈이긔? 라창년아니고?,2025-11-23T15:34:53
dcinside_남자연예인_갤러리,악기가 돈 ㅈㄴ드는거 같던데,뭔 하나에 몇천이랬나?,악기가 돈 ㅈㄴ드는거 같던데 뭔 하나에 몇천이랬나?,2025-11-23T15:34:45
dcinside_남자연예인_갤러리,송소희언냐만 봐도 국악 카르텔 존나 심해보여,무섭긔,송소희언냐만 봐도 국악 카르텔 존나 심해보여 무섭긔,2025-11-23T15:34:35
dcinside_남자연예인_갤러리,무용이 ㄹㅇ 집에 돈많은집 아니면 할짓안되는거같긔,시키는데 돈이 많이 드는것보다도 졸업하고 할게없자노 무용하다가 결국 치어리더하고 그러던데,무용이 ㄹㅇ 집에 돈많은집 아니면 할짓안되는거같긔 시키는데 돈이 많이 드는것보다도 졸업하고 할게없자노 무용하다가 결국 치어리더하고 그러던데,2025-11-23T15:34:31
dcinside_남자연예인_갤러리,죄범이네 힙찔컨셉 가지기 좋긴하긔,주위가 진짜 다 힙찔인데 ㅋㅋㅋㅋ,죄범이네 힙찔컨셉 가지기 좋긴하긔 주위가 진짜 다 힙찔인데 ㅋㅋㅋㅋ,2025-11-23T15:34:26
dcinside_남자연예인_갤러리,예체능중에서 미술만 수저 다양하고 무용악기성악 이런건,거의 금아님?,예체능중에서 미술만 수저 다양하고 무용악기성악 이런건 거의 금아님?,2025-11-23T15:34:02
dcinside_남자연예인_갤러리,여갈이 그저 웃으며 사진 좀 찍어줬을뿐인데,또 가만히 있다가 곰젖괴들 발작하게 만드노,여갈이 그저 웃으며 사진 좀 찍어줬을뿐인데 또 가만히 있다가 곰젖괴들 발작하게 만드노,2025-11-23T15:33:53
dcinside_남자연예인_갤러리,곰아픈 이번 컨셉 가끔 뜨는거보면,더이상 귀엽다하지말라고 이러던데 막상 나오면 또 경지컨셉일꺼같음,곰아픈 이번 컨셉 가끔 뜨는거보면 더이상 귀엽다하지말라고 이러던데 막상 나오면 또 경지컨셉일꺼같음,2025-11-23T15:33:38
dcinside_남자연예인_갤러리,여갈이 빨리는대로 순수무해ㅌㅊ는 아닌거같긔,은근 기쎄보임,여갈이 빨리는대로 순수무해ㅌㅊ는 아닌거같긔 은근 기쎄보임,2025-11-23T15:33:31
dcinside_남자연예인_갤러리,죄범이네 컨셉이뭐긔?,힙찔잦돌?,죄범이네 컨셉이뭐긔? 힙찔잦돌?,2025-11-23T15:33:16
dcinside_남자연예인_갤러리,예체능하는년들은 자부심으로 하는거지 거의,ㅇㅇ,예체능하는년들은 자부심으로 하는거지 거의 ㅇㅇ,2025-11-23T15:33:00
dcinside_남자연예인_갤러리,맠신영 1.245 덬창에서 딴새끼 대리스워하다,맠신영 영업글 조현병자처럼 쓰는거 공수치와 혼자 존나 기괴함 아무도 맠신영은 관심 안주는데,맠신영 1.245 덬창에서 딴새끼 대리스워하다 맠신영 영업글 조현병자처럼 쓰는거 공수치와 혼자 존나 기괴함 아무도 맠신영은 관심 안주는데,2025-11-23T15:32:58
dcinside_남자연예인_갤러리,여갈이 생당근 맛있다고 하잖아 보통애가 아님,ㄹㅇ,여갈이 생당근 맛있다고 하잖아 보통애가 아님 ㄹㅇ,2025-11-23T15:32:58
dcinside_남자연예인_갤러리,발레는 재능충이면 해외발레단 가고,아님 국립발레단 이런데라도 가면 밥벌이는 하는데 한국무용은 존나 암울하노;,발레는 재능충이면 해외발레단 가고 아님 국립발레단 이런데라도 가면 밥벌이는 하는데 한국무용은 존나 암울하노;,2025-11-23T15:32:49
dcinside_남자연예인_갤러리,죄범이네 뜰거같은거 띠니가 쇼미충이었어서 그런가?,띠니 1 듣보일때부터(쇼미 나오기 전) 호감이었어 근데 실제로 힙찔이치고 존나 잘됐어 월드투어도 함ㅇㅇ 암튼 데뷔무대랑 자컨 봐야 더 각이 나올거같은데 최소 중박이상각이야,죄범이네 뜰거같은거 띠니가 쇼미충이었어서 그런가? 띠니 1 듣보일때부터(쇼미 나오기 전) 호감이었어 근데 실제로 힙찔이치고 존나 잘됐어 월드투어도 함ㅇㅇ 암튼 데뷔무대랑 자컨 봐야 더 각이 나올거같은데 최소 중박이상각이야,2025-11-23T15:32:48
dcinside_남자연예인_갤러리,국악쪽이 슨상 존나 무섭고 쎔,국악은 ㄹㅇ 인간문화재가 존재하고 아직도 정정하긔 그 슨상들 라인 잘타면 갓울대 프리패스 가능함 근데 그게 존나 힘들어서 문제지,국악쪽이 슨상 존나 무섭고 쎔 국악은 ㄹㅇ 인간문화재가 존재하고 아직도 정정하긔 그 슨상들 라인 잘타면 갓울대 프리패스 가능함 근데 그게 존나 힘들어서 문제지,2025-11-23T15:32:48
dcinside_남자연예인_갤러리,은저씨아들 스타일링 전이긔,,은저씨아들 스타일링 전이긔,2025-11-23T15:32:47
dcinside_남자연예인_갤러리,미술 무용 다 학벌세탁용이긔 ???,좋은 대학 가고싶어서 하는거노?,미술 무용 다 학벌세탁용이긔 ??? 좋은 대학 가고싶어서 하는거노?,2025-11-23T15:32:41
dcinside_남자연예인_갤러리,무용봊들 결국엔 다 좆플루언서로 빠지잖아,그러고 돈 많이 버니까 ㅅㅌㅊ긴 한듯,무용봊들 결국엔 다 좆플루언서로 빠지잖아 그러고 돈 많이 버니까 ㅅㅌㅊ긴 한듯,2025-11-23T15:32:35
dcinside_남자연예인_갤러리,죄범이네 띤빨망 당할듯,ㅋㅋㅋ,죄범이네 띤빨망 당할듯 ㅋㅋㅋ,2025-11-23T15:32:34
dcinside_남자연예인_갤러리,여갈 뭔가 멘갑이 같음,되게 독실한 신자 느낌 강철멘탈 ㄴㄴ,여갈 뭔가 멘갑이 같음 되게 독실한 신자 느낌 강철멘탈 ㄴㄴ,2025-11-23T15:32:24
dcinside_남자연예인_갤러리,여갈이는 이미 뿡도어랑 활동도 하긴했다며,앰버서더,여갈이는 이미 뿡도어랑 활동도 하긴했다며 앰버서더,2025-11-23T15:32:20
dcinside_남자연예인_갤러리,무당이 일족이한테 인기밀린줄알았는데 돌아왔구나,ㅇ,무당이 일족이한테 인기밀린줄알았는데 돌아왔구나 ㅇ,2025-11-23T15:32:14
dcinside_남자연예인_갤러리,아기족까 찐앰 키 엄청 크긔,26살에 족까 낳으셨대 앱은 27살,아기족까 찐앰 키 엄청 크긔 26살에 족까 낳으셨대 앱은 27살,2025-11-23T15:32:13
dcinside_남자연예인_갤러리,캄보디아 태자 그룹에서 짱깨공산당 고위직 이름 나오는거,아니노 싱가폴과 대출 회사,캄보디아 태자 그룹에서 짱깨공산당 고위직 이름 나오는거 아니노 싱가폴과 대출 회사,2025-11-23T15:32:09
dcinside_남자연예인_갤러리,돌려받읍시다. 도ཕ박하다 잃었었던 자본,고고 ㅌཕㄹ ཕཕཕཕ43,돌려받읍시다. 도ཕ박하다 잃었었던 자본 고고 ㅌཕㄹ ཕཕཕཕ43,2025-11-23T15:32:02
dcinside_남자연예인_갤러리,은저씨 아들 눈썹 연하게 그려봐,눈썹문신 1일차 같긔,은저씨 아들 눈썹 연하게 그려봐 눈썹문신 1일차 같긔,2025-11-23T15:31:58
dcinside_남자연예인_갤러리,여갈이가 뭔 강철멘탈이야,ㅡㅡ,여갈이가 뭔 강철멘탈이야 ㅡㅡ,2025-11-23T15:31:53
dcinside_남자연예인_갤러리,무용처음엔 금수저 학벌세탁용으로 입문하더라도,하다보면 진심 아니면 못버티기 다 무용에 진심 돼서 자부심 개쩜,무용처음엔 금수저 학벌세탁용으로 입문하더라도 하다보면 진심 아니면 못버티기 다 무용에 진심 돼서 자부심 개쩜,2025-11-23T15:31:39
dcinside_남자연예인_갤러리,솔직히 뿡이브 잦돌앰 입장에선 뉴트남 오는게 좋음,곰자매년들 지들이 뿡이브 공주님 ㅇㅈㄹ하면서 잦돌이랑 다였는거 개토나왓음,솔직히 뿡이브 잦돌앰 입장에선 뉴트남 오는게 좋음 곰자매년들 지들이 뿡이브 공주님 ㅇㅈㄹ하면서 잦돌이랑 다였는거 개토나왓음,2025-11-23T15:31:33
dcinside_남자연예인_갤러리,뉴트남 제발 3명다 안받으면좋겠긔,웅,뉴트남 제발 3명다 안받으면좋겠긔 웅,2025-11-23T15:31:32
dcinside_남자연예인_갤러리,피아노 바이올린 슨상들도 무서움?,예고슨상들은 걍 다 무서운가,피아노 바이올린 슨상들도 무서움? 예고슨상들은 걍 다 무서운가,2025-11-23T15:31:24
dcinside_남자연예인_갤러리,코아픈 앰들 쌓인게 터진거네,ㅇㅇ,코아픈 앰들 쌓인게 터진거네 ㅇㅇ,2025-11-23T15:31:24
dcinside_남자연예인_갤러리,발레도 돈 못 벌긔?,무용 다 비슷비슷한가,발레도 돈 못 벌긔? 무용 다 비슷비슷한가,2025-11-23T15:31:20
dcinside_남자연예인_갤러리,은저씨아들은 영상으로 봐야돼ㅡㅡ,이 좆같은 대가리도 영상으로보면 잘생김..ㅇㅇ,은저씨아들은 영상으로 봐야돼ㅡㅡ 이 좆같은 대가리도 영상으로보면 잘생김..ㅇㅇ,2025-11-23T15:31:17
dcinside_남자연예인_갤러리,언니들 나 정신병원인데 딸배애미 사겼어,07 상판앰 완전 애기야,언니들 나 정신병원인데 딸배애미 사겼어 07 상판앰 완전 애기야,2025-11-23T15:30:59
dcinside_남자연예인_갤러리,족갈이보블보니까,좆습생들 더 쳐맞아야 되겠노 안쳐맞고 배우니까 그따구긔,족갈이보블보니까 좆습생들 더 쳐맞아야 되겠노 안쳐맞고 배우니까 그따구긔,2025-11-23T15:30:54
dcinside_남자연예인_갤러리,일족이는 짭승언 삼란이관데 성격이 존나 잦초딩이라니까,짭승언 삼란이는 조용충인데,일족이는 짭승언 삼란이관데 성격이 존나 잦초딩이라니까 짭승언 삼란이는 조용충인데,2025-11-23T15:30:51
dcinside_남자연예인_갤러리,여갈이 짤보고 든 생각은,곰자매랑 곰젖괴만 정병왔긔,여갈이 짤보고 든 생각은 곰자매랑 곰젖괴만 정병왔긔,2025-11-23T15:30:49
dcinside_남자연예인_갤러리,1.245 학치커로도 대리스워하는년 짹창에서 투다리로 대리스워하노,존나 티내 1.24 5 느악몽창 죄노애미 좆픈톡 알계 수십개 대리스워 하면서 지계정 잘라와서 스워함 크트 주로 쓰고 스크 쓸때 와파실수함 외퀴인척 알계 파서 조롱 알티 태움 앰코질 하다 음총팀 서포터 계정 만들거나 트럭 화환 총공계 만들어 분탕치고 사기침 능국애민척 주작글 쓰고 가저와서 중계하긔 꼭 지가 쓰고 가져오고 주작질만함. 짹창에 계정 수백개로 외퀴인척 경괴 쳐패고 지새끼 알티 노동하면서 투다리 컴백만 하면 외퀴 계정 터트림 개년들 맠신영 애미년,1.245 학치커로도 대리스워하는년 짹창에서 투다리로 대리스워하노 존나 티내 1.24 5 느악몽창 죄노애미 좆픈톡 알계 수십개 대리스워 하면서 지계정 잘라와서 스워함 크트 주로 쓰고 스크 쓸때 와파실수함 외퀴인척 알계 파서 조롱 알티 태움 앰코질 하다 음총팀 서포터 계정 만들거나 트럭 화환 총공계 만들어 분탕치고 사기침 능국애민척 주작글 쓰고 가저와서 중계하긔 꼭 지가 쓰고 가져오고 주작질만함. 짹창에 계정 수백개로 외퀴인척 경괴 쳐패고 지새끼 알티 노동하면서 투다리 컴백만 하면 외퀴 계정 터트림 개년들 맠신영 애미년,2025-11-23T15:30:44
dcinside_남자연예인_갤러리,여갈이는 진짜 아무것도 몰라 걍 하라는대로 하는거긔,자기일에는 독기 있는데 세상 돌아가는거 좆도모름 강철멘탈이라 좆돌하기엔 좋을거긔,여갈이는 진짜 아무것도 몰라 걍 하라는대로 하는거긔 자기일에는 독기 있는데 세상 돌아가는거 좆도모름 강철멘탈이라 좆돌하기엔 좋을거긔,2025-11-23T15:30:33
dcinside_남자연예인_갤러리,근데 체육하던 좆간들 체질적으로 좀 비슷한거있어,좀 서열충에 노력 독기부심있고 이런거 비슷하긔 띠닌 능잦인 틀케도 이래서 신기했긔,근데 체육하던 좆간들 체질적으로 좀 비슷한거있어 좀 서열충에 노력 독기부심있고 이런거 비슷하긔 띠닌 능잦인 틀케도 이래서 신기했긔,2025-11-23T15:30:09
dcinside_남자연예인_갤러리,무용 돈들여서 하는이유가머노,막상 돈안되잖아,무용 돈들여서 하는이유가머노 막상 돈안되잖아,2025-11-23T15:29:58
dcinside_남자연예인_갤러리,느릴라크트 하나가 아까부터 계속 섹호글 싸고있긔,앰코까지하면서,느릴라크트 하나가 아까부터 계속 섹호글 싸고있긔 앰코까지하면서,2025-11-23T15:29:58
dcinside_남자연예인_갤러리,관계성 좆망한 울숙씨들이 좆코네 이간질하는거,누가몰라,관계성 좆망한 울숙씨들이 좆코네 이간질하는거 누가몰라,2025-11-23T15:29:56
dcinside_남자연예인_갤러리,률옵 대체 어떤 사랑을 하신거노,짜증나,률옵 대체 어떤 사랑을 하신거노 짜증나,2025-11-23T15:29:48
dcinside_남자연예인_갤러리,1. . 245잦돌 다패는년이 맠신영 병신춤만 올려치네,맠신영 보블하는년,1. . 245잦돌 다패는년이 맠신영 병신춤만 올려치네 맠신영 보블하는년,2025-11-23T15:29:47
dcinside_남자연예인_갤러리,족까 아역도 하지 않았나,키즈좆델이었나? 암튼 무용충에 어릴때부터 좆예계 들어간거보면 머장부 안될수가 없긴하노 앰앱도 ㅈㄴ빡셀듯,족까 아역도 하지 않았나 키즈좆델이었나? 암튼 무용충에 어릴때부터 좆예계 들어간거보면 머장부 안될수가 없긴하노 앰앱도 ㅈㄴ빡셀듯,2025-11-23T15:29:46
dcinside_남자연예인_갤러리,좆코네 관계성으로 빨리니까 심술난 분들이 패시는듯,그럴만한 곳 딱 하나 떠오르긴해,좆코네 관계성으로 빨리니까 심술난 분들이 패시는듯 그럴만한 곳 딱 하나 떠오르긴해,2025-11-23T15:29:40
dcinside_남자연예인_갤러리,일족이같은년은 성격이 좀 수즙음많고 조용충이어야,시녀붙는데 일족이 존나 깝치는ㅌㅊ야 순메랑 비슷함,일족이같은년은 성격이 좀 수즙음많고 조용충이어야 시녀붙는데 일족이 존나 깝치는ㅌㅊ야 순메랑 비슷함,2025-11-23T15:29:29
dcinside_남자연예인_갤러리,우주봊은 무을이롤 없어서 문제였나,죄다 기만 세가지고,우주봊은 무을이롤 없어서 문제였나 죄다 기만 세가지고,2025-11-23T15:29:19
dcinside_남자연예인_갤러리,뉴트남오면 뿡이브 로이전쟁통될듯,지금도 짹창 뉴곰스워 또 존나심해졌던데 저년들 4년간 얼마나쳐싸울지,뉴트남오면 뿡이브 로이전쟁통될듯 지금도 짹창 뉴곰스워 또 존나심해졌던데 저년들 4년간 얼마나쳐싸울지,2025-11-23T15:29:14
dcinside_남자연예인_갤러리,운지학 섹호가 싸워봤자 느릴라에선 절친수준이니깐,그만해,운지학 섹호가 싸워봤자 느릴라에선 절친수준이니깐 그만해,2025-11-23T15:29:11
dcinside_남자연예인_갤러리,뎅기열이랑 발삼이 두잇 췄다,기대돼,뎅기열이랑 발삼이 두잇 췄다 기대돼,2025-11-23T15:29:00
dcinside_남자연예인_갤러리,여갈이 유일하게 광고 스케 혼자만 뛰었음,회사 나가고서도ㅋㅋㅋ 러닝도 해서 노출시키고 보통 아님 그냥 내주변에 없엇으면함,여갈이 유일하게 광고 스케 혼자만 뛰었음 회사 나가고서도ㅋㅋㅋ 러닝도 해서 노출시키고 보통 아님 그냥 내주변에 없엇으면함,2025-11-23T15:28:59
dcinside_남자연예인_갤러리,뿡턱앰 커엽다,워보닮음,뿡턱앰 커엽다 워보닮음,2025-11-23T15:28:40
dcinside_남자연예인_갤러리,투투경 족2 뉴트남 다 면요리증후군이노,ㅇ,투투경 족2 뉴트남 다 면요리증후군이노 ㅇ,2025-11-23T15:28:34
dcinside_남자연예인_갤러리,한국무용 3명 동반유학한거 어디학교야?,머학생임?,한국무용 3명 동반유학한거 어디학교야? 머학생임?,2025-11-23T15:28:27
dcinside_남자연예인_갤러리,일족이 이족이한테도 인기 밀리는 이유가 있었노,시녀자석상인데 입이 많이 가볍군아,일족이 이족이한테도 인기 밀리는 이유가 있었노 시녀자석상인데 입이 많이 가볍군아,2025-11-23T15:28:22
dcinside_남자연예인_갤러리,좆예인들 면요리 금지시키시긔,모든참사는 면요리로일어나노,좆예인들 면요리 금지시키시긔 모든참사는 면요리로일어나노,2025-11-23T15:28:05
dcinside_남자연예인_갤러리,되돌아보니 여갈이가 ㄹㅇ 씹탑이었긔,냥부이 멘탈 ㅎㅌㅊ에 ㅈㄴ 른른한 년이었고,되돌아보니 여갈이가 ㄹㅇ 씹탑이었긔 냥부이 멘탈 ㅎㅌㅊ에 ㅈㄴ 른른한 년이었고,2025-11-23T15:28:04
dcinside_남자연예인_갤러리,저 크트병신은 느릴라크트니까 먹금해,어휴,저 크트병신은 느릴라크트니까 먹금해 어휴,2025-11-23T15:28:03
dcinside_남자연예인_갤러리,섹호 그래도 슨타성 조금 생겼어,띤갤련들 아무도 관심안줬는데,섹호 그래도 슨타성 조금 생겼어 띤갤련들 아무도 관심안줬는데,2025-11-23T15:28:02
dcinside_남자연예인_갤러리,라방에 멤버들 안들어오면 오라고 톡 보내는,그런 기개가 있어야함,라방에 멤버들 안들어오면 오라고 톡 보내는 그런 기개가 있어야함,2025-11-23T15:27:52
dcinside_남자연예인_갤러리,국악 한국무용 이런게 특히 더 심하댔긔,왜지,국악 한국무용 이런게 특히 더 심하댔긔 왜지,2025-11-23T15:27:51
dcinside_남자연예인_갤러리,여갈이는 복귀할거같긔 봊돌 샐럽 포기할련이아니셔,해맑게웃는거 찐독기야 ㄹㅇ,여갈이는 복귀할거같긔 봊돌 샐럽 포기할련이아니셔 해맑게웃는거 찐독기야 ㄹㅇ,2025-11-23T15:27:29
dcinside_남자연예인_갤러리,무당일족1군인데 호모는 이족이사위인거,ㅈㄴ응냥 1군인데 사위가 측갑이인거ㅠ생각나서 웃창,무당일족1군인데 호모는 이족이사위인거 ㅈㄴ응냥 1군인데 사위가 측갑이인거ㅠ생각나서 웃창,2025-11-23T15:27:22
dcinside_남자연예인_갤러리,근데 섹호 라방엔 멤버들이 안오긔,친하지 않은건 팩트 그냥 딱 비지니스임,근데 섹호 라방엔 멤버들이 안오긔 친하지 않은건 팩트 그냥 딱 비지니스임,2025-11-23T15:27:21
dcinside_남자연예인_갤러리,근데 뉴트남 뭘이기라는거야?,이미패소했는데 뭐로 이기라고,근데 뉴트남 뭘이기라는거야? 이미패소했는데 뭐로 이기라고,2025-11-23T15:27:19
dcinside_남자연예인_갤러리,무용슨상들은 작대기로 팰것같고 악기슨상들은 악보로,팰것같아서 무서워,무용슨상들은 작대기로 팰것같고 악기슨상들은 악보로 팰것같아서 무서워,2025-11-23T15:27:16
dcinside_남자연예인_갤러리,갈개 3년전에 나간 켈리클락슨쇼 영범 솔로18년만에 출연해놓고,쌀국서 솔로 ㅈㄴ 잘나가는척 언플 오지노 ㅋㅋ 코첼라도 메주가 나갈건데 영범이 대신 나간다고 쌀국언냐들 열불낫긔,갈개 3년전에 나간 켈리클락슨쇼 영범 솔로18년만에 출연해놓고 쌀국서 솔로 ㅈㄴ 잘나가는척 언플 오지노 ㅋㅋ 코첼라도 메주가 나갈건데 영범이 대신 나간다고 쌀국언냐들 열불낫긔,2025-11-23T15:27:12
dcinside_남자연예인_갤러리,우동사리ㅋㅋㅋㅋㅋ 태어나서 한번도 안 씀,ㄹㅇ 실제로 쓰는 좆간이 있었노 저급해,우동사리ㅋㅋㅋㅋㅋ 태어나서 한번도 안 씀 ㄹㅇ 실제로 쓰는 좆간이 있었노 저급해,2025-11-23T15:27:09
dcinside_남자연예인_갤러리,언냐들 죄범이네 와꾸 잘나온거로 다시 올려줄게,순서대로 은저씨 새깅잦 운친 임 셋다 ㄱㅊ은데 ㅡㅡ,언냐들 죄범이네 와꾸 잘나온거로 다시 올려줄게 순서대로 은저씨 새깅잦 운친 임 셋다 ㄱㅊ은데 ㅡㅡ,2025-11-23T15:27:06
dcinside_남자연예인_갤러리,와 좆코네 친해보였는데 자적자 좆되노,섹호 불쌍해,와 좆코네 친해보였는데 자적자 좆되노 섹호 불쌍해,2025-11-23T15:26:50
dcinside_남자연예인_갤러리,한무는 분위기 살벌하긔?,?,한무는 분위기 살벌하긔? ?,2025-11-23T15:26:37
dcinside_남자연예인_갤러리,캄보디아 태자 그룹 싱가폴에서 자동차 대출 회사 운영,했노 캄보디아 회사 따위가 싱가폴에서 어떻게 대출 회사를 운영하지,캄보디아 태자 그룹 싱가폴에서 자동차 대출 회사 운영 했노 캄보디아 회사 따위가 싱가폴에서 어떻게 대출 회사를 운영하지,2025-11-23T15:26:31
